{"taxa": [{"scientific_name": "protium spruceanum (benth.) engl", "compounds": ["\u03b1-amirina", "amirina", "\u03b2-cariofileno", "\u03b2-amirina", "quercetina", "sabineno", "procianidina", "catequina", "linoleato de metila"], "accepted_name": "Protium spruceanum", "accepted_species": "Protium spruceanum", "accepted_genus": "Protium", "inchi_keys": {}, "inchi_key_simps": {}}], "text": "Journal of Biotechnology and Biodiversity | v.9 | n.1 | 2021 Journal of Biotechnology and Biodiversity journal homepage: https://sistemas.uft.edu.br/periodicos/index.php/JBB/index \u00a9 2020 Journal of Biotechnology and Biodiversity ISSN: 2179-4804 DOI: https://doi.org/10.20873/jbb.uft.cemaf.v9n1.menezesfilho 48 Avalia\u00e7\u00e3o fitoqu\u00edmica, f\u00edsico-qu\u00edmica e atividades antioxidante, hemot\u00f3xi-ca e antibacteriana do extrato de Protium spruceanum (Benth.) Engl Antonio Carlos Pereira de Menezes Filhoa* , Mariana Chaves Santos a , Carlos Frederico de Souza Castro a a Instituto Federal Goiano, Campus Rio Verde, Goi\u00e1s, Brasil * Autor correspondente (astronomoamadorgoias@gmail.com) I N F O A B S T R A C T Keywords Protium spruceanum Screening phytochemical; Escherichia coli; Staphylococcus aureus Phytochemical, physicochemical evaluation and antioxidant, hemotoxic and antibacterial activities of the extract from Protium spruceanum (Benth.) Engl. Protium spruceanum is one 146 species in the genus Protium. It\u2019s considered medicinal plant by the field and scientific population. The objective this study was evaluates the phytochemistry, physicochemical and antioxidant, hemotoxic and antibacterial activities of the hydroethanolic extract from P. spruceanum resin. It\u00b4s noteworthy the results presented this study, showed numerous phytochemicals class with positive results, soluble solids with 1.15%, refractive index of 1.584, pH of 5.63, relative density of 0.9517 g mL-1 20 \u00b0C, IC50 of 275.14 \u00b5g mL-1 of DPPH, total phenolics of 9.96 mg GAE 100 g-1, and yield of 6.61%. Positive hemolytic activity, and in particular, efficiency in antibacterial activity with inhibition halos from 19.13 mm Staphylococcus aureus, 14.07 mm Salmonella typhimurium, and 17.51 mm Salmonella enteritidis, and low inhibition Escherichia coli 9.18 mm. The hydroethanolic extract of Protium spruceanum resin showed exceptional results as an antioxidant and antibacterial agent. R E S U M O Palavras-chaves Protium spruceanum Prospec\u00e7\u00e3o fotoqu\u00edmica Escherichia coli Staphylococcus aureus Protium spruceanum \u00e9 uma das 146 esp\u00e9cies do g\u00eanero Protium, considerada como medicinal pela popula\u00e7\u00e3o do campo e no meio cient\u00edfico. O objetivo deste estudo foi avaliar a fitoqu\u00edmica, f\u00edsico-qu\u00edmica e as atividades antioxidantes, hemot\u00f3xica e antibacteriana do extrato hidroetan\u00f3lico da resina de P. spruceanum. Destaca-se que os resultados apresentados neste estudo apresentaram in\u00fameras classes fitoqu\u00edmicas com resultados positivos, s\u00f3lidos sol\u00faveis com 1,15%, \u00edndice de refra\u00e7\u00e3o de 1,584, pH de 5,63, densidade relativa de 0,9517 g mL-1 20 \u00b0C, CI50 de 275,14 \u00b5g mL-1 de DPPH, fen\u00f3licos totais de 9,96 mg EAG 100 g-1, e rendimento de 6,61%. Atividade hemol\u00edtica positiva, em especial, efici\u00eancia na atividade antibacteriana com halos de inibi\u00e7\u00e3o de 19,13 mm para Staphylococcus aureus, de 14,07 mm para Salmonella typhimurium, e de 17,51 mm para Salmonella enteritidis, e baixa inibi\u00e7\u00e3o para Escheri-chia coli de 9,18 mm. O extrato hidroetan\u00f3lico da resina de Protium spruceanum demonstrou resultados excepcionais como agente antioxidante e antibacteriano. Received 09 September 2020; Received in revised from 11 November 2020; Accepted 24 January 2021 Menezes Filho / Journal of Biotechnology and Biodiversity / v.9 n.1 (2021) 048-059 \u00a9 2020 Journal of Biotechnology and Biodiversity ISSN: 2179-4804 DOI: https://doi.org/10.20873/jbb.uft.cemaf.v9n1.menezesfilho 49 INTRODU\u00c7\u00c3O A fam\u00edlia Burseraceae \u00e9 formada exclusivamente por esp\u00e9cies arbor\u00edcolas e arbustos em \u00e1reas tropicais da Am\u00e9rica do Sul, Mal\u00e1sia e \u00c1frica. O g\u00eanero Protium Burm. f. apresenta aproximadamente cerca de 146 esp\u00e9cies, deste total, nove s\u00e3o neotropicais. A grande maioria das esp\u00e9cies habita \u00e1reas de sub-bosque na floresta \u00famida prim\u00e1ria e em terra firme (Machado et al., 2003; Vieira et al., 2010). O principal centro de diversidade est\u00e1 no bioma Amaz\u00f4nico onde s\u00e3o identificadas 73 esp\u00e9cies, sendo 42 end\u00eamicas dessa regi\u00e3o. A esp\u00e9cie Protium spruceanum (Benth.) Engler, apresenta porte arb\u00f3reo com dossel, ou arb\u00f3rea secund\u00e1ria, seletiva higr\u00f3fita e com s\u00edndromes de entomofilia e ornitocoria, onde alguns indiv\u00edduos foram registrados em estudo apresentando altura de 20 metros. Entre a popula\u00e7\u00e3o, a esp\u00e9cie \u00e9 conhecida por \u201cbreu-branco, amescla, almecegueira ou resina mesca\u201d. O auge das infloresc\u00eancias s\u00e3o nos meses de setembro a novembro com frutifica\u00e7\u00e3o entre outubro a mar\u00e7o; os frutos s\u00e3o do tipo baga subglobosa, de superf\u00edcie lisa e brilhante, com colora\u00e7\u00e3o avermelhado, contendo de 1 a 2 sementes cinzentas envoltas por arilo fino, carnudo e adocicado. Pode ocorrer deposi\u00e7\u00e3o de resina na \u00e1rea externa do fruto. Naturalmente, os frutos servem de alimento para p\u00e1ssaros, que promovem a dispers\u00e3o (zooc\u00f3rica) (Vieira et al., 2010). De acordo com Vieira e Carvalho (2008), a esp\u00e9cie \u00e9 utilizada em \u00e1reas de reflorestamento heterog\u00eaneo destinado a recupera\u00e7\u00e3o da vegeta\u00e7\u00e3o de \u00e1reas ciliares degradadas. P. spruceanum \u00e9 encontrado al\u00e9m do bioma Amaz\u00f4nico, na Mata Atl\u00e2ntica e no dom\u00ednio Cerrado principalmente no estado de Goi\u00e1s. Alguns estudos apresentam diversidade ecol\u00f3gica nos estados de Minas Gerais, algumas \u00e1reas dos estados da Bahia, Mato Grosso do Sul e S\u00e3o Paulo, em \u00e1reas de florestas tropicais, de matas ciliares, em ambientes rip\u00e1rios e em \u00e1reas de brejo (Oliveira Filho; Ratter, 1995; Fajardo et al., 2009). A esp\u00e9cie \u00e9 arom\u00e1tica, com resina oleosa, que quando encontra o oxig\u00eanio do ambiente, cristaliza no tronco apresentando colora\u00e7\u00e3o esbranqui\u00e7ada. A resina apresenta uso fitoter\u00e1pico no tratamento dos sintomas da gripe, na analgesia, como cicatrizante e expectorante, bem como \u00e9 utilizada na ind\u00fastria de vernizes, na calafetagem, e como flavorizante na ind\u00fastria de perfumaria (Machado et al., 2003). Os vegetais produzem naturalmente compostos pertencentes aos metab\u00f3litos secund\u00e1rios, apresentando in\u00fameras a\u00e7\u00f5es biol\u00f3gicas, sendo amplamente estudados pelas ind\u00fastrias farmac\u00eautica, agr\u00edcola e de biotecnologia. Os metab\u00f3litos secund\u00e1rios apresentam em in\u00fameros estudos, importantes atividades com valor comercial. O estudo fitoqu\u00edmico preliminar tem um grande papel para o conhecimento das classes constituintes nas esp\u00e9cies vegetais, onde ap\u00f3s a identifica\u00e7\u00e3o, inicia o processo de extra\u00e7\u00e3o de determinadas classes de maior interesse (Sim\u00f5es; De Almeida, 2015). A resina \u00e9 um dos compostos desse metabolismo, apresentando em sua constitui\u00e7\u00e3o a \u03b1- e \u03b2-amirinas (Rodrigues et al., 2013), sabineno e \u03b2-cariofileno como compostos majorit\u00e1rios nos \u00f3leos essenciais das folhas, resina e galhos (Machado et al., 2003). O extrato etan\u00f3lico dos galhos apresenta importante a\u00e7\u00e3o antimicrobiana, testada em 19 isolados de bact\u00e9rias patog\u00eanicas (Amparo et al., 2018). In\u00fameros extratos vegetais apresentam atividade antioxidante na redu\u00e7\u00e3o de radicais livres como o oxig\u00eanio singleto. Pessuto et al. (2009) apresentam que, extratos vegetais ricos em compostos fen\u00f3licos demonstram importante atividade antioxidante, atuando como sequestradores de radicais livres e como quelantes de metais. V\u00e1rios agentes oxidantes agem na deple\u00e7\u00e3o de biomol\u00e9culas, principalmente no DNA, podendo desencadear v\u00e1rios tipos de c\u00e2nceres, bem como est\u00e3o envolvidos nas doen\u00e7as de Parkinson e Alzheimer (Conde et al., 2017; Lemes et al., 2017; Zimmermann; Kirsten, 2008). Conforme Conde et al. (2017) os agentes antioxidantes podem atuar em m\u00faltiplos mecanismos biol\u00f3gicos, em depend\u00eancia do sistema de rea\u00e7\u00e3o ou fonte de radicais ou oxidante avaliado. Outros usos de import\u00e2ncia sobre o estudo de extratos vegetais \u00e9 na a\u00e7\u00e3o promotora da inibi\u00e7\u00e3o do crescimento de fungos, bact\u00e9rias e v\u00edrus que causam s\u00e9rios problemas tanto nos estudos de esp\u00e9cies vegetais de uso agr\u00edcola, como na produ\u00e7\u00e3o de fitof\u00e1rmacos no tratamento de doen\u00e7as f\u00fangicas, bacterianas e virais em humanos e animais. Visto que, v\u00e1rias bact\u00e9rias ao longo dos anos v\u00eam apresentando resist\u00eancia aos antibi\u00f3ticos comerciais, como Staphylococcus aureus, Staphylococcus epidermidis e Escherichia coli (Garc\u00eda et al., 2019). Na busca por novos fitof\u00e1rmacos ativos, vem sendo constantemente estudados como proposta de substitui\u00e7\u00e3o aos f\u00e1rmacos sint\u00e9ticos de refer\u00eancia que j\u00e1 n\u00e3o est\u00e3o apresentando efetiva atividade de inibi\u00e7\u00e3o. O estudo das esp\u00e9cies vegetais no Brasil, em especial no dom\u00ednio Cerrado vem como proposta, auxiliar no estudo fitoter\u00e1pico com alto potencial fitomedicinal encontrado nas in\u00fameras fitofisionomias desse ambiente natural. O trabalho teve por objetivo avaliar \u00e0 Menezes Filho / Journal of Biotechnology and Biodiversity / v.9 n.1 (2021) 048-059 \u00a9 2020 Journal of Biotechnology and Biodiversity ISSN: 2179-4804 DOI: https://doi.org/10.20873/jbb.uft.cemaf.v9n1.menezesfilho 50 fitoqu\u00edmica, f\u00edsico-qu\u00edmica e as atividades antioxidantes, hemot\u00f3xica e antibacteriana do extrato hidroetan\u00f3lico da resina de Protium spruceanum. MATERIAL E M\u00c9TODOS A resina foi coletada nas cascas dos troncos e de ra\u00edzes descobertas em indiv\u00edduos de P. spruceanum, com aux\u00edlio de uma faca inox. O material foi mantido em frasco pl\u00e1stico herm\u00e9tico resfriado em uma embalagem com isolamento t\u00e9rmico. A coleta foi realizada no m\u00eas de abril de 2020 em uma area de mata ciliar localizada no munic\u00edpio de Rio Verde \u2013 GO, Brasil, nas seguintes coordenadas geogr\u00e1ficas: 17\u00b042\u201959.5\u2019\u2019S 50\u00b053\u201927.3\u2019\u2019W. A \u00e1rea de coleta apresenta fitofisionomia de mata ciliar e brejo. A esp\u00e9cie foi identificada pelo MSc\u00ba Bi\u00f3logo Antonio Carlos Pereira de Menezes Filho. Uma exsicata foi herborizada e depositada no Herb\u00e1rio do laborat\u00f3rio de Sistem\u00e1tica Vegetal do IF Goiano, Campus Rio Verde, com o seguinte Voucher HRV 1015. A resina foi triturada em um processador de alimentos, obtendo-se assim um p\u00f3 fino e homog\u00eaneo. O extrato bruto hidroetan\u00f3lico foi obtido via turb\u00f3lise na propor\u00e7\u00e3o de 40 g do p\u00f3 para 200 mL de uma solu\u00e7\u00e3o hidroetan\u00f3lica 70% (v/v). O extrato permaneceu em um frasco \u00e2mbar em repouso na geladeira por 24 horas a 4 \u00b0C, sem presen\u00e7a de luz. Ap\u00f3s este per\u00edodo, o extrato foi transferido para um frasco Erlenmeyer e submetido a ondas de ultrassom, em banho de ultrassom (Eco-Sonics, Mod. Q3,0/40A), por 30 minutos em local ao abrigo da luz. O extrato foi novamente transferido para o frasco \u00e2mbar e armazenado na geladeira a 4 \u00b0C por 72 horas. Em seguida, o extrato bruto foi filtrado em papel de filtro. O sobrenadante foi concentrado em rotaevaporador rotativo \u00e0 press\u00e3o negativa (Fisatom, Mod. 801), at\u00e9 completa elimina\u00e7\u00e3o do \u00e1lcool et\u00edlico. Em seguida, foi congelado a -10 \u00b0C e posteriormente liofilizado. O extrato em p\u00f3 foi armazenado em frasco de vidro cor \u00e2mbar, identificado e mantido em geladeira a 4 \u00b0C at\u00e9 an\u00e1lises conforme descrito por Oliveira et al. (2014). Foram realizadas an\u00e1lises colorim\u00e9tricas e de precipita\u00e7\u00e3o para as classes de compostos fen\u00f3licos, a\u00e7\u00facares redutores, n\u00e3o redutores, taninos, flavonoides, antraquinonas, cumarinas, \u00e1cidos org\u00e2nicos, catequinas, ester\u00f3ides e triterpenos, saponinas espum\u00eddica e hemol\u00edtica, glicos\u00eddeos cardiot\u00f4nicos, duplas olef\u00ednicas, benzaquinonas, naftaquinonas e fenantraquinonas, alcaloides e deps\u00eddeos e depsidonas conforme descrito por Menezes Filho e Castro (2019), glicos\u00eddeos cianog\u00eanicos, conforme descrito por Rodrigues et al. (2009), polissacar\u00eddeos, purinas, resinas e sesquiterpenolactonas conforme descrito por Sim\u00f5es e De Almeida (2015). Os reagentes utilizados para os testes fitoqu\u00edmicos foram de grau (P.A \u2013 ACS) das marcas (Synth, Anidrol, Din\u00e2mica, Sigma-Aldrich, Alphatec, Vetec, Inlab, Cromoline, Neon, Isofar, Proqu\u00edmicos, \u00caxodo Cient\u00edfica, Qhemis, Quimex, Impex, LS Chemicals). Os resultados foram comparados com o grupo controle (branco). Para a intensidade da rea\u00e7\u00e3o foi utilizado teste de cruzes (+) fraco positivo, (++) moderado positivo e (+++) fortemente positivo, e (-) negativo (Oliveira et al., 2014). A determina\u00e7\u00e3o da atividade hemol\u00edtica seguiu conforme descrito por Ramos et al. (2020). Em tr\u00eas tubos Falcon c\u00f4nicos (Sarstedt) de 50 mL, foram acrescidos com 5 mL de solu\u00e7\u00e3o fisiol\u00f3gica NaCl concentra\u00e7\u00e3o 0,9% (Arboreto) e tr\u00eas tubos Falcon c\u00f4nicos como controle positivo contendo \u00e1gua destilada e sangue. O ensaio foi realizado nas seguintes concentra\u00e7\u00f5es 50; 100; 150; 250; 500; 750; 1000 \u00b5g mL-1 de extrato hidroetan\u00f3lico da resina de P. spruceanum. As amostras foram incubadas em temperatura de 25 \u00b0C em banho ultratermostatizado (Solab, Mod. SL 152-I) por 15 mim. Em seguida, as amostras foram centrifugadas (Solab, Mod. SL-700) a 3.000 RPM durante 20 minutos. Em seguida, o sobrenadante foi analizado em espectrofot\u00f4metro UV-Vis no comprimento de ondas em 540 nm em absorb\u00e2ncia, utilizando cubeta de quartzo com campo \u00f3ptico de 1 cm. O percentual hemol\u00edtico foi determinado com o Abs do controle positivo como 100%. O porcentual hemol\u00edtico foi determinado conforme equa\u00e7\u00e3o 3, proposta por Dacie et al. (1975). %Hem = (Absamostra)*100/(Abscontrole) Ap\u00f3s o ensaio hemol\u00edtico, foram realizadas imagens microsc\u00f3picas, utilizando microsc\u00f3pio \u00f3ptico (Global Optics, Mod. NO215B) com objetivas planacrom\u00e1tica 4, 10 e 40 X, e c\u00e2mera acoplada ao microsc\u00f3pio (GX) Full HD 30 FPS. Uma al\u00edquota de 20 \u00b5L mL-1 foi adicionado a 150 \u00b5L mL-1 do concentrado de hem\u00e1cias a 5%. O tempo foi avaliado em 5 e 10 minutos. Como controle negativo foi utilizado solu\u00e7\u00e3o de hem\u00e1cias a 5% e solu\u00e7\u00e3o hidroetan\u00f3lica 70%. Os par\u00e2metros organol\u00e9pticos e f\u00edsico-qu\u00edmicos para s\u00f3lidos totais e \u00edndice de refra\u00e7\u00e3o (Hanna Instruments, Mod. HI96800), foram avaliados conforme descrito por Dom\u00ednguez et al. (2019), e L\u00f3pez et al. (2019). O pH foi determinado atrav\u00e9s de um pHmetro digital de Menezes Filho / Journal of Biotechnology and Biodiversity / v.9 n.1 (2021) 048-059 \u00a9 2020 Journal of Biotechnology and Biodiversity ISSN: 2179-4804 DOI: https://doi.org/10.20873/jbb.uft.cemaf.v9n1.menezesfilho 51 bancada (Lucadena, Mod. 210-P), com uma al\u00edquota de 50 mL de extrato bruto. A densidade relativa foi determinada utilizando um picn\u00f4metro de 1 mL, conforme descrito por Alarc\u00f3n et al. (2019). O resultado foi expresso em g mL-1 a 20 \u00b0C. Uma varredura foi realizada entre os comprimentos de ondas 200 a 800 nm em espectrofot\u00f4metro UV-Vis (Bel Photonics, Mod. M-51) por absorb\u00e2ncia utilizando cubeta de quartzo a partir do extrato bruto 1 mL, afim de descrever as poss\u00edveis classes metab\u00f3licas presentes conforme descrito por Garc\u00eda et al. (2019). O rendimento de extrato seco bruto foi calculado conforme descrito por Alves et al. (2011). Calculado a partir da rela\u00e7\u00e3o da massa de extrato seco por massa da droga vegetal expresso em percentagem conforme equa\u00e7\u00e3o 1 (Balan\u00e7a anal\u00edtica, Marte, Mod. AW 220). \ud835\udc45\ud835\udc52\ud835\udc5b\ud835\udc51. (%) = (\ud835\udc54 \ud835\udc38\ud835\udc65\ud835\udc61 \ud835\udc46\ud835\udc52\ud835\udc50/\ud835\udc37\ud835\udc5f\ud835\udc5c\ud835\udc54 \ud835\udc49\ud835\udc52\ud835\udc54)\u2217 100 \ud835\udc38\ud835\udc5e. [1] Onde: g Ext Sec = (g) do extrato seco, g Drog Veg = (g) droga vegetal. A atividade redutora do radical livre, foi determinada utilizando 2\u20192-difenil-1-picrilhidrazil (DPPH \u2013 P.A - ACS) (Sigma-Aldrich), atrav\u00e9s do m\u00e9todo descrito por Conde et al. (2019). Em placa de 96 po\u00e7os, uma al\u00edquota de 75 \u00b5L mL-1 de amostra do extrato, foi adicionada com 150 \u00b5L mL-1 de uma solu\u00e7\u00e3o etan\u00f3lica de DPPH (100 \u00b5g mL-1). Em seguida, foi incubado a 25 \u00b0C por 60 minutos. Logo ap\u00f3s, a placa foi levada para um espectrofot\u00f4metro UV-Vis leitor de microplacas (Polaris, Mod. EE) no comprimento de ondas em 517 nm. Foi utilizada uma solu\u00e7\u00e3o etan\u00f3lica de \u00e1cido asc\u00f3rbico (P.A \u2013 ACS) (Synth, pureza de 99-100%) como controle positivo para redu\u00e7\u00e3o do radical DPPH (25 \u00b5g mL-1). A concentra\u00e7\u00e3o de inibi\u00e7\u00e3o (CI50) foi determinada atrav\u00e9s de sucessivas concentra\u00e7\u00f5es seriadas da amostra (5 a 1000 \u00b5g mL-1) atrav\u00e9s de uma an\u00e1lise de regress\u00e3o linear. Os resultados foram expressos em porcentagem de redu\u00e7\u00e3o do radical livre DPPH pelo extrato bruto da resina de P. spruceanum, conforme equa\u00e7\u00e3o 2. % \ud835\udc45\ud835\udc52\ud835\udc51. =\ud835\udc340 \u2212 \ud835\udc34\ud835\udc38\ud835\udc340\u2217 100 \ud835\udc38\ud835\udc5e. [2] Onde: A0 \u00e9 a solu\u00e7\u00e3o etan\u00f3lica de DPPH; e AE solu\u00e7\u00e3o hidroetan\u00f3lica do extrato resinoso + solu\u00e7\u00e3o de DPPH. Os compostos fen\u00f3licos totais foram determinados pelo m\u00e9todo de Folin-Ciocalteu (P.A \u2013 ACS) (Sigma-Aldrich, pureza de 98%) conforme descrito por Fern\u00e1ndez et al. (2017). A solu\u00e7\u00e3o de Folin-Ciocalteu foi preparada a partir de 10 mL do reativo, dilu\u00eddo em 100 mL de \u00e1gua destilada. Em seguida, foi preparada uma solu\u00e7\u00e3o aquosa de carbonado de s\u00f3dio anidro (P.A \u2013 ACS) (Din\u00e2mica, pureza 98-100%) na concentra\u00e7\u00e3o 7,5% (m/v). Uma curva padr\u00e3o foi preparada com 500 mg de \u00e1cido g\u00e1lico (P.A \u2013 ACS) (Din\u00e2mica, pureza de 98-100%). Em seguida, foi dissolvido em 20 mL de \u00e1gua destilada. A solu\u00e7\u00e3o foi transferida para um bal\u00e3o volum\u00e9trico de 50 mL, completado com \u00e1gua destilada. A partir da solu\u00e7\u00e3o estoque, em bal\u00e3o volum\u00e9trico de 100 mL, al\u00edquotas entre 1 a 5 mL foram transferidas, e em seguida, acrescidas com \u00e1gua destilada. As dilui\u00e7\u00f5es correspondem as seguintes concentra\u00e7\u00f5es 10, 20, 30, 40 e 50 mg 100 mL-1 expresso em equivalente ao \u00e1cido g\u00e1lico (EAG). Em tubos de ensaios, foram adicionados 200 \u00b5L mL-1 do extrato, com 10 mL da solu\u00e7\u00e3o aquosa de Folin-Ciocalteu e 1,8 mL de \u00e1gua destilada. A solu\u00e7\u00e3o foi agitada por 10 segundos em Vortex (Prolab), e deixada em descanso por 5 minutos em local protegido da luz. Logo ap\u00f3s, foi adicionado 8 mL da solu\u00e7\u00e3o aquosa de carbonado de s\u00f3dio 7,5%, e em seguida, agitado em Vortex por 1 minuto. As amostras foram mantidas em local escuro por 1 hora. Em seguida, foi realizada a leitura em espectrofot\u00f4metro UV-Vis (Bel Photonics, Mod. M-51) no comprimento de ondas em 765 nm. O mesmo foi realizado para as solu\u00e7\u00f5es da curva padr\u00e3o. A atividade antibacteriana foi realizada conforme descrito por Fern\u00e1ndez et al. (2017). Foram utilizadas culturas de bact\u00e9rias dos g\u00eaneros Staphylococcus aureus ATCC 9891, Salmonella sorovar Typhimurium ATCC 14028, Salmonella sorovar Enteritidis ATCC 13076 e Escherichia coli ATCC 8739. As bact\u00e9rias foram doadas pelo banco gen\u00e9tico de microorganismos da Universidade Federal de Goi\u00e1s \u2013 UFG, Campus Samambaia, Goi\u00e2nia, Goi\u00e1s, Brasil. Inicialmente col\u00f4nias foram suspendidas em 50 mL de uma solu\u00e7\u00e3o aquosa de caldo peptona bacteriol\u00f3gica (PB \u2013 Kasvi) em frasco Erlenmeyer 125 mL esterilizado. E logo em seguida, incubado a 36 \u00b0C, por 48 horas (SolidSteel, Mod. SSD). Ap\u00f3s fase de crescimento, al\u00edquotas de 5 mL foram coletadas e distribu\u00eddas em placas de Petri contendo meio \u00c1gar Contagem de Placas (ACP - Kasvi) esterilizado, e homogeneizadas com aux\u00edlio de uma al\u00e7a de Drigalski ap\u00f3s flambagem. As placas foram incubadas a 36 \u00b0C por 24 horas. Foram selecionadas cinco col\u00f4nias coletadas com uma al\u00e7a de platina flambada, e transferiu-se para Erlenmeyers de 125 mL contendo 50 mL de Menezes Filho / Journal of Biotechnology and Biodiversity / v.9 n.1 (2021) 048-059 \u00a9 2020 Journal of Biotechnology and Biodiversity ISSN: 2179-4804 DOI: https://doi.org/10.20873/jbb.uft.cemaf.v9n1.menezesfilho 52 caldo peptona bacteriol\u00f3gica, em seguida foram incubados entre 35 a 37 \u00b0C por 24 a 36 horas em incubadora com agita\u00e7\u00e3o orbital a 100 rpm, at\u00e9 obter turbidez adequada conforme a escala 0.5 de McFarland. Ap\u00f3s determina\u00e7\u00e3o da turbidez ideal, entre 1 a 2 x 108 UFC mL-1 uma al\u00edquota de 5 mL foi coletada e transferida para placas de Petri contendo meio ACP. Em seguida, a solu\u00e7\u00e3o foi homogeneizada com al\u00e7a de Drigalski ap\u00f3s flambagem. A avalia\u00e7\u00e3o da atividade antimicrobiana foi realizada atrav\u00e9s do m\u00e9todo de difus\u00e3o em po\u00e7os. Na placa de Petri foram realizados pequenos po\u00e7os com 9 mm de di\u00e2metro na superf\u00edcie do meio. Em cada placa foram realizados 4 po\u00e7os, onde foi aplicado 100 \u00b5L mL-1 para o 1\u00ba po\u00e7o: Ciprofloxacina 500 mg (La Sant\u00e9), como controle positivo, no 2\u00ba po\u00e7o: Azitromicina 500 mg (Eurofarma), como controle positivo, no 3\u00ba po\u00e7o: \u00e1gua destilada est\u00e9ril como controle negativo, e no 4\u00ba po\u00e7o: extrato hidroetan\u00f3lico da resina de P. spruceanum na concentra\u00e7\u00e3o de 20% (m/v). Os controles positivos foram dilu\u00eddos em 50 mL de \u00e1gua destilada est\u00e9ril na seguinte concentra\u00e7\u00e3o (500 mg 100 mL-1). Ap\u00f3s a aplica\u00e7\u00e3o, as placas foram mantidas por 30 minutos em c\u00e2mara de fluxo laminar a 25 \u00b0C, e em seguida incubadas a 37 \u00b0C por 24 a 36 horas. Ap\u00f3s este per\u00edodo, a leitura foi realizada utilizando paqu\u00edmetro digital (Digimess, Mod. 100.174NL, resolu\u00e7\u00e3o de 0,01 mm/.0005\u201d com erro de 0,001 mm), e o di\u00e2metro do halo da zona de inibi\u00e7\u00e3o determinado, considerando o di\u00e2metro do orif\u00edcio. Todos os ensaios foram realizados em triplicata, seguido de \u00b1 desvio padr\u00e3o. O software estat\u00edstico utilizado foi o PAST 3 (vers\u00e3o livre, 2019). RESULTADOS E DISCUSS\u00c3O A resina de P. spruceanum foi coletada em 10 indiv\u00edduos, apresentando colora\u00e7\u00e3o natural branca, sendo produzida nas ra\u00edzes, tronco e galhos, exalando aroma natural no ambiente circundante aos indiv\u00edduos na \u00e1rea de mata de galeria natural, sendo esta, caracter\u00edstica da presen\u00e7a desta esp\u00e9cie. Os indiv\u00edduos de P. spruceanum coletados neste estudo no m\u00eas de abril, coincidiram com o per\u00edodo de frutifica\u00e7\u00e3o para este ambiente de Cerrado goiano. J\u00e1 Vieira e Carvalho (2008) descrevem o per\u00edodo de frutifica\u00e7\u00e3o entre outubro a mar\u00e7o para P. spruceanum. No estudo de Vieira et al. (2010) os pesquisadores discutem sobre o pico de frutifica\u00e7\u00e3o ser no m\u00eas de novembro coincidindo com o per\u00edodo chuvoso, que aumenta a taxa de germina\u00e7\u00e3o. Na figura 1, est\u00e1 apresentado um indiv\u00edduo de P. spruceanum, com produ\u00e7\u00e3o do exsudato (resi-na) em uma raiz descoberta em ambiente de Cer-rado natural. Figura 1 - (A) Ra\u00edz descoberta naturalmente de P. spruceanum com exsudato (resina) em cor branca. A partir do per\u00edodo chuvoso foram obtidas quantidades significativas de resina cerca de 35 g atrav\u00e9s do processo de escarifica\u00e7\u00e3o, sendo cole-tada a partir das ra\u00edzes descobertas (Figura 1), e dos troncos. Entretanto, a resina pode ser coletada em qualquer per\u00edodo do ano, principalmente na \u00e9poca de chuva, onde o vegetal produz maior con-te\u00fado de exsudato (Figura 1). Na tabela 1, est\u00e3o apresentados os par\u00e2metros f\u00edsico-qu\u00edmicos e bioativos a partir do extrato hidroetan\u00f3lico da resina de P. spruceanum. Tabela 1 - Caracter\u00edsticas f\u00edsico-qu\u00edmicas e bioativas do extrato hidroetan\u00f3lico da resina de P. spruceanum. Par\u00e2metros EHR* Caracter\u00edsticas organol\u00e9pticas L\u00edquido marrom cristalino, arom\u00e1tico resinoso, l\u00edmpido, n\u00e3o oleoso ao tato. S\u00f3lidos sol\u00faveis (%) 1,15 \u00b1 0,06 \u00cdndice de refra\u00e7\u00e3o 1,584 \u00b1 0,08 pH 5,63 \u00b1 0,01 Densidade relativa (g mL-1) 20 \u00b0C 0,9517 \u00b1 0,01 DPPH CI50 (\u00b5g mL-1) 275,14 \u00b1 0,13 Compostos fen\u00f3licos totais (mg EAG 100 g-1) 9,96 \u00b1 0,13 Rendimento de extrato seco (%) 6,61 \u00b1 0,19 *EHR = Extrato hidroetan\u00f3lico da resina de P. spruceanum. Menezes Filho / Journal of Biotechnology and Biodiversity / v.9 n.1 (2021) 048-059 \u00a9 2020 Journal of Biotechnology and Biodiversity ISSN: 2179-4804 DOI: https://doi.org/10.20873/jbb.uft.cemaf.v9n1.menezesfilho 53 As caracter\u00edsticas organol\u00e9pticas para o extrato bruto hidroetan\u00f3lico apresentou-se como um l\u00ed-quido marrom cristalino, arom\u00e1tico resinoso, l\u00edm-pido, n\u00e3o oleoso ao tato. O conte\u00fado de s\u00f3lidos sol\u00faveis totais foi de 1,15% (Tabela 1). Os s\u00f3lidos sol\u00faveis totais representam o conte\u00fado de material org\u00e2nico vol\u00e1til e inorg\u00e2nico da solu\u00e7\u00e3o de extra-to. Outros estudos avaliando extratos, em diversas esp\u00e9cies vegetais, como no estudo de L\u00f3pez et al. (2019) os pesquisadores encontraram resultado para s\u00f3lidos totais de 1,03% para 100 mL do ex-trato aquoso da semente de Swietenia humilis. O extrato de P. spruceanum demonstrou ser fracamente \u00e1cido com pH de 5,63 (Tabela 1). O pH varia conforme o extrato vegetal de in\u00fameras plantas. Dom\u00ednguez et al. (2019) encontraram pH de 6,19 para o extrato etan\u00f3lico das folhas, e de 6,33 para o extrato dos bulbos de Allium schoeno-prasum. O pH levemente \u00e1cido em extratos, pode estar relacionado a classe de compostos de nature-za fen\u00f3lica (Dom\u00ednguez et al., 2019). O extrato hidroetan\u00f3lico da resina de P. spruceanum apre-sentou densidade relativa de 0,9517 g mL-1 con-forme observa-se na (Tabela 1). O extrato apresen-tou efetiva e especial atividade antioxidante na redu\u00e7\u00e3o do radical livre DPPH, com CI50 de 275,14 \u00b5g mL-1 (Tabela 1). Em v\u00e1rios estudos, \u00e9 poss\u00edvel verificar que ex-tratos vegetais apresentam bons resultados antio-xidantes na redu\u00e7\u00e3o do radical livre, inclusive atrav\u00e9s do modelo DPPH amplamente avaliado. Comparando com outros extratos vegetais, Conde et al. (2019), avaliaram o extrato etan\u00f3lico de pi-ment\u00e3o (Capsicum annum), onde os pesquisadores obtiveram atividade antioxidante com CI50 de 343,00 \u00b5g mL-1 na redu\u00e7\u00e3o do radical DPPH. Os compostos fen\u00f3licos totais foram de 9,96 mg EAG 100 g-1 de resina (Tabela 1). O conte\u00fado de fen\u00f3li-cos totais na resina \u00e9 considerado baixo, em com-para\u00e7\u00e3o com os extratos das folhas e galhos como avaliado por Amparo (2016), onde o pesquisador encontrou para os extratos etan\u00f3licos das folhas e galhos de P. spruceanum resultados de 74,31 e de 103,06 mg EAG 100 g-1. O rendimento encontrado para o extrato hidroe-tan\u00f3lico da resina de P. spruceanum foi de 6,61% para a resina dos galhos e das ra\u00edzes descobertas (Tabela 1). Amparo (2016) encontrou rendimento de 16,03% para o extrato bruto etan\u00f3lico das fo-lhas e para os galhos de 9,60% para P. sprucea-num. Conforme Sultana et al. (2009), a diferen\u00e7a de rendimento entre os diversos \u00f3rg\u00e3os de um vegetal se deve a sua disponibilidade resultante da variedade da composi\u00e7\u00e3o qu\u00edmica no vegetal, bem como a \u00e9poca de coleta do material biol\u00f3gico. Na tabela 2, est\u00e3o apresentados os resultados para fitoqu\u00edmica a partir do extrato hidroetan\u00f3lico da resina de P. spruceanum. Foi observada uma grande quantidade de com-postos do metabolismo secund\u00e1rio a partir do ex-trato hidroetan\u00f3lico da resina de P. spruceanum, com resultados positivos. As provas de rea\u00e7\u00e3o para os ensaios fitoqu\u00edmi-cos realizados no extrato hidroetan\u00f3lico de P. spruceanum, apresentaram resultados positivos para compostos fen\u00f3licos, corroborando com o ensaio de compostos fen\u00f3licos totais por reativo de Folin-Ciocalteau realizado conforme descrito na (Tabela 1), al\u00e9m deste, foram observados resul-tados positivos para a\u00e7\u00facares redutores, taninos, flavonoides, antraquinonas, cumarinas, \u00e1cidos org\u00e2nicos, catequinas, ester\u00f3ides e triterpenos, saponinas hemol\u00edticas, esta, corroborando com o ensaio hemol\u00edtico em suspens\u00e3o de hem\u00e1cias (Fi-gura 2), para glicos\u00eddeos card\u00edacos e cianog\u00eanicos, duplas olef\u00ednicas, benzoquinonas, naftoquinonas e fenantraquinonas, alcaloides, deps\u00eddeos e depsido-nas, purinas, resinas e sesquiterpenolactonas con-forme apresentado na (Tabela 2). A triagem fito-qu\u00edmica demonstrou que o extrato hidroetan\u00f3lico da resina apresenta in\u00fameros compostos, em espe-cial, e de grande import\u00e2ncia principalmente para a farmacologia. Tabela 2 - Prospec\u00e7\u00e3o fitoqu\u00edmica do extrato hi-droetan\u00f3lico da resina de P. spruceanum coletados em \u00e1rea de Cerrado em Rio Verde \u2013 Goi\u00e1s, Brasil. Metab\u00f3litos Resultados Compostos fen\u00f3licos +++ A\u00e7\u00facares redutores ++ A\u00e7\u00facares n\u00e3o redutores - Taninos Vd Flavonoides +++ Antraquinonas ++ Cumarinas + \u00c1cidos org\u00e2nicos +++ Catequinas ++ Esteroides e triterpenos +++ Saponins espum\u00eddica - Saponina hemol\u00edtica +++ Glicos\u00eddeos card\u00edacos +++ Glicos\u00eddeos cianog\u00eanicos ++ Duplas olefinas +++ Benzaquinonas, naftaquinonas e fenan-traquinonas ++ Alcaloides +++ Deps\u00eddeos e depsidonas +++ Polissacar\u00eddeos - Purinas +++ Resinas +++ Sesquiterpenolactonas ++ (+++) fortemente positivo, (++) moderadamente positivo, (+) fracamente positivo, (-) negativo. (Vd) taninos cat\u00e9quicos e (Az) taninos condensados. Menezes Filho / Journal of Biotechnology and Biodiversity / v.9 n.1 (2021) 048-059 \u00a9 2020 Journal of Biotechnology and Biodiversity ISSN: 2179-4804 DOI: https://doi.org/10.20873/jbb.uft.cemaf.v9n1.menezesfilho 54 Amparo (2016) encontrou para o extrato bruto das folhas e galhos de P. spruceanum as seguintes classes de compostos secund\u00e1rios: cumarinas, flavonoides, taninos, terpen\u00f3ides e \u00e1cidos graxos. Estudos fitoqu\u00edmicos preliminares para o g\u00eanero Protium, j\u00e1 demonstraram a presen\u00e7a de compos-tos esteroidais, terpenos (mono- e triterpenos), cumarinas, ligninas, fenilpropanoides e flavonoi-des (Magalh\u00e3es et al., 2006; Adfa et al., 2013). Para a esp\u00e9cie de P. spruceanum atrav\u00e9s das an\u00e1li-ses em CG-EM e HPLC a partir da an\u00e1lise do extrato dos galhos, foram observados alguns \u00e9ste-res de \u00e1cidos graxos, terpenos, flavonoides e tani-nos no estudo realizado por Amparo et al. (2018), corroborando com os resultados apresentados neste estudo. Na figura 2, est\u00e1 apresentada a porcentagem hemol\u00edtica do extrato hidroetan\u00f3lico 70% da resi-na extra\u00edda das cascas do tronco e raiz de P. spru-ceanum. Figura 2 - Percentual hemol\u00edtico do extrato resinoso hidroetan\u00f3lico 70% de P. spruceanum em diferentes concentra\u00e7\u00f5es expressos em \u00b5g mL-1. Conforme se observa na figura 2, o extrato resi-noso de P. spruceanum apresenta atividade hemo-l\u00edtica considerada alta em todas as concentra\u00e7\u00f5es entre 76 a 56%. Devido a falta de dados para cu-nho comparativo no g\u00eanero Protium, os resultados deste estudo, foi comparado com outros extratos, como nos estudos de Sousa et al. (2018), onde os pesquisadores observaram atividade hemol\u00edtica de 63,88% na maior concentra\u00e7\u00e3o de 400 \u00b5g mL-1 para o extrato hidroetan\u00f3lico 70% das cascas do caule de Ziziphus joazeiro. Conforme Nofiani et al. (2011), e Ramos et al. (2020), processos hemo-l\u00edticos acima de 40% s\u00e3o considerados altos e inferior a esse valor, considerado baixo. Na figura 3, est\u00e3o apresentadas micrografias \u00f3pticas do processo de hem\u00f3lise do tecido hema-topoi\u00e9tico em suspendido de eritr\u00f3citos humanos a 5% ap\u00f3s o per\u00edodo de 5 e 10 minutos da adminis-tra\u00e7\u00e3o do extrato hidroetan\u00f3lico da resina de P. spruceanum. Fonte: Pesquisa, (2020). Figura 3 \u2013 Micrografia \u00f3ptica da suspen\u00e7\u00e3o de eritr\u00f3citos humanos a 5% (v/v) em solu\u00e7\u00e3o salina a 0,85% (m/v). Em (A) concentrado de eritr\u00f3citos normoc\u00edticos. Em (B) tempo de 5 minutos ap\u00f3s adi\u00e7\u00e3o de 20 \u00b5L mL-1 de extrato resinoso de P. spruceanum. Em (C) tempo de 10 minutos ap\u00f3s adi\u00e7\u00e3o de 20 \u00b5L mL-1 de ex-trato resinoso de P. spruceanum. Menezes Filho / Journal of Biotechnology and Biodiversity / v.9 n.1 (2021) 048-059 \u00a9 2020 Journal of Biotechnology and Biodiversity ISSN: 2179-4804 DOI: https://doi.org/10.20873/jbb.uft.cemaf.v9n1.menezesfilho 55 Como observado na tabela 2, n\u00e3o foram obser-vados a presen\u00e7a de saponinas espum\u00eddicas, entre-tanto, foram observadas tamb\u00e9m a presen\u00e7a de saponinas hemol\u00edticas conforme se observa na (Figura 3). A a\u00e7\u00e3o eritrocit\u00e1ria ocorreu entre 5 a 10 minutos, onde com 10 minutos houve completa hem\u00f3lise com libera\u00e7\u00e3o de hemoglobina no meio extracelular dos eritr\u00f3citos. A concentra\u00e7\u00e3o em-pregada neste estudo demonstrou apresentar toxi-cidade no tecido hematopoi\u00e9tico. Conforme Souza et al. (2018), a intera\u00e7\u00e3o das mol\u00e9culas com carac-ter\u00edsticas hemol\u00edticas do extrato, que ocorre com os ester\u00f3is constituintes da membrana do eritr\u00f3ci-to, leva a forma\u00e7\u00e3o de poros na membrana, cau-sando a hem\u00f3lise figura 3 (B) 5 minutos e em (C) 10 minutos. Posteriormente foi realizada uma varredura por espectrofotometria no UV-Vis para o extrato bruto hidroetan\u00f3lico da resina de P. spruceanum entre os comprimentos de ondas de 300 a 800 nm, como pode ser observado no (Figura 1). Observam-se no Gr\u00e1fico 1, bandas nas faixas entre 365 a 424 nm caracter\u00edsticas de absor\u00e7\u00e3o de fen\u00f3is e cumarinas, em 434 a 462 nm, e entre 467 a 503 nm caracter\u00edsticas da absor\u00e7\u00e3o para compos-tos flavon\u00f3licos. A partir dos resultados anteriores de fitoqu\u00edmi-ca observados na tabela 2, \u00e9 poss\u00edvel sugerir atra-v\u00e9s do espectro de varredura entre 800 a 300 nm por absorb\u00e2ncia, a presen\u00e7a de compostos do tipo fen\u00f3licos, cumar\u00ednicos e flavon\u00f3licos (Figura 1). In\u00fameros trabalhos avaliam por espectroscopia no UV-Vis a trav\u00e9s de varreduras sendo poss\u00edvel pre-sumir a presen\u00e7a de determinadas classes fitoqu\u00ed-micas. Outros trabalhos aplicando esta t\u00e9cnica foram descritas por Garc\u00eda et al. (2019) onde tam-b\u00e9m encontraram bandas entre 200 a 300 nm cor-respondente a classe de compostos fen\u00f3licos e entre 400 a 500 nm para compostos flavon\u00f3licos, avaliando as fra\u00e7\u00f5es e o extrato aquoso de Ana-cardium occidentale. Figura 1 - Espectro de varredura do extrato bruto hidroetan\u00f3lico de P. spruceanum. Fonte: Pr\u00f3pria (2020). Souza et al. (2018) avaliaram o fruto de Bacte-ris gasipaes (pupunha) onde encontraram compos-tos flavon\u00f3licos no extrato etan\u00f3lico da casca com duas bandas entre 260 e 290 nm e em 400 e 490 nm. J\u00e1 Fuentes et al. (2017), os pesquisadores analisaram por espectroscopia UV-Vis para os extratos da folha, galhos e ra\u00edzes de Macroptilium lathyroides onde encontraram bandas em 375, 384, 386, 390 e 392 nm que evidenciam a presen-\u00e7a de compostos cumar\u00ednicos, e em 207 nm para alcal\u00f3ides. Conforme Bobin et al. (1994), os fla-vonoides apresentam duas bandas no espectro de absor\u00e7\u00e3o UV-Vis em 240 a 280 e 300 a 550 nm Na Tabela 3 est\u00e3o apresentados os resultados da atividade de inibi\u00e7\u00e3o observados pela forma\u00e7\u00e3o de halo de antibiose para S. aureus, S. sorovar Typhimurium, S. sorovar Enteritidis e E. coli so-bre o extrato hidroetan\u00f3lico da resina de P. spru-ceanum e comparados aos controles positivos e negativo. Menezes Filho / Journal of Biotechnology and Biodiversity / v.9 n.1 (2021) 048-059 \u00a9 2020 Journal of Biotechnology and Biodiversity ISSN: 2179-4804 DOI: https://doi.org/10.20873/jbb.uft.cemaf.v9n1.menezesfilho 56 Tabela 3 - Atividade antibacteriana avaliada pela forma\u00e7\u00e3o de halo de antibiose expresso em (mm) para o extrato de P. spruceanum 20% (m/v) frente a S. aureus, S. Typhimurium, S. Enteritidis e E. coli. Microrganismos Di\u00e2metro do halo (mm) S. aureus 19,13 \u00b1 0,06 mm S. Typhimurium 14,07 \u00b1 0,12 mm S. Enteritidis 17,51 \u00b1 0,04 mm E. coli 9,18 \u00b1 0,08 mm *Ciprofloxacina 29 \u00b1 0,03 / 27 \u00b1 0,08 / 30 \u00b1 0,09 / 29 \u00b1 0,12 mm *Azitromicina 27 \u00b1 0,12 / 31 \u00b1 0,06 / 29 \u00b1 0,09 / 28 \u00b1 0,11 mm \u00c1gua + *Antibi\u00f3ticos de refer\u00eancia na dosagem de 500 mg mL-1, como controles positivos. Os respectivos resultados s\u00e3o apresentados em m\u00e9-dias a partir de tr\u00eas repeti\u00e7\u00f5es expressos em (mm) seguidos de (\u00b1) desvio padr\u00e3o. Cada (/) representa a m\u00e9dia do halo de antibiose para cada cepa bacteriana referente ao extrato de P. spruceanum e respectivos controles positivos (antibi\u00f3ticos de refer\u00eancia). Controle nega-tivo \u00e1gua (+) para crescimento de todos os isolados bacterianos. Fonte: Pesquisa (2020). Conforme se observa na tabela 3, o extrato hi-droetan\u00f3lico da resina de P. spruceanum apresen-tou boa e especial efici\u00eancia de inibi\u00e7\u00e3o atrav\u00e9s do ensaio de antibiose para S. aureus, S. Typhimuri-um e S. Enteritidis com halos superiores a 10 mm. J\u00e1 para E. coli, o isolado bacteriano apresentou baixa sensibilidade ao extrato, apresentando resul-tado inferior a 10 mm. Possivelmente os compos-tos agindo por sinergismo n\u00e3o possuem efici\u00eancia com alta efic\u00e1cia para inibir o crescimento desta cepa resistente. No estudo desenvolvido por Amparo et al. (2018), onde avaliaram o extrato etan\u00f3lico dos galhos de P. spruceanum, os pesquisadores obtive-ram importante atividade antibacteriana para S. aureus e S. aureus MRSA, Staphylococcus sapro-phyticus, Enterococcus faecalis e S. Enteritidis. Em outro estudo realizado tamb\u00e9m por Amparo (2016), o pesquisador encontrou atividade de ini-bi\u00e7\u00e3o para o extrato bruto das folhas e galhos de P. spruceanum, avaliando isolados de S. aureus com halo de inibi\u00e7\u00e3o igual a 18,52 e 18,89; 18,52 e 18,89; e de 21,03 e 21,65 mm e para E. coli de 10,52; 10,17 e de 10,08 mm respectivamente, superiores aos resultados deste estudo. J\u00e1 para a cepa de S. Typhimurium com inibi\u00e7\u00e3o de 10,12 e de 10,67 mm, e para S. Enteritidis de 11,11 e de 13,50 mm, os resultados foram inferiores ao teste de antibiograma deste estudo, que demonstraram maior sensibilidade pelo extrato hidroetan\u00f3lico da resina dos galhos e ra\u00edzes. Outra esp\u00e9cie do g\u00eanero Protium, o Protium heptaphyllum apresentou em estudo, atividade antimicrobiana para fungos dos g\u00eaneros Candida, isolado C. krusei e para Cryptococcus, isolado C. neoformans e para a bact\u00e9ria do g\u00eanero Staphylo-coccus, isolado de S. aureus atrav\u00e9s do extrato etan\u00f3lico da casca da mesma esp\u00e9cie vegetal (Vio-lante et al., 2012). J\u00e1 no estudo de Su\u00e1rez et al. (2007), os investigadores avaliaram a esp\u00e9cie Pro-tium neglectum end\u00eamica na Venezuela, onde o \u00f3leo essencial extra\u00eddo da resina apresentou ativi-dade bactericida para cepas de Bacillus subtillis e S. aureus. De acordo com Matikainen et al. (2015), Wang et al. (2015), Alves et al. (2014), Aderogba et al. (2013) e Johann et al. (2007), a excepcional ativi-dade antimicrobiana apresentada para P. sprucea-num, est\u00e1 relacionada aos compostos linoleato de metila, amirina, catequina, procianidina e querce-tina. Comparando com outros extratos vegetais na li-teratura, Fuentes et al. (2017) encontraram excep-cional atividade antibacteriana em extratos a 20% das folhas, galhos e ra\u00edzes de M. lathyroides. Os pesquisadores observaram halos de inibi\u00e7\u00e3o de 8 e 11 mm S. aureus e de 8 e 14 mm para E. coli nos extratos das folhas (tintura e seca), e de 8 a 10 S. aureus e de 9 e 11 mm para E. coli mm nos extra-tos dos galhos (tintura e seca), e de 8 a 11mm S. aureus e de 8 e 15 mm E. coli para os extratos das ra\u00edzes (tintura e seca). N\u00e3o foi observada inibi\u00e7\u00e3o para o isolado de Pseudomonas aeruginosa em nenhum dos extratos avaliados pelos pesquisado-res. Como controle positivo foi utilizado cipro-floxacina e gentamicina com inibi\u00e7\u00e3o de 24, 27 e 14 mm para S. aureus, E. coli e P. aeruginosa. CONCLUS\u00d5ES O extrato hidroetan\u00f3lico da resina extra\u00edda das ra\u00edzes descobertas e do tronco de indiv\u00edduos de Protium spruceanum apresentam importantes resultados, tanto para as avalia\u00e7\u00f5es fitoqu\u00edmicas, f\u00edsico-qu\u00edmicas em especial para atividade antioxidante na redu\u00e7\u00e3o do modelo de radical livre DPPH, bem como, no ensaio de antibiograma realizado para as quatro estirpes bacterianas resistentes a antibi\u00f3ticos. Trabalhos futuros dever\u00e3o ser realizados avaliando as mesmas caracter\u00edsticas, bem como determinar a capacidade de inibi\u00e7\u00e3o m\u00ednima Menezes Filho / Journal of Biotechnology and Biodiversity / v.9 n.1 (2021) 048-059 \u00a9 2020 Journal of Biotechnology and Biodiversity ISSN: 2179-4804 DOI: https://doi.org/10.20873/jbb.uft.cemaf.v9n1.menezesfilho 57 (CIM) das bact\u00e9rias, e testar sobre alguns isolados f\u00fangicos que causam s\u00e9rios problemas de sa\u00fade p\u00fablica como o g\u00eanero Candida, bem como, cepas fitopatol\u00f3gicas que causam perdas agr\u00edcolas anualmente em planta\u00e7\u00f5es pelo mundo. AGRADECIMENTOS Ao Instituto Federal Goiano, Campus Rio Verde; aos laborat\u00f3rios de Qu\u00edmica Tecnol\u00f3gica, \u00c1guas e Efluentes, Bioensaios e Biomol\u00e9culas, Sistem\u00e1tica Vegetal, Materiais e Eletroanal\u00edtica, e de Fisiologia Vegetal; ao Herb\u00e1rio do IF Goiano; a Central Anal\u00edtica Multi-Usu\u00e1rio \u2013 CEMA; aos \u00f3rg\u00e3os de fomento em pesquisa, CAPES, CNPq e FINEP. REFER\u00caNCIAS BIBLIOGR\u00c1FICAS Aderogba MA, Ndhlala AR, Rengasamy KRR, Van Staden J. Antimicrobial and selected in vitro enzyme inhibitory ef-fects of leaf extracts, flavonols and indole alkaloids isola-ted from Croton menyharthi. Molecules, v. 18, n. 10, p. 12633-12644, 2013. https://doi.org/10.3390/molecules181012633 Adfa M, Hattori Y, Ninomiya M, Funahashi Y, Yoshimura T, Koketsu M. Chemical constituents of Indonesian plant Protium javanicum Burm. f. and their antifeedant activities against Coptotermes formosanus Shiraki. Journal Natural Product Research, v. 27, n. 3, 270-273, 2013. https://doi.org/10.1080/14786419.2012.665917 Alarc\u00f3n MET, Conde CG, M\u00e9ndez GL. Extracci\u00f3n, caracte-rizaci\u00f3n y actividad antioxidante del aceite esencial de Eu-calyptus globulus Labill. Revista Cubana de Farmacia, 52(1), p. e266, 2019. https://www.medigraphic.com/cgi-bin/new/resumenI.cgi?IDARTICULO=93927 Alves MM, Pereira AMS, Pereira PS, Fran\u00e7a SC, Bertoni BW. Caracteriza\u00e7\u00e3o qu\u00edmica de tinturas e extratos secos de plantas medicinais do Cerrado por cromatografia em ca-mada delgada. Scientia Plena, v. 7, n. 12, p. 9901, 2011. https://scientiaplena.emnuvens.com.br/sp/article/view/159 Alves CT, Ferreira ICFR, Barros L, Silva S, Azeredo J, Henriques M. Antifungal activity of phenolic compounds identified in flowers from North Eastern Portugal against Candida species. Future Microbiology, v. 9, p. 139-146, 2014. https://doi.org/10.2217/fmb.13.147 Amparo TR. An\u00e1lise fitoqu\u00edmica e Bioprospec\u00e7\u00e3o para ativi-dade antimicrobiana de Protium spruceanum (Benth.) En-gler. 2016. 151 p. Disserta\u00e7\u00e3o (Mestrado em Ci\u00eancias Farmac\u00eauticas) - Universidade Federal de Ouro Preto, Mi-nas Gerais. Amparo TR, Rodrigues IV, Seibert JB, Souza RHZ, De Oliveira AR, Cabral VAR, Vieira PMA, Brand\u00e3o GC, Okuma AA, Filho SAV, Teixeira LFM, De Souza GHB. Antibacterial activity of extract and fractions from branch-es of Protium spruceanum and cytotoxicity on fibroblasts. Natural Product Research, v. 32, n. 16, p. 1951-1954, 2018. https://doi.org/10.1080/14786419.2017.1354182 Bobin MF, Raymond M, Martini MC. UVA/UVB absorption properties of natural products. Cosmetic and Toiletries, v. 109, n. 11, p. 63-70, 1994. Conde CG, Alarc\u00f3n MET, Parajo NP, Llamas EG, M\u00e9ndez GL. Caracterizaci\u00f3n qu\u00edmica y determinaci\u00f3n de la activi-dad antioxidante de la pulpa de Tamarindus indica L. (ta-marindo). Revista Cubana de Plantas Medicinales, v. 22, n. 2, 2017. http://revplantasmedicinales.sld.cu/index.php/pla/article/view/509 Conde CG, Pajaro NP, M\u00e9ndez GL. Actividad antioxidante y contenido fen\u00f3lico del extracto etan\u00f3lico de Capsicum an-num L. Revista Cubana de Farmacia, v. 52, n. 2, p. e78, 2019. http://revfarmacia.sld.cu/index.php/far/article/view/78 Conde CG, Guardo KPT, Llamas EG, P\u00e1jaro-Castro NP, Milano YG. Caracterizaci\u00f3n qu\u00edmica y evaluaci\u00f3n de la actividad antioxidante de la pulpa de Passiflora edulis Sims. (gulupa). Revista Cubana de Plantas Medicinales, v. 22, n. 2, 2017. http://www.revplantasmedicinales.sld.cu/index.php/pla/article/view/513 Dacie JV, Lewis SM, Catovsky D. Blood cell cytochemistry and supplementary techniques. Practical Hematology, Churchill Livingstone, Edinburgh, 120-148 p. 1975. Dom\u00ednguez OGP, Pesantes KEB, Mart\u00ednez MM, Gait\u00e9n YG. Estudio qu\u00edmico y evaluaci\u00f3n biol\u00f3gica del extracto etan\u00f3-lico de Allium schoenoprasum L. Regel & Tiling (Cebo-ll\u00edn). Revista Cubana de Farmacia, v. 52, n.1, p. e98, 2019. http://revfarmacia.sld.cu/index.php/far/article/view/98 Farjado CG, Vieira FA, Morais FM, Maracaj\u00e1 PB, De Carva-lho D. Polimorfismo de isoenzimas em Protium sprucea-num (Benth.) Engler (Burseraceae) com base para estudos de diversidade gen\u00e9tica. Revista Verde de Agroecologia e Desenvolvimento Sustent\u00e1vel, v. 4 n. 4, p. 27-32, 2009. https://editoraverde.org/gvaa.com.br/revista/index.php/RVADS/article/viewFile/213/213 Fern\u00e1ndez MC, F\u00e1rez DLA, Roblez NCC, Hern\u00e1ndez IM, Galv\u00e1n DSM, Rubio OC. Composici\u00f3n qu\u00edmica y activi-dad antimicrobiana del extracto etan\u00f3lico de las partes a\u00e9-reas de Minthostachys mollis Griseb. Revista Cubana de Farmacia, v. 51, n. 2, 2017. http://revfarmacia.sld.cu/index.php/far/article/view/221 Flores L\u00f3pez ZY, D\u00edaz APC, Santos EHQ, Gait\u00e9n YG, Olivet ES, Cuellar AC. Caracter\u00edsticas fitoqu\u00edmicas y toxicol\u00f3gi-cas de la semilla Swietenia humilis Zuccarini y su efecto hipoglucemiante. Revista Cubana de Farmacia, v. 52, n. 1, p. e129, 2019. https://www.medigraphic.com/cgi-bin/new/resumen.cgi?IDARTICULO=93929 Fuentes JTL, Fuentes DP, Herrera GC. Actividad antibacte-riana in vitro de los extractos y de las tinturas al 20% de Macroptilium lathyroides (L.) Urban (maribari). Revista Cubana de Plantas Medicinales, v. 22, n. 4, 2017. http://www.revplantasmedicinales.sld.cu/index.php/pla/article/view/627 Garc\u00eda, J. H. G., Naranjo, B. D. C., Salazar, M. T. J., & Ser-na, D. M. O. (2019). Actividad antibacteriana y antif\u00fangica de los extractos de diferente polaridad de Anacardium oc-cidentale. Revista Cubana de Plantas Medicinales, 24(2), e677. Menezes Filho / Journal of Biotechnology and Biodiversity / v.9 n.1 (2021) 048-059 \u00a9 2020 Journal of Biotechnology and Biodiversity ISSN: 2179-4804 DOI: https://doi.org/10.20873/jbb.uft.cemaf.v9n1.menezesfilho 58 http://revplantasmedicinales.sld.cu/index.php/pla/article/view/677 Johann S, Soldi C, Lyon JP, Pizzolatti MG, Resende MA. Antifungal activity of the amyrin derivatives and in vitro inhibition of Candida albicans adhesion to human epitheli-al cells. Letters in Applied Microbiology, v. 45, n. 2, p. 148-153, 2007. https://doi.org/10.1111/j.1472-765X.2007.02162.x Lemes EO, Fernandes MMC, Rosa VP, Nascimento AH. Levantamento da utiliza\u00e7\u00e3o do pequi (Caryocar brasiliense Camb.) como agente antioxidante na preven\u00e7\u00e3o de doen\u00e7as neurodegenerativas. Unici\u00eancias, v. 21, n. 2, p. 110-114, 2017. https://doi.org/10.17921/1415-5141.2017v21n2p110-114 Machado LB, Zoghbi MGB, Andrade EHA. Seasonal varia-tion in the composition of the essential oils from the leaves, thin branches and resin of Protium spruceanum (Benth.) Engl. Flavour and Fragrance Journal, v. 18, n. 4, p. 339-341, 2003. Magalh\u00e3es A, Zoghbi MDGB, Siani, AC. 5-Methoxypropacin, a novel coumarinolignoid from Protium unifoliolatum. Journal Natural Product Research, v. 20, n. 1, p. 43-46, 2006. https://doi.org/10.1080/14786410500055555 Menezes Filho ACP, Castro CFS. An\u00e1lise fitoqu\u00edmica preli-minar de extratos foliares de Orchidaceas (Cattleya walke-riana Gardner.), (Encyclia linearifolioides Kraenzl.) e (Polystachya concreta (Jacp.) Garay & H. R. Sweet). En-saios e Ci\u00eancias, v. 23, n. 1, p. 16-23, 2019. https://doi.org/10.17921/1415-6938.2019v23n1p16-23 Matikainen J, Lehtinen M, Pelttari E, Elo H. Toxicity of fatty acid autoxidation products: highest anti-microbial toxicity in the initial oxidative phase. Molecules, v. 20, n. 1, p. 35-42, 2015. https://doi.org/10.3390/molecules20010035 Nofiani R, Kurniadi R, Ardiningsih P. Antimicrobial, antiox-idant, hemolytic activities and toxicity of ethyl acetate ex-tract from an unidentified coral-associated Fungus, Asper-gillus brevipes RK06. Indonesian Journal of Cancer Chemoprevention, v. 2, n. 2, p. 212-216, 2011. http://dx.doi.org/10.14499/indonesianjcanchemoprev2iss2pp212-216 Oliveira AKM, Pereira KCL, Muller JAI, Matias R. An\u00e1lise fitoqu\u00edmica e potencial alelop\u00e1tico das cascas de Pouteria ramiflora na germina\u00e7\u00e3o de alface. Horticultura Brasileira, v. 32, p. 41-47, 2014. https://doi.org/10.1590/S0102-05362014000100007 Oliveira Filho AT, Ratter JA. A study of the origin of central Brazilian forests by the analysis of the plant species distri-bution. Edinburgh Journal of Botany, v. 52, n. 2, p. 141-194, 1995. Pessuto MB, Da Costa IC, De Souza AB, Nicoli FM, De Mello JCP, Petereit F, Luftmann H. Atividade antioxidante de extratos e taninos condensados das folhas de Maytenus ilicifolia Mart. ex Reiss. Qu\u00edmica Nova, v. 32, n. 2, p. 412-416, 2009. https://doi.org/10.1590/S0100-40422009000200027 Ramos RM, Feitosa JM, Lima VS, Santos RC, De Oliveira AM, Soares LAL, Da Silva GC. Estudo comparativo da composi\u00e7\u00e3o fitoqu\u00edmica, citotoxicidade e potencias antio-xidante e fotoprotetora da casca e folha de Erythrina velu-tina. Brazilian Journal of Development, v. 6, n. 6, p. 33140-33158, 2020. https://doi.org/10.34117/bjdv6n6-026 Rodrigues IMC, Souza Filho APS, Ferreira FA. Estudo fito-qu\u00edmico de Senna alata por duas metodologias. Revista Planta Daninha, v. 27, n. 3, p. 507-513, 2009. https://doi.org/10.1590/S0100-83582009000300011 Sim\u00f5es RC, De Almeida SSMS. Estudo fitoqu\u00edmico de Bau-hinia forficata (Fabaceae). Biota Amaz\u00f4nia, v. 5, n. 1, p. 27-31, 2015. http://dx.doi.org/10.18561/2179-5746/biotaamazonia.v5n1p27-31 Souza BAS, Souza FBS, Prado AF, Almeida LD, Amarante CB. Avalia\u00e7\u00e3o in vitro da atividade fotoprotetora de extra-tos vegetais da Amaz\u00f4nia. In: 58\u00ba Congresso Brasileiro de Qu\u00edmica, S\u00e3o Lu\u00eds-MA, 6 a 9 de novembro de 2018, 2018. Sousa IJO, Silva MCP, Leopoldino GL, Agostinho LS. Estu-do fitoqu\u00edmico, avalia\u00e7\u00e3o da capacidade hemol\u00edtica e anti-microbiana de um extrato bruto da casca do caule de Zi-ziphus joazeiro Mart. (Rhamnaceae). Journal of Biology & Pharmacy and Agricultural Management, v. 14, n. 4, p. 208-225, 2018. http://revista.uepb.edu.br/index.php/biofarm/article/view/3496 Suar\u00e9z AI, Compagnone RS, Acosta D, V\u00e1squez L, Diaz B, Canel\u00f3n DJ. Chemical composition and antimicrobial ac-tivity of the essential oil from oleoresins of Protium ne-glectum. Journal of Essential Oil Bearing Plants, v. 10, n. 1, p. 70-75, 2007. https://doi.org/10.1080/0972060X.2007.10643521 Sultana B, Anwar F, Ashraf M. Effect of extration sol-vent/technique on the antioxidant activity of selected me-dicinal plant extracts. Molecules, v. 14, p. 2167-2180, 2009. https://doi.org/10.3390/molecules14062167 Vieira FA, Appolin\u00e1rio V, Fajardo CG, De Carvalho D. Reproductive biology of Protium spruceanum (Burserace-ae), a dominant dioecious tree in vegetation corridors in Southeastern Brazil. Brazilian Journal of Botany, v. 33, n. 4, p. 711-715, 2010. https://doi.org/10.1590/S0100-84042010000400018 Vieira FA, Carvalho D. Genetic structure of na insect-pollinated and Bird-dispersed tropical tree in vegetation fragments and corridors: implication for conservation. Bi-odiversity and Conservation, v. 17, p. 2305-2321, 2008. https://doi.org/10.1007/s10531-008-9367-7 Violante IMP, Hamerski L, Garcez WS, Batista AL, Chang MR, Pott VJ, Garcez FR. Antimicrobial activity of some medicinal plants from the cerrado of the central-western region of Brazil. Brazilian Journal of Microbiology, v. 43, n. 4, p. 1302-1308, 2012. https://doi.org/10.1590/S1517-83822012000400009 Zimmermann AM, Kirsten VR. Alimentos com fun\u00e7\u00e3o antio-xidante em doen\u00e7as cr\u00f4nicas: Uma abordagem cl\u00ednica. Re-vista Eletr\u00f4nica Disciplinarum Scientia, Ci\u00eancias da Sa\u00fade, v. 9, n. 1, p. 51-68, 2008. https://periodicos.ufn.edu.br/index.php/disciplinarumS/article/view/934 Wang C-M, Hsu Y-M, Jhan Y-L, Tsai S-J, Lin S-X, Su C-H, Chou C-H. Structure elucidation of procyanidins isolated from Rhododendron formosanum and their anti-oxidative and anti-bacterial activities. Molecules, v. 20, n. 7, p. Menezes Filho / Journal of Biotechnology and Biodiversity / v.9 n.1 (2021) 048-059 \u00a9 2020 Journal of Biotechnology and Biodiversity ISSN: 2179-4804 DOI: https://doi.org/10.20873/jbb.uft.cemaf.v9n1.menezesfilho 59 12787-12803, 2015. https://doi.org/10.3390/molecules200712787"}