{"taxa": [{"scientific_name": "eugenia pyriformis", "compounds": ["\u00e1cido fer\u00falico", "\u00f3xido de cariofileno", "terpinen-4-ol", "miricetina cumaril di-hexos\u00eddeo", "\u00e1cido cafeoilqu\u00ednico", "\u03b1-amirina", "\u00e1cido fert\u00e1rico", "\u00e1cido p-cum\u00e1rico", "hexos\u00eddeo de apigenina", "germacreno d", "caempferol", "\u00e1cido cafeoil metilqu\u00ednico", "\u03b2-amirina", "limoneno", "cafeoil-hexose", "\u00e1cido dimetoxi cin\u00e2mico", "hexos\u00eddeo de metilapigenina", "rutina", "miricetina", "\u00e1cido clorog\u00eanico", "biciclogermacreno", "\u03b1-cadinol", "\u00e1cido qu\u00ednico", "\u00e1cido g\u00e1lico", "\u00e1cido coumaroil tart\u00e1rico", "\u00e1cido succ\u00ednico", "\u00e1cido cin\u00e2mico", "\u00e1cido m\u00e1lico", "di-hexos\u00eddeo de catequina", "hexos\u00eddeo de \u00e1cido g\u00e1lico", "quercitina", "hexos\u00eddeo de luteonina", "\u03b1-terpineol", "\u00e1cido caf\u00e9ico", "galocatequina", "cafeato de hexos\u00eddeo de apigenina", "cariofileno e"], "accepted_name": "Eugenia pyriformis", "accepted_species": "Eugenia pyriformis", "accepted_genus": "Eugenia", "inchi_keys": {"terpinen-4-ol": "WRYLYDPHFGVWKC-UHFFFAOYSA-N", "rutina": "IKGXIBQEEMLURG-KUKMIBIMSA-N", "\u03b1-cadinol": "LHYHMMRYTDARSZ-BYNSBNAKSA-N", "\u03b1-terpineol": "WUOACPNHFRMFPN-UHFFFAOYSA-N"}, "inchi_key_simps": {"terpinen-4-ol": "WRYLYDPHFGVWKC", "rutina": "IKGXIBQEEMLURG", "\u03b1-cadinol": "LHYHMMRYTDARSZ", "\u03b1-terpineol": "WUOACPNHFRMFPN"}}], "text": "Scientia Naturalis, Rio Branco, v. 3, n. 1, p. 345-369, 2021 p. 345 SCIENTIA NATURALIS Scientia Naturalis, v. 3, n. 1, p. 345-369, 2021 Home page: http://revistas.ufac.br/revista/index.php/SciNat ISSN 2596-1640 Eugenia pyriformis \u201cuvaia\u201d: descri\u00e7\u00e3o, fitoqu\u00edmica e usos na fitomedicina e nutri\u00e7\u00e3o Antonio Carlos Pereira de Menezes Filho* Bi\u00f3logo e Mestre em Agroqu\u00edmica pelo Instituto Federal Goiano, Goi\u00e1s, Brasil. *astronomoamadorgoias@gmail.com Recebido em: 21/01/2021 Aceito em: 18/02/2021 Publicado em: 20/03/2021 RESUMO In\u00fameras esp\u00e9cies vegetais da fam\u00edlia Myrtaceae s\u00e3o constantemente estudadas, em especial do g\u00eanero Eugenia que apresenta v\u00e1rias esp\u00e9cies frut\u00edferas como Eugenia pyriformis utilizada como fitomedicinal e aliment\u00edcia para animais silvestres e o homem. Este estudo teve por objetivo realizar uma revis\u00e3o bibliogr\u00e1fica sobre fitoqu\u00edmica, fitomedicina e conte\u00fados nutricionais do fruto de Eugenia pyriformis. Foi realizada uma pesquisa descritiva, com palavras-chave como descritores em idioma Portugu\u00eas, Ingl\u00eas e Espanhol. Os trabalhos com alguma rela\u00e7\u00e3o com a esp\u00e9cie E. pyriformis foram analisados. Os resultados apontaram consider\u00e1vel n\u00famero de estudos sobre a fenologia, conserva\u00e7\u00e3o, germina\u00e7\u00e3o, fitoqu\u00edmicos, fitomedicinais e nutricionais. No entanto, para uso aliment\u00edcio, s\u00e3o poucos os relatos de trabalhos no desenvolvimento de alimentos como p\u00e3es integrais, bolachas, cookies, biscoitos dentre outros com o emprego da polpa como m\u00e9todo alternativo, e mais saud\u00e1vel na dieta humana. Esta revis\u00e3o bibliogr\u00e1fica instiga a produ\u00e7\u00e3o de novos estudos principalmente para as poss\u00edveis atividades biol\u00f3gicas e nutricionais a partir do fruto de Eugenia pyriformis visto que, a polpa apresenta conte\u00fados expressivos de compostos fen\u00f3licos, flavonoides e alta atividade antioxidante que podem ser utilizados em benef\u00edcio humano como prote\u00e7\u00e3o a diversas patologias e enriquecendo a dieta com produtos de origem natural. Palavras-chave: G\u00eanero Eugenia. Conte\u00fado nutricional. Fam\u00edlia Myrtaceae. Eugenia pyriformis \u201cuvaia\u201d: description, phytochemistry and uses in phytomedicine and nutrition ABSTRACT Numerous plant species of the Myrtaceae family are constantly studied, especially of the genus Eugenia, which presents several fruit species such as Eugenia pyriformis used as phytomedicine and food for wild animals and man. This study aimed to carry out a literature review on phytochemistry, phytomedicine and nutritional content of the fruit of Eugenia pyriformis. A descriptive research was carried out, with keywords as descriptors in Portuguese, English and Spanish. The studies with some relationship with the species E. pyriformis were analyzed. The results showed a considerable number of studies on phenology, conservation, germination, phytochemicals, phytomedicine and nutritionals. However, for food use, there are few reports of work in the development of foods such as whole-grain breads, crackers, cookies, cookies, among others, with the use of pulp as an alternative method, and healthier in the human diet. This bibliographic review instigates the production of new studies mainly for the possible biological and nutritional activities from the fruit of Eugenia pyriformis since, the pulp has expressive contents of phenolic compounds, flavonoids and high antioxidant activity that can be used for human benefit as protection to various pathologies and enriching the diet with products of natural origin. Keywords: Eugenia genus. Nutritional content. Myrtaceae family. Scientia Naturalis, Rio Branco, v. 3, n. 1, p. 345-369, 2021 p. 346 INTRODU\u00c7\u00c3O Myrtaceae \u00e9 uma das maiores fam\u00edlias bot\u00e2nicas, possuindo aproximadamente 3.000 esp\u00e9cies, distribu\u00eddas em cerca de 140 g\u00eaneros. No Brasil, as esp\u00e9cies de Myrtaceae est\u00e3o restritas \u00e0 tribo Myrteae, subdividida classicamente em Myrtinae, Eugeniinae e Myrciinae conforme descrito por Lucas et al. (2005), Wilson et al., (2005) e Alvarez e Silva (2012). V\u00e1rias esp\u00e9cies pertencentes a essa fam\u00edlia, s\u00e3o representantes frut\u00edferas e comest\u00edveis apresentando aroma e sabor agrad\u00e1vel, alguns adocicados e outros a levemente \u00e1cidos como os frutos de uvaia, pitanga, goiaba, jabuticaba, ara\u00e7\u00e1, ara\u00e7\u00e1-roxo, guabiroba, cagaita e cambuci (LAZZAROTTO-FIGUEIR\u00d3 et al., 2020). Estas esp\u00e9cies al\u00e9m de serem fontes de alimentos tanto para a fauna quanto para o homem do campo que colhem os frutos para o beneficiamento industrial, gerando assim uma renda extra para as fam\u00edlias do campo. As esp\u00e9cies do g\u00eanero Eugenia tamb\u00e9m s\u00e3o utilizadas na ornamenta\u00e7\u00e3o e arboriza\u00e7\u00e3o urbana e rural, em bosques, jardins, hortos bot\u00e2nicos e em projetos de inclus\u00e3o e reflorestamento de \u00e1reas degradadas (STIEVEN et al., 2009). O g\u00eanero Eugenia L. \u00e9 considerado um dos maiores e mais complexos g\u00eaneros de Myrtaceae, apresentando not\u00e1vel similaridade entre os t\u00e1xons, onde v\u00e1rias esp\u00e9cies s\u00e3o nativas, com in\u00fameras esp\u00e9cies nos mais variados biomas e dom\u00ednio Cerrado brasileiro. Caracter\u00edstica peculiar desse g\u00eanero \u00e9 a baixa presen\u00e7a em n\u00famero de sementes em seus frutos, o que dificulta o plantio de grandes \u00e1reas com intuito de produ\u00e7\u00e3o em escala comercial internacional, e ainda se observa taxa vari\u00e1vel sobre a germina\u00e7\u00e3o em ambiente natural que \u00e9 considerada baixa (SCALON et al., 2012; SCALON et al., 2014). A esp\u00e9cie Eugenia pyriformis \u00e9 bem conhecida pelos seus frutos comest\u00edveis, de paladar levemente \u00e1cido, sendo conhecida popularmente por \u201cuvaia, uvaieira, uvalha, uvalheira\u201d, e o nome ind\u00edgena iwa\u2019ya significa \u201cfruto \u00e1cido\u201d (MANICA, 2002; SARMENTO et al., 2012). Entre a comunidade bot\u00e2nica, \u00e9 classificada como uma esp\u00e9cie de m\u00e9dio porte arb\u00f3reo apresentando entre 5-15 m de altura; com copa arredondada e alongada; flores solit\u00e1rias e brancas; e frutos de colora\u00e7\u00e3o amarelo-ouro, sendo levemente arom\u00e1tico, do tipo indeiscente, carnoso e piloso, de sabor adocicado e levemente \u00e1cido nas v\u00e1rias fases de matura\u00e7\u00e3o. A esp\u00e9cie \u00e9 facilmente encontrada entre as regi\u00f5es do estado de S\u00e3o Paulo e do Rio Grande do Sul, habitando florestas semidec\u00edduas do planalto e na bacia do rio Paran\u00e1, Brasil (SILVA et al., 2015). Scientia Naturalis, Rio Branco, v. 3, n. 1, p. 345-369, 2021 p. 347 Al\u00e9m do uso paisag\u00edstico, de conserva\u00e7\u00e3o e aliment\u00edcio, E. pyriformis apresenta v\u00e1rios compostos fitoqu\u00edmicos produzidos a partir do seu metabolismo secund\u00e1rio, como por exemplo, \u00f3leo essencial que \u00e9 extra\u00eddo das folhas e dos frutos. O \u00f3leo essencial das folhas apresenta atividade biol\u00f3gica acaricida sobre Tyrophagus putrescentiae e Suidasia pontifica. Al\u00e9m dos \u00f3leos essenciais, o extrato etan\u00f3lico das folhas de E. pyriformis apresenta in\u00fameros compostos fitoqu\u00edmicos descritos no estudo de Silva et al., (2015) onde os pesquisadores observaram atrav\u00e9s de testes qualitativos a presen\u00e7a das classes fitoqu\u00edmicas para alcaloides, antraquinonas, glicos\u00eddeos cardiot\u00f4nicos, flavonoides e taninos. Atividade antioxidante tamb\u00e9m foi descrita em E. pyriformis na redu\u00e7\u00e3o do radical 2,2-difenil-1-picril-hidrazil (DPPH) com resultados expressivos de redu\u00e7\u00e3o a partir do extrato foliar etan\u00f3lico, e concentra\u00e7\u00e3o de inibi\u00e7\u00e3o (CI50) de 2,8 \u00b5g mL-1. O uso de extra\u00e7\u00e3o por flu\u00eddo supercr\u00edtico com g\u00e1s di\u00f3xido de carbono (CO2) foi tamb\u00e9m descrito por Klein et al., (2019) para a extra\u00e7\u00e3o de \u03b1-\u03b2-amirina a partir das folhas, onde obtiveram resultados entre 5,0 a 7,1 g 100 g-1 de \u03b1-amirina e entre 38,5 a 52,9 g 100 g-1 de \u03b2-amirina. No entanto, ainda pouco se conhece sobre esta esp\u00e9cie, e quando se avalia os estudos sobre a polpa do fruto, os trabalhos s\u00e3o ainda mais escassos, carecendo de estudos sobre as in\u00fameras e poss\u00edveis atividades biol\u00f3gicas que podem ser testadas tanto in vitro e ex vivo, bem como, os constituintes fitoqu\u00edmicos e uso aliment\u00edcio no beneficiamento de produtos naturais ricos em compostos nutricionais como cookies, bolachas e p\u00e3o de forma. Este estudo de revis\u00e3o bibliogr\u00e1fica visou avaliar os principais estudos sobre a descri\u00e7\u00e3o da esp\u00e9cie na conserva\u00e7\u00e3o e germina\u00e7\u00e3o, bem como, na fitoqu\u00edmica, fitomedicina com suas atividades biol\u00f3gicas, e poss\u00edveis manifesta\u00e7\u00f5es toxicol\u00f3gicas, e quanto aos valores nutricionais da polpa do fruto de Eugenia pyriformis utilizada na alimenta\u00e7\u00e3o. MATERIAL E M\u00c9TODOS A pesquisa de revis\u00e3o bibliogr\u00e1fica \u00e9 de \u00e2mbito qualitativa e descritiva, com livre per\u00edodo sem especificidade na ordem cronol\u00f3gica de publica\u00e7\u00e3o, visto que, existem trabalhos superiores a 5 anos. A revis\u00e3o foi realizada com base em princ\u00edpios primordiais dando prefer\u00eancia aos artigos cient\u00edficos, bem como, quando pertinentes o uso de disserta\u00e7\u00f5es, teses e livros que tratam sobre o uso dos frutos de Eugenia Scientia Naturalis, Rio Branco, v. 3, n. 1, p. 345-369, 2021 p. 348 pyriformis. Compara\u00e7\u00f5es foram realizadas entre E. pyriformis e outras esp\u00e9cies de Eugenia promovendo uma discuss\u00e3o comparat\u00f3ria. Foram utilizados descritores em Portugu\u00eas, Ingl\u00eas e Espanhol nas buscas: Uvaia, Eugenia pyriformis, Eugenia uvalha, Myrtaceae e Myrtaceas no Brasil, atrav\u00e9s de in\u00fameras bases de dados: peri\u00f3dicos da CAPES, PubMed, Science Direct da Elsevier, Willey on line library, Base de dados da Springer-Nature, Taylor & Francis, infoMED, BVE, Lilacs, Scopus, Latindex, Imbiomed, BMC, SAGE Journals, Hindawi, SciELO, ACS \u2013 American Chemical Society e Google Acad\u00eamico. Ap\u00f3s a sele\u00e7\u00e3o dos resumos, foi realizada a leitura do texto na \u00edntegra para cada material, sobre a descri\u00e7\u00e3o (conserva\u00e7\u00e3o e reprodu\u00e7\u00e3o), fitoqu\u00edmica, atividades biol\u00f3gicas in vitro e in vivo (medicinal), e uso aliment\u00edcio e seu valor nutricional a partir dos frutos de uvaia. O processo metodol\u00f3gico seguiu conforme descrito por Dexheimer e Pozzobon (2017). Descri\u00e7\u00e3o de Eugenia pyriformis A taxonomia vegetal \u00e9 um ramo da Bot\u00e2nica que trata exclusivamente da descri\u00e7\u00e3o (identifica\u00e7\u00e3o, nomeclatura e classifica\u00e7\u00e3o dos vegetais), abrangendo o conhecimento de diversifica\u00e7\u00e3o, diferencia\u00e7\u00e3o e correla\u00e7\u00e3o entre os vegetais, com bases primordiais morfol\u00f3gicas (VIDAL; VIDAL, 2000). Iniciando a breve apresenta\u00e7\u00e3o desta revis\u00e3o bibliogr\u00e1fica, nada mais sensato que realizar e discutir sobre a descri\u00e7\u00e3o de E. pyriformis dentro da fam\u00edlia Myrtaceae e do respectivo g\u00eanero Eugenia. A seguir, est\u00e1 apresentada na Figura 1, fragmento da chave clad\u00edstica de identifica\u00e7\u00e3o para o g\u00eanero Eugenia, em especial E. pyriformis. Scientia Naturalis, Rio Branco, v. 3, n. 1, p. 345-369, 2021 p. 349 Figura 1. Chave de identifica\u00e7\u00e3o do g\u00eanero Eugenia, esp\u00e9cie E. pyriformis. Fonte: Cardoso e Sajo (2004). E. pyriformis Cambess. [sinon\u00edmia: E. uvalha Cambess.] pertencente ao g\u00eanero Eugenia, sendo esta, uma esp\u00e9cie de porte arb\u00f3rea entre 5-15 m de alt., semidec\u00eddua, apresentando casca descamante em seu tronco; as folhas s\u00e3o subcori\u00e1ceas, densamente ser\u00edceas na face abaxial, principalmente nos fol\u00edolos novos, as folhas apresentam tamanho variando entre 4-7 cm de comprimento, com padr\u00e3o de nerva\u00e7\u00e3o campt\u00f3dromo-broquid\u00f3dromo, \u00faltima nerva\u00e7\u00e3o marginal incompleta, bainha perivascular mista, com morfologia do feixe vascular em arco com extremidades fletidas (CARDOSO; SAJO, 2004); as flores s\u00e3o solit\u00e1rias, de colora\u00e7\u00e3o branca e arom\u00e1ticas, apresentando sistem\u00e1tica axilar, com ped\u00fanculo pubescente 2 cm, dicasialtrifloro ou pouco composto, com florada entre agosto a dezembro; os frutos apresentam desenvolvimento pleno entre os meses de setembro a fevereiro (LISB\u00d4A et al., 2011, SILVA et al., 2015; DEOTTI et al., 2019). Ainda sobre os frutos, s\u00e3o esses indeiscentes, drupas globosas, carnosos, suculentos, piriformes, pilosos e colora\u00e7\u00e3o amarelo ouro, como observado na (Figura 2). As sementes possuem tegumento de colora\u00e7\u00e3o castanha, com cotil\u00e9dones carnosos justapostos (SILVA et al., 2015). Scientia Naturalis, Rio Branco, v. 3, n. 1, p. 345-369, 2021 p. 350 Figura 2 - Frutos de Eugenia pyriformis (uvaia), coletados no munic\u00edpio de Rio Verde, Goi\u00e1s, Brasil, em 2020. Fonte: Autor, 2020. Fenologia, conserva\u00e7\u00e3o e processos de germina\u00e7\u00e3o S\u00e3o in\u00fameros os estudos sobre reprodu\u00e7\u00e3o e conserva\u00e7\u00e3o do material gen\u00e9tico de E. pyriformis. V\u00e1rios pesquisadores abordam a conserva\u00e7\u00e3o, armazenamento e germina\u00e7\u00e3o avaliando as sementes mantidas em ambientes com condi\u00e7\u00f5es variadas, avaliando diferentes temperaturas e de n\u00edveis de umidade sob controle, bem como realizam ensaios de viabilidade de emerg\u00eancia em v\u00e1rios processos empregados em outras esp\u00e9cies do g\u00eanero Eugenia. Atrav\u00e9s dessas varia\u00e7\u00f5es, os pesquisadores conseguem avaliar para cada esp\u00e9cie suas condi\u00e7\u00f5es ideais de armazenamento e de germina\u00e7\u00e3o em futuros projetos de conserva\u00e7\u00e3o de material gen\u00e9tico, hibridismo e de preserva\u00e7\u00e3o por longo tempo. De acordo com Mattos (1956) e Reitz et al. (1988), as sementes de uvaia apresentam longevidade com curta dura\u00e7\u00e3o, onde a semeadura deve ser realizada imediatamente ap\u00f3s a coleta e despolpa dos frutos, aumentando assim, a taxa (%) de germina\u00e7\u00e3o, sendo este procedimento simplificado e bem adotado em processos de reflorestamento de \u00e1reas degradadas. Estudos morfol\u00f3gicos s\u00e3o necess\u00e1rios para a caracteriza\u00e7\u00e3o e maior conhecimento sobre a fisiologia de uma semente, com isso, Andrade e Ferreira (2000) avaliaram as caracter\u00edsticas das sementes de E. pyriformis quanto ao peso, germina\u00e7\u00e3o e armazenamento. Os resultados, observados em um lote com mil frutos, apresentou Scientia Naturalis, Rio Branco, v. 3, n. 1, p. 345-369, 2021 p. 351 massa espec\u00edfica de 3,050 g. A contagem de sementes por frutos tamb\u00e9m foi averiguada neste estudo, onde observaram uma m\u00e9dia de duas sementes 81%, de 15% tr\u00eas sementes e com 2% apenas a presen\u00e7a de uma ou quatro sementes. Ainda neste estudo, foi observada uma desuniformidade das sementes que influenciou nos quesitos taxa e tempo de germina\u00e7\u00e3o. Conclu\u00edram que, as sementes que apresentavam tamanho m\u00e9dio foi a que apresentou melhor desempenho de germina\u00e7\u00e3o com menor tempo de emerg\u00eancia. Quanto ao armazenamento em c\u00e2mara fria e seca por 60 dias, foi observada certa perda gradativa com significativa redu\u00e7\u00e3o da porcentagem de umidade no montante de sementes avaliadas, onde ap\u00f3s esse per\u00edodo em c\u00e2mara fria, a taxa de perda de umidade foi = 21,62%, e para c\u00e2mara seca com decr\u00e9scimo = 67,56%. Em ambos os tratamentos, foi observado efeito significativo na emerg\u00eancia das sementes. Para c\u00e2mara seca ap\u00f3s 30 dias de armazenamento, a taxa de germina\u00e7\u00e3o foi reduzida para 91%, em rela\u00e7\u00e3o \u00e0 taxa inicial = 67%. J\u00e1 para c\u00e2mara fria, a taxa de germina\u00e7\u00e3o foi de apenas 16%. Para o per\u00edodo de 60 dias em c\u00e2mara fria, a taxa de germina\u00e7\u00e3o foi superior = 50%, e para c\u00e2mara seca onde a umidade foi reduzida a n\u00edveis inferiores a 20% (30 dias), as sementes perderam completamente a fun\u00e7\u00e3o de germina\u00e7\u00e3o, com 45 dias de armazenamento e teor de umidade = 14%. O processo de germina\u00e7\u00e3o de uvaia apresenta-se lento e desuniforme, se prolongando por at\u00e9 135 dias. Scalon et al., (2004) tamb\u00e9m avaliaram o tempo de armazenamento e de germina\u00e7\u00e3o das sementes de E. pyriformis, onde tamb\u00e9m observaram longo tempo de germina\u00e7\u00e3o, entorno de 200 dias, durante a observa\u00e7\u00e3o do experimento com 0 dias de armazenamento. J\u00e1 para sementes armazenadas com 30 e 120 dias, a taxa de germina\u00e7\u00e3o caiu consideravelmente. A maior germina\u00e7\u00e3o, e o maior \u00edndice de velocidade de emerg\u00eancia (IVE) para sementes armazenadas em c\u00e2mara fria com 60 dias de perman\u00eancia, apresentaram neste estudo, taxa de 65,56% e 0,099, respectivamente. Resultados pr\u00f3ximos aos obtidos no estudo anteriormente citado. Al\u00e9m disso, o uso de subst\u00e2ncias estimulantes de germina\u00e7\u00e3o s\u00e3o potenciais aliados em projetos de conserva\u00e7\u00e3o de esp\u00e9cies. O uso de estimuladores de germina\u00e7\u00e3o como o \u00e1cido giber\u00e9lico (AG), apresentou efeitos positivos, sendo o melhor tratamento na concentra\u00e7\u00e3o de 125 mg L-1 onde obtiveram uma taxa de germina\u00e7\u00e3o = 52,07% e 0,073 de IVE (SCALON et al., 2004). Scientia Naturalis, Rio Branco, v. 3, n. 1, p. 345-369, 2021 p. 352 Em temperatura ambiente, o maior \u00edndice de germina\u00e7\u00e3o aos 90 dias, apresentou taxa = 52,03% e IVE de 0,062, sendo este, o melhor tratamento pr\u00e9-germinativo com estimulante GA na concentra\u00e7\u00e3o de 250 mg L-1 = 39,80% e IVE com m\u00e9dia = 0,044. Esse valor de IVE de acordo com o estudo, n\u00e3o apresentou diferen\u00e7a entre os tratamentos com estimulante para germina\u00e7\u00e3o em temperatura ambiente. Os pesquisadores complementam que, a baixa taxa de germina\u00e7\u00e3o at\u00e9 os 60 primeiros dias de armazenamento sob refrigera\u00e7\u00e3o, para as sementes utilizadas no ensaio, indicaram que, possivelmente poderiam estar imaturas e com baixos teores de giberelina end\u00f3gena. Ap\u00f3s imers\u00e3o destas em AG ou \u00e1gua quente houve a germina\u00e7\u00e3o (SCALON et al., 2004). Ainda, taxas menores de germina\u00e7\u00e3o em sementes de E. pyriformis sob armazenamento por 30 dias foram observadas em ambos os tratamentos com (temperatura ambiente e sob refrigera\u00e7\u00e3o). J\u00e1 para as sementes tratadas com AG com 60 e 90 dias, a taxa de germina\u00e7\u00e3o foi superior. No entanto, as sementes mantidas sob refrigera\u00e7\u00e3o por 90 dias tratadas com AG na conc. 125 mg L-1 n\u00e3o apresentou varia\u00e7\u00e3o significativa com a testemunha, onde taxa de emerg\u00eancia = 91,6%. Por\u00e9m aos 120 dias, a taxa de germina\u00e7\u00e3o caiu mantendo-se pr\u00f3ximo a 50% quando armazenadas sob refrigera\u00e7\u00e3o. No tratamento com temperatura ambiente, a maior emerg\u00eancia foi observada na testemunha; j\u00e1 nas sementes sob refrigera\u00e7\u00e3o, n\u00e3o houve diferen\u00e7a significativa entre as sementes da testemunha e tratada com AG na conc. 250 mg L-1. O m\u00e9todo de imers\u00e3o em \u00e1gua quente avaliado por Scalon et al. (2004), demonstrou n\u00e3o ser uma op\u00e7\u00e3o para sementes de E. pyriformis, pois induziu a uma dorm\u00eancia, onde n\u00e3o foi observado entre os tratamentos sob temperatura ambiente e refrigera\u00e7\u00e3o nenhuma taxa positiva de germina\u00e7\u00e3o, n\u00e3o sendo esta uma poss\u00edvel op\u00e7\u00e3o como j\u00e1 discutido. No estudo de Scalon et al. (2012), os pesquisadores relataram conte\u00fado de \u00e1gua nas sementes de E. pyriformis com 45% (Tu%), os pesquisadores ainda levantaram dados na revis\u00e3o, sobre o conte\u00fado de \u00e1gua em sementes descritas no estudo proposto por Masetto et al., (2008) onde descreveram tamb\u00e9m alto conte\u00fado de \u00e1gua para E. pyriformis = 66,8%. De acordo com Pammenter e Berjak (1999) e Leonhardt et al., (2010) os altos \u00edndices de umidade em sementes durante a maturidade, est\u00e3o intimamente associados a sensibilidade \u00e0 desseca\u00e7\u00e3o e a taxa de germina\u00e7\u00e3o. Este tipo de semente apresenta curta longevidade, germinando logo em seguida, pois sua perman\u00eancia por longo per\u00edodo em Scientia Naturalis, Rio Branco, v. 3, n. 1, p. 345-369, 2021 p. 353 um ambiente com baixa umidade diminui a taxa de emerg\u00eancia influenciando negativamente na sucess\u00e3o da esp\u00e9cie. Al\u00e9m disso, a intoler\u00e2ncia \u00e0 desseca\u00e7\u00e3o est\u00e1 associada aos compostos fitoqu\u00edmicos, armazenamento de mol\u00e9culas insol\u00faveis como \u00e1cidos graxos, no sistema antioxidante que apresenta alta capacidade, no ac\u00famulo de prote\u00ednas e a\u00e7\u00facares e ao sistema de reparo durante a reidrata\u00e7\u00e3o. Ainda no estudo de Scalon et al., (2012) foi observado que as sementes levaram entre 1-4 dias para atingir teores de umidade entre 40 e 30%, sendo considerado uma secagem lenta. Embora, n\u00e3o tenha sido um problema de germina\u00e7\u00e3o nesse estudo. O mesmo foi observado por Justo et al., (2007) onde tamb\u00e9m avaliaram sementes de uvaia com secagem branda, observando em seguida, que houve estimula\u00e7\u00e3o no metabolismo da semente apresentando respostas positivas ultraestruturais similares \u00e0 diferencia\u00e7\u00e3o a n\u00edvel celular ocorrente na germina\u00e7\u00e3o. No entanto, a massa fresca e o comprimento total das pl\u00e2ntulas foram influenciados negativamente pelo processo de desseca\u00e7\u00e3o ao quais as sementes foram submetidas. O mesmo foi observado na mensura\u00e7\u00e3o da ra\u00edz prim\u00e1ria. As sementes s\u00e3o estruturas de reprodu\u00e7\u00e3o de um t\u00e1xon, que em especial, apresentam cuidados devido a sua fragilidade com o meio interno do fruto e externo principalmente em choques mec\u00e2nicos, radia\u00e7\u00e3o, insetos e fungos que podem inviabilizar seu uso em projetos de reflorestamento (Coelho; Ribeiro, 2018). Corroborando com essa discuss\u00e3o, Delgado e Barbedo (2007) em outro estudo, afirmam que as sementes de E. pyriformis s\u00e3o mais sens\u00edveis quando comparadas as outras esp\u00e9cies do g\u00eanero Eugenia, carecendo especial aten\u00e7\u00e3o nos processos germinativos e de sucess\u00e3o da esp\u00e9cie. Os pesquisadores ainda avaliam a viabilidade de germina\u00e7\u00e3o, onde depararam sobre o decaimento da emerg\u00eancia sobre n\u00edveis de perda de \u00e1gua pr\u00f3ximos ou superiores a 65%, sendo que, o teor de \u00e1gua \u00e9 letal, e invi\u00e1vel quando est\u00e1 pr\u00f3ximo e/ou inferior a 15% para esta esp\u00e9cie. Complexidade fitoqu\u00edmica Os vegetais em sua grande composi\u00e7\u00e3o flor\u00edstica, apresentam in\u00fameras classes de compostos fitoqu\u00edmicos importantes tanto para planta quanto para os humanos e animais, que buscam atrav\u00e9s desta, al\u00edvio natural sobre in\u00fameras formas de patologias e como alimentos. Os frutos de in\u00fameras esp\u00e9cies, em especial ao g\u00eanero Eugenia, apresentam em estudos uma rica quantidade de fitocompostos. Esses fitocompostos s\u00e3o fitomol\u00e9culas que muitas das vezes apresentam v\u00e1rias atividades biol\u00f3gicas de grande Scientia Naturalis, Rio Branco, v. 3, n. 1, p. 345-369, 2021 p. 354 interesse farmac\u00eautico, agr\u00edcola, biol\u00f3gico e biotecnol\u00f3gico. \u00c9 a partir da cultura popular desde o Egito antigo, que as plantas v\u00eam sendo utilizadas ora como fitomedicamentos ora como iguarias culin\u00e1rias. Os pesquisadores n\u00e3o fazem simplesmente a busca por um vegetal qualquer, o conceito farmacol\u00f3gico inicial \u00e9 baseado nas culturas principalmente entre as in\u00fameras tribos ind\u00edgenas conhecedoras de inumer\u00e1veis esp\u00e9cies com princ\u00edpios com alto potencial biol\u00f3gico. Da planta tudo se aproveita desde as ra\u00edzes as sementes. E \u00e9 por isso que a import\u00e2ncia desses \u00f3rg\u00e3os vegetais como os frutos torna-se de grande import\u00e2ncia tanto para a sa\u00fade, o bem estar quanto para uma alimenta\u00e7\u00e3o mais saud\u00e1vel e rica em nutrientes, vitaminas e principalmente de compostos fen\u00f3licos e flavonoides. Especial aten\u00e7\u00e3o deve ser dada para os frutos, visto que, devido \u00e0s cores, sabores e atratividade s\u00e3o mais facilmente consumidos por toda a popula\u00e7\u00e3o pelas propriedades funcionais, centesimais e tecnol\u00f3gicas. Com isso, Farias et al., (2020) encontraram a partir de um estudo com frutos de uvaia, onde produziram o extrato a partir da polpa com intuito de verificar quais fitocompostos est\u00e3o presentes nesse \u00f3rg\u00e3o. Foi a partir disso, que in\u00fameros compostos foram identificados como \u00e1cidos org\u00e2nicos: \u00e1cido m\u00e1lico, fragmento de \u00e1cido m\u00e1lico, \u00e1cido succ\u00ednico, \u00e1cido qu\u00ednico. \u00c1cidos cin\u00e2micos: \u00e1cido cin\u00e2mico e \u00e1cido dimetoxi cin\u00e2mico e compostos fen\u00f3licos: \u00e1cido caf\u00e9ico, \u00e1cido cafeoilqu\u00ednico, cafeoil-hexose, \u00e1cido cafeoil metilqu\u00ednico, \u00e1cido coumaroil tart\u00e1rico, \u00e1cido fert\u00e1rico, hexos\u00eddeo de \u00e1cido g\u00e1lico, hexos\u00eddeo de apigenina, cafeato de hexos\u00eddeo de apigenina, hexos\u00eddeo de metilapigenina, di-hexos\u00eddeo de catequina, galocatequina, hexos\u00eddeo de luteonina e miricetina cumaril di-hexos\u00eddeo a partir da t\u00e9cnica de cromatografia l\u00edquida de alta efici\u00eancia (CLAE). S\u00e3o v\u00e1rios os estudos que avaliam os frutos de E. pyriformis em diferentes locais, assim, podemos observar a variedade e teores dos compostos nestes. J\u00e1 no estudo de Haminiuk et al., (2014) os pesquisadores encontraram a presen\u00e7a de flavonoides por CLAE como miricetina (29,5; 22,9; 23,0; nd e 25,4 mg kg-1), quercitina (149,7; 124,0; 114,2; 180,9 e 133,9 mg kg-1) e caempferol (13,4; 2,7; nd; 2,8 e 2,6 mg kg-1) e \u00e1cidos fen\u00f3licos como \u00e1cido g\u00e1lico (346,1; 75,1; 255,8; 299,2 e 215,1 mg kg-1) e \u00e1cido clorog\u00eanico (38,4; 27,2; 33,4; 42,3 e 31,6 mg kg-1), bem como \u00e1cido caf\u00e9ico (5,2 mg kg-1; nd; nd; nd; nd), \u00e1cido p-cum\u00e1rico (1,5; 0,92; 2,9; 1,8 e 1,2 mg kg-1), \u00e1cido fer\u00falico (3,4; 2,3; 2,7; 3,3 e 2,3 mg kg-1) e rutina (1,1; 0,85; 0,83; 1,1 e 0,85 mg kg-1) a partir do extrato dos frutos de E. pyriformis, onde foram produzidos extratos por macera\u00e7\u00e3o Scientia Naturalis, Rio Branco, v. 3, n. 1, p. 345-369, 2021 p. 355 utilizado os solventes, \u00e1lcool met\u00edlico e et\u00edlico, aquoso (\u00e1gua), hidrometan\u00f3lico e hidroetan\u00f3lico, respectivamente. Os \u00f3leos essenciais s\u00e3o uma classe fitoqu\u00edmica muito complexa apresentando variedades de compostos hidrocarbonados, oxigenados, mono, di e sesquiterpenos, fenilpropan\u00f3ides e \u00e1lcoois em concentra\u00e7\u00f5es variadas. Estando tamb\u00e9m presentes entre as esp\u00e9cies de Myrtaceas apresentando composi\u00e7\u00e3o qu\u00edmica rica em terpenos. O \u00f3leo essencial extra\u00eddo das flores e frutos de E. pyriformis \u00e9 rico em terpinen-4-ol com 1,3% e \u03b1-terpineol com 5,4% no fruto. No entanto, relatos demonstraram a presen\u00e7a de limoneno com surpriendentes 12,4% e para \u00f3xido de cariofileno com 16,2%. Entretanto, ambos compostos n\u00e3o s\u00e3o frequentemente observados em esp\u00e9cies de Myrtaceae, sendo E. pyriformis um caso excepcional entre elas (Stieven et al., 2009; Stefanello et al., 2009). Stieven et al. (2009), encontraram teor de \u00f3leo essencial de 1,23% para casca, e de 0,725% na casca com polpa, e de 0,39% para a semente dos frutos de E. pyriformis atrav\u00e9s do m\u00e9todo de hidrodestila\u00e7\u00e3o utilizando aproximadamente 10 g de material previamente refrigerado. Os compostos s\u00e3o vari\u00e1veis e muitos desses facilmente em temperaturas superiores a 25 \u00b0C volatilizam com muita facilidade ou mesmo em contato com a luz podem sofrer oxida\u00e7\u00e3o e/ou a a\u00e7\u00e3o da sazonalidade (URBIZU-GONZ\u00c1LEZ et al., 2017; RAHIMMLEK et al., 2017). Isso \u00e9 observado em in\u00fameros estudos com \u00f3leo essencial, os rendimentos em (%) variam consideravelmente, e a colora\u00e7\u00e3o tamb\u00e9m variando desde incolor a amarelo, isso foi descrito tamb\u00e9m por Stefanello et al., (2009) estudando as folhas de E. pyriformis coletadas na cidade de Curitiba, estado do Paran\u00e1, Brasil, onde encontraram \u00f3leos incolores com rendimentos de 0,02-0,04%. Ainda neste estudo, os pesquisadores avaliaram as flores e frutos de E. pyriformis onde observaram os compostos majorit\u00e1rios limoneno com 12,4% (frutos), Cariofileno E com 22,8% (flores), germacreno D com 15,3% (flores), biciclogermacreno com 8,4% (flores), \u00f3xido de cariofileno com 16,2% (frutos), \u03b1-cadinol com 7,2% e 5,4% (flores e frutos) com total identificado de 89,3% (flores) e de 80,3% (frutos), e a presen\u00e7a majorit\u00e1ria da classe de sesquiterpenos com 82,5% e 51,3%, respectivamente. Uso fitomedicinal, atividades biol\u00f3gicas e toxicol\u00f3gicas Como discutido anteriormente, os vegetais apresentam in\u00fameras classes de fitocompostos como flavonoides, glicos\u00eddeos card\u00edacos, cumarinas, compostos fen\u00f3licos Scientia Naturalis, Rio Branco, v. 3, n. 1, p. 345-369, 2021 p. 356 dentre outras, com formid\u00e1vel uso na fitomedicina. Existem in\u00fameras formas de uso para as drogas vegetais como na forma de extratos, decotos, infus\u00f5es, ch\u00e1s, banhos, p\u00f3 (granulados), c\u00e1psulas, dr\u00e1geas, comprimidos, pomadas, lo\u00e7\u00f5es, suposit\u00f3rios, tinturas, xaropes e pastilhas (TOLEDO et al., 2003; MONTES et al., 2017). No entanto, antes de propor seu uso, \u00e9 necess\u00e1rio exaustivas horas de laborat\u00f3rio sob os in\u00fameros tipos de ensaios in vitro e ex vivo avaliando as in\u00fameras atividades biol\u00f3gicas, bem como suas intera\u00e7\u00f5es e poss\u00edveis efeitos toxicol\u00f3gicos (LAZZAROTTO-FIGUEIR\u00d3 et al., 2020). E. pyriformis apresenta v\u00e1rios estudos sobre uso fitomedicinal, a\u00e7\u00f5es biol\u00f3gicas e toxicol\u00f3gicas. No estudo de Farias et al., (2020) os pesquisadores observaram importantes resultados quanto ao quantitativo de compostos fen\u00f3licos e de flavonoides totais para polpa e semente de E. pyriformis com resultados de 49,36/237,44 mg EAG 100 g-1 e de 6,49/101,46 mg equivalente em catequina 100 g-1 em base seca, respectivamente. J\u00e1 para atividade antioxidante, foram avaliados tr\u00eas modelos radicalares DPPH com resultados de 51,20/235,02 \u00b5M Trolox 100 g-1, TEAC de 83,39/427,86 \u00b5M Trolox 100 g-1 e para ORAC de 49,24/98,58 \u00b5M Trolox 100 g-1, respectivamente para polpa e semente em base seca. Bianchini et al., (2020) tamb\u00e9m avaliaram E. pyriformis, onde encontraram potencial a partir dos resultados do teor de compostos fen\u00f3licos totais com valores de 225,84; 247,50 e 59,17 mg EAG 100 g-1, flavonoides totais de 7,70; 8,20 e 5,09 mg expressos em rutina 100 g-1, atividade antioxidante atrav\u00e9s dos modelos radicalares para FRAP de 406,67; 498,34 e 520,17 mM em Trolox 100 g-1, para ABTS+ com 184,84; 232,18 e 270,01 mM em Trolox 100 g-1, conte\u00fado de vitamina C expresso em \u00e1cido asc\u00f3rbico de 7,50; 2,24 e inferior ao limite de detec\u00e7\u00e3o de 0,041 mg 100 g-1 e para caroten\u00f3ides totais expressos em \u03b2-caroteno de 1,40; 1,68 e 1,63 mg \u03b2-caroteno 100 g-1, respectivamente para a polpa do fruto controle, 85 \u00b0C 1 min. e 85 \u00b0C 5 min., respectivamente. O extrato da polpa do fruto de uvaia apresenta a\u00e7\u00e3o antiinflamat\u00f3ria relatada nos estudos de Pereira et al., (2012) e Ramirez et al., (2012) avaliados em modelos in vitro e in vivo, bem como atividade antimicrobiana (STIEVEN et al., 2009; CHAVASCO et al., 2014) e formid\u00e1vel atividade antioxidante devido aos bons resultados obtidos nos v\u00e1rios modelos radicalares discutidos anteriormente e a seguir. A polpa de uvaia foi verificada tamb\u00e9m quanto aos teores de compostos fen\u00f3licos por Silva et al., (2014). Neste estudo, os pesquisadores obtiveram teores Scientia Naturalis, Rio Branco, v. 3, n. 1, p. 345-369, 2021 p. 357 expressivos de \u00e1cido g\u00e1lico de 0,193 g kg-1, um derivado de \u00e1cido g\u00e1lico com 0,148 g kg-1, \u00e1cido trigaloil lactonizado com 0,138 g kg-1 e de \u00e1cido dicaf\u00e9ico com 0,002 g kg-1. O mesmo foi observado por Sganzerla et al., (2019) onde observaram que o extrato hidroetan\u00f3lico da polpa do fruto apresentou maior conte\u00fado total de fen\u00f3licos de 4,333 g EAG kg-1, com conte\u00fado de flavonoides totais de 0,012 g expressos em quercetina kg-1, e para atividade antioxidante verificada atrav\u00e9s dos m\u00e9todos de redu\u00e7\u00e3o do DPPH igual a 73,88 g TEAC kg-1, e para ABTS+ de 9,235 g TEAC kg-1. Os frutos t\u00eam chamado \u00e0 aten\u00e7\u00e3o dos pesquisadores quanto a sua capacidade antioxidante observada em algumas esp\u00e9cies reativas como o oxig\u00eanio (ROS), radicais peroxila (ROO) e hidroxila (HO), per\u00f3xido de hidrog\u00eanio (H2O2), peroxinitrito (HOONO) e radicais super\u00f3xido (O2-) (KWON et al., 2010; TAKAO et al., 2015). Em outro estudo realizado por Sganzerla et al., (2018) foram avaliados os extratos aquoso, etan\u00f3lico e hidroetan\u00f3lico 70% da polpa dos frutos de E. pyriformis para determina\u00e7\u00e3o dos conte\u00fados de fen\u00f3licos e flavonoides totais, onde foram observados importantes resultados de 34,70 e 0,04; 107,14 e 0,16, e de 189,41 e 0,42 mg EAG 100 g-1 e expressos em mg de quercitina 100 g-1, respectivamente. J\u00e1 para os modelos de antioxidantes DPPH, ABTS+ e FRAP foram obtidos resultados de 249,45; 579,03 e 1600,50 mg Trolox (TEAC) 100 g-1, 27,00; 140,66 e 342,11 mg Trolox (TEAC) 100 g-1 e de 64,74; 243,11 e 227,99 mg Trolox (TEAC) 100 g-1 de polpa, respectivamente. A maior capacidade antioxidante foi observada para os modelos DPPH e ABTS+. Ainda neste estudo, os pesquisadores avaliaram os extratos da polpa dos frutos de uvaia sobre E. coli, Klebsiella pneumoniae, S. aureus e Shigella dysenteriae, no entanto, n\u00e3o foram observados nenhuma taxa de inibi\u00e7\u00e3o contra estes pat\u00f3genos, sendo este resistentes aos extratos testados. Importante efeito bacteriost\u00e1tico foi sugerido por Stieven et al., (2009) onde avaliaram o \u00f3leo essencial (OE) da casca, casca com polpa e semente, e os extratos etan\u00f3lico (EE), hidroetan\u00f3lico 80% e aquoso (EA) constitu\u00eddos por (casca, casca com polpa e sementes) dos frutos de E. pyriformis sobre as cepas de Enterococcus faecalis, E. coli, Staphylococcus aureus e Pseudomonas aeruginosa. Para o OE, EE, EA foram observadas atividades antibacterianas para E. faecalis, E. coli e S. aureus. Nenhuma amostra de OEs e dos extratos apresentaram atividade bactericida para P. aeruginosa, em diferentes per\u00edodos de tempo, onde alguns resultados foram positivos e negativos conforme o tempo de ensaio e perman\u00eancia do OE na amostra. Essa varia\u00e7\u00e3o se d\u00e1 pela Scientia Naturalis, Rio Branco, v. 3, n. 1, p. 345-369, 2021 p. 358 volatiliza\u00e7\u00e3o das mol\u00e9culas de monoterpenos, diterpenos, sesquiterpenos e fenilpropan\u00f3ides, visto que, temperaturas superiores a 25 \u00b0C provocam a perda por escape dessas mol\u00e9culas de diferentes pesos moleculares (Rocha et al., 2000. Rad\u00fcnz et al., 2006). Al\u00e9m desses usos, a uvaia apresenta tamb\u00e9m como preventivo em diversos tipos de doen\u00e7as cr\u00f4nicas (SALVADOR et al., 2011; PEREIRA, 2014). Os compostos fen\u00f3licos entre outros grupos de fitocompostos apresentam in\u00fameras fitomol\u00e9culas com potencial efeito bacteriost\u00e1tico, fungist\u00e1tico e antiviral, entre outras a\u00e7\u00f5es de interesse farmac\u00eautico. A import\u00e2ncia de se estudar os meios de extra\u00e7\u00e3o, solventes de polaridades diferentes, an\u00e1lise, separa\u00e7\u00e3o e isolamento dos compostos de interesse farmac\u00eautico, bem como a pr\u00f3pria hist\u00f3ria dos primeiros povos como as culturas ind\u00edgenas que utilizam na alimenta\u00e7\u00e3o, rituais e em patologias, que influenciam consideravelmente no conhecimento das plantas, s\u00e3o dois fatores intimamente ligados, onde h\u00e1 a uni\u00e3o entre o pesquisador e os povos trabalhando conjuntamente proporcionando maior conhecimento sobre os vegetais (GALANAKIS et al., 2013; PEREIRA et al., 2020). As plantas naturalmente s\u00e3o capazes de produzirem diferentes subst\u00e2ncias t\u00f3xicas em grande quantidade, aparentemente para sua defesa contra v\u00edrus, bact\u00e9rias, fungos, animais e insetos predadores. No entanto, a atividade toxicol\u00f3gica varia conforme o organismo entre os animais e humanos. O fruto de uvaia j\u00e1 \u00e9 bem caracterizado quanto a sua toxicidade para o ser humano, no entanto, essa caracteriza\u00e7\u00e3o ainda \u00e9 pouco estudada entre os animais dom\u00e9sticos (Fonseca; Pereira, 2004). Embora, houve casos de intoxica\u00e7\u00e3o por ingest\u00e3o de frutos de uvaia por ovinos descrito no estudo de Emmerich et al., (2014) onde observaram entre os indiv\u00edduos intoxicados a presen\u00e7a dos sintomas de convuls\u00e3o, andar em c\u00edrculos, opist\u00f3lomo e cegueira, e com a evolu\u00e7\u00e3o do quadro cl\u00ednico para convuls\u00f5es intermitentes, eutan\u00e1sia in extremis e \u00f3bito, no entanto, os frutos de uvaia s\u00e3o seguros para alimenta\u00e7\u00e3o. Aplicabilidade na alimenta\u00e7\u00e3o e conte\u00fados nutricionais A diversifica\u00e7\u00e3o por culturas de frut\u00edferas nativas nos mais variados biomas e no dom\u00ednio Cerrado brasileiro, tornou-se de grande interesse pela diversibilidade de aumentando assim as alternativas por alimentos mais saud\u00e1veis refletido na nova concep\u00e7\u00e3o dos consumidores, que passaram nos \u00faltimos anos por v\u00e1rios processos, sendo um deles a procura por alimentos mais saud\u00e1veis e uma nutri\u00e7\u00e3o rica em Scientia Naturalis, Rio Branco, v. 3, n. 1, p. 345-369, 2021 p. 359 compostos indispens\u00e1veis para a manuten\u00e7\u00e3o de um organismo mais pr\u00f3ximo do natural, diminuindo assim o uso de alimentos industrializados (NASCIMENTO, 2008; KRUMREICH et al., 2016). O fruto de uvaia neste sentido apresenta potencial e \u00e9 um forte candidato a pesquisas no desenvolvimento de novos produtos aliment\u00edcios com caracter\u00edsticas naturais, minerais, vitaminas e em complexas fitomol\u00e9culas com excepcional atividade antioxidante (FARIAS et al., 2020). Nos estudos a seguir, est\u00e3o descritos v\u00e1rios ensaios quanto as caracter\u00edsticas nutricionais descritas, como no estudo de Farias et al., (2020) onde determinaram a composi\u00e7\u00e3o centesimal e mineral da polpa e sementes dos frutos maduros de uvaia, onde encontraram para umidade teores de 91,75% e 88,54%, cinzas de 3,63% e 2,18%, lip\u00eddios de 2,95% e 1,50%, prote\u00ednas de 17,85% e 12,08%, fibras totais de 46,11% e 28,68%, a\u00e7\u00facares totais de 29,46% e 55,56%, respectivamente. J\u00e1 para os teores de minerais foram observados os elementos majorit\u00e1rios Mg com 124,40 e 81,87 mg 100 g-1, e para K com 1.557,61 e 952,68 mg 100 g-1. Os demais minerais podem ser observados na Tabela 1. Tabela 1 - Teores de demais minerais presentes na polpa e sementes dos frutos de Eugenia pyriformis. Minerais Polpa* Sementes* Ca 63,87 23,29 Fe 3,80 3,55 Zn 3,07 2,49 Cu 0,99 1,14 Mn 2,06 0,74 Na 91,21 69,71 *Minerais expressos em mg 100 g-1 em material seco. Fonte: Farias et al., (2020). O conte\u00fado de minerais tamb\u00e9m foi determinado por Silva et al. (2018) em polpas de frutas de E. pyriformis colhidas em duas popula\u00e7\u00f5es no munic\u00edpio de Sales\u00f3polis, estado de S\u00e3o Paulo, Brasil, onde apresentaram expressivos conte\u00fados de K com 99,14 mg 100 g-1, Mg com 5,65 mg 100 g-1 e de 7,59 mg 100 g-1 para Ca. J\u00e1 em outro estudo de Silva et al. (2019) os pesquisadores descreveram conte\u00fados minerais para Fe de 5,53 mg 100 g-1, Cu de 1,38 mg 100 g-1, Zn de 2,13 mg 100 g-1 e Mn de 3,05 mg 100 g-1. De acordo com os pesquisadores, a ingest\u00e3o di\u00e1ria de 100 g da por\u00e7\u00e3o comest\u00edvel do fruto de uvaia, fornece uma ingest\u00e3o di\u00e1ria recomendada para o organismo de um adulto com 89% de Mn, 48% de Mg, 44% de Zn, 44% de K, 27% de Fe e 6% de Ca. Esses valores di\u00e1rios s\u00e3o recomendados atrav\u00e9s de uma dieta Scientia Naturalis, Rio Branco, v. 3, n. 1, p. 345-369, 2021 p. 360 recomendada pela ANVISA (2005) e OMS (2007). O conte\u00fado de carboidratos tamb\u00e9m foi avaliado neste estudo, apresentando certa quantidade e diversidade de a\u00e7\u00facares naturais observados na Tabela 2, atrav\u00e9s da t\u00e9cnica de cromatografia acoplada \u00e0 detec\u00e7\u00e3o amperom\u00e9trica pulsada (HPAEC-PAD). Tabela 2 - Quantitativo de poli\u00f3is/a\u00e7\u00facares e oligossacar\u00eddeos na polpa e sementes dos frutos de Eugenia pyriformis. Poli\u00f3is/A\u00e7\u00facares Polpa* Sementes* Glicose 42,39 2,18 Frutose 123,08 7,42 Sacarose 64,40 13,52 Manitol 2,81 7,02 Maltose 0,31 0,44 Oligossacar\u00eddeos Polpa* Sementes* Rafinose - 0,23 1-kestose (GF2) - 0,21 Maltotetraose (G4) 5,28 0,72 *mg 100 g-1 em base seca. (-) n\u00e3o encontrado. Fonte: Farias et al. (2020). No trabalho de Bianchini et al., (2020) os pesquisadores tamb\u00e9m avaliaram polpas de uvaia in natura (controle) e pasteurizadas quanto ao conte\u00fado de a\u00e7\u00facares, onde para frutose, foram obtidos resultados de 2,32; 2,26 e 2,09 g 100 g-1, para glicose de 1,41; 1,34 e 1,27 g 100 g-1 e para sacarose com 0,13; 0,08 e 0,09 g 100 g-1, para controle, 85 \u00b0C 1 min. e 85 \u00b0C 5 min., respectivamente. Observa-se que o teor de frutose na polpa se sobressai sobre os teores de glicose e sacarose, sendo este, o carboidrato predominante. Al\u00e9m disso, foi observado que o processo de pasteuriza\u00e7\u00e3o influencia negativamente nos teores de a\u00e7\u00facares diminuindo assim sua concentra\u00e7\u00e3o. Conforme Mehta (2015) este comportamento \u00e9 normal para carboidratos de baixo peso molecular como mono e dissacar\u00eddeos que apresentam ser suscept\u00edveis \u00e0 degrada\u00e7\u00e3o em processos qu\u00edmicos e t\u00e9rmicos. Os teores de a\u00e7\u00facares tamb\u00e9m n\u00e3o fogem a regra sobre os demais metab\u00f3litos secund\u00e1rios, Silva et al. (2019) avaliaram diferentes cultivares de uvaia, frutos in natura onde observaram teores superiores para frutose entre 4,64 a 6,50 g 100 g-1, glicose entre 4,04 a 5,21 g 100 g-1 e de sacarose entre 1,42 a 8,47 g 100 g-1. A varia\u00e7\u00e3o nas concentra\u00e7\u00f5es apresenta sim, uma acalorada discuss\u00e3o, como abordado nos estudos de Bianchini et al., (2020) e Schimidt et al., (2019) onde complementam que os teores de a\u00e7\u00facares s\u00e3o vari\u00e1veis devido a influencia do clima, regi\u00e3o de cultivo, solo, minerais, estresse, variedade e matura\u00e7\u00e3o dos frutos. Scientia Naturalis, Rio Branco, v. 3, n. 1, p. 345-369, 2021 p. 361 Pode-se dizer tamb\u00e9m que, fatores bi\u00f3ticos e abi\u00f3ticos s\u00e3o fortes moduladores n\u00e3o somente nos conte\u00fados de a\u00e7\u00facares, mas tamb\u00e9m como em todos os par\u00e2metros f\u00edsico-qu\u00edmicos, fitoqu\u00edmicos e nutricionais incluindo cin\u00e9tica de secagem. Isso \u00e9 observado em estudos apresentados a seguir sobre a variabilidade entre composi\u00e7\u00e3o versus proje\u00e7\u00e3o de resultados. A cin\u00e9tica de secagem avaliada por Rigueto et al., (2018) na forma adimensional do conte\u00fado de umidade versus tempo, nas temperaturas de 50, 60, 70 e 80 \u00b0C congeladas, apresentam resultados animadores quanto ao comportamento deste novo produto aliment\u00edcio. Os pesquisadores encontraram para a melhor temperatura de 80 \u00b0C com tempo reduzido de 150 min. Com o aumento da temperatura, foi obtido curvas de cin\u00e9tica de secagem mais inclinadas devido a maior quantidade de calor sob as amostras. No entanto, outras ari\u00e1veis devem ser observadas, como gastos e tempo de produ\u00e7\u00e3o, bem como a preserva\u00e7\u00e3o das caracter\u00edsticas sensoriais e centesimais. Neste estudo, os pesquisadores utilizaram os seguintes modelos matem\u00e1ticos: Modelos de Lewis, Midilli e Kucuk e Page para descrever o comportamento da polpa at\u00e9 ent\u00e3o desconhecida. O modelo de Page apresentou ser a melhor correla\u00e7\u00e3o e o menor erro m\u00e9dio estimado em todas as condi\u00e7\u00f5es ensaiadas. Quanto \u00e0s caracter\u00edsticas f\u00edsico-qu\u00edmicas das polpas congeladas e por processo de termoconvers\u00e3o nas temperaturas de 50, 60, 70 e 80 \u00b0C e in natura, foram observados os seguintes resultados para \u00b0Brix de 7,75; para teor de umidade de 83,2; 83,00; 85,0; 86,48 e 87,53 Tu%; acidez titul\u00e1vel total de 4,0; 4,5; 4,6; 4,6 e 0,7 ATT%; pH de 3,21; 3,19; 3,32; 3,32 e 3,15; teor de cinzas de 2,62; 2,95; 3,24; 3,05 e 0,24 Tcz%; teor de vitamina C expresso em \u00e1cido asc\u00f3rbico de 289,43; 255,52; 165,29; 59,8 e 59,79 mg 100 g-1. Coutinho e Pascolatti (2014) encontraram teor de vitamina C de 93,83 mg 100 g-1 para os frutos de E. pyriformis. O conte\u00fado de vitamina C \u00e9 de espetacular import\u00e2ncia, pois no organismo humano, influencia positivamente no sistema imunol\u00f3gico aumentando assim a resist\u00eancia contra o v\u00edrus da gripe em especial (Nascimento, 2005). Polpas de frutas submetidas a baixas temperaturas tendem conforme descrito por Chambers et al., (1996) a estabilidade nos conte\u00fados de \u00e1cido asc\u00f3rbico, aumentando assim, seu teor de vitamina, e seu an\u00e1logo ocorre em polpas submetidas a altas temperaturas e luminosidade devido aos fitocompostos com caracter\u00edsticas fotossens\u00edveis. Scientia Naturalis, Rio Branco, v. 3, n. 1, p. 345-369, 2021 p. 362 Zillo et al., (2013) avaliaram frutos os uvaia coletados na regi\u00e3o Nordeste do Brasil, onde os resultados dos par\u00e2metros avaliados para polpa in natura quanto congelada, com resultados para pH = 3,15 e 2,97 e caroten\u00f3ides totais = 0,910 e 0,366 \u00b5g de caroten\u00f3ides totais 100 g-1 com diferen\u00e7a significativa em ambos os tratamentos. J\u00e1 para acidez titul\u00e1vel com 10,5% e 1,25% expresso em \u00e1cido c\u00edtrico, teor de vitamina C de 100,73 e 84,47 mg expresso em \u00e1cido asc\u00f3rbico 100 g-1 e s\u00f3lidos sol\u00faveis de 6,26 e 6,00 expressos em \u00b0Brix n\u00e3o apresentaram diferen\u00e7a significativa pelo teste de Tukey com 5% de signific\u00e2ncia. Estudos aplicando adjuvantes como maltodextrina e goma ar\u00e1bica na polpa de uvaia tamb\u00e9m foram desenvolvidos e avaliados por Krumreich et al., (2016) sobre a estabilidade dos compostos bioativos a partir da polpa processada e em p\u00f3. As caracter\u00edsticas dos tr\u00eas produtos acabados, foram avaliadas pela caracteriza\u00e7\u00e3o f\u00edsico-qu\u00edmica para teor de umidade, acidez total, pH, s\u00f3lidos sol\u00faveis expressos em \u00b0Brix, rela\u00e7\u00e3o s\u00f3lidos sol\u00faveis e acidez total, conte\u00fado de carotenoides totais (CT) expressos em \u03b2-caroteno e conte\u00fado de vitamina C expresso em \u00e1cido asc\u00f3rbico, onde foram obtidos os seguintes resultados: para Tu% de 94,60%; 88,42% e 88,78%, ATT% expresso em \u00e1cido c\u00edtrico de 0,46%; 0,57% e 0,52%, pH de 3,16; 3,19 e 3,62, rela\u00e7\u00e3o SST/ATT de 14,35; 24,39 e 25,58, CT de 2211,24 \u00b5g \u03b2-caroteno g-1, 1073,65 \u00b5g \u03b2-caroteno g-1 e 943,01 \u00b5g \u03b2-caroteno g-1, respectivamente para controle, maltodextrina e goma ar\u00e1bica. Em outro estudo de Zillo et al. (2014), os pesquisadores avaliaram a polpa pasteurizada e polpa n\u00e3o-pasteurizada de E. pyriformis, onde n\u00e3o observaram diferen\u00e7a significativa em ambos os tratamentos para pH de 2,96 e 2,97, acidez total de 1,25% e 1,25% expresso em (%) de \u00e1cido c\u00edtrico, luminosidade (L*) de 52,32 e 53,34, anglo hue (h\u00ba) de 78,75 e 79,26, compostos fen\u00f3licos com 4,89 mg EAG 100 mL-1 de polpa in natura, caroten\u00f3ides totais de 0,910 \u00b5g g-1 para polpa n\u00e3o pasteurizada, e de 0,560 \u00b5g g-1 para polpa pasteurizada e para vitamina C, respectivamente. O teor de \u00e1cido asc\u00f3rbico foi de 100,73 mg \u00e1cido asc\u00f3rbico 100 g-1 no fruto in natura, e de 81,67 mg de \u00e1cido asc\u00f3rbico 100 g-1 na polpa processada. Esta queda no valor de acordo com Redy e Love, (1999) e Howard et al. (1999), n\u00e3o necessariamente \u00e9 um problema para o teor de vitamina C no produto, que visa em primeiro lugar o processo de pasteuriza\u00e7\u00e3o garantindo a seguran\u00e7a do produto. Scientia Naturalis, Rio Branco, v. 3, n. 1, p. 345-369, 2021 p. 363 No estudo de Vizzoto et al., (2009) os pesquisadores encontraram expressivo conte\u00fado de \u03b2-caroteno de 4,47expresso em mg \u03b2-caroteno 100 mL-1 no suco da fruta in natura de uvaia. J\u00e1 Franco (2008) e Pavan (2016) citaram a presen\u00e7a de vitaminas A (retinol) 30 mcg, B1 (tiamina) 40 mcg, B2 (riboflavina) 40 mcg e B3 (niacina) 0,500 mg em seus estudos com E. pyriformis. Ainda no estudo de Zillo et al., (2014) os par\u00e2metros f\u00edsico-qu\u00edmicos para s\u00f3lidos totais expressos em \u00baBrix de 7,03 e 6,00, e Croma (C*) com 47,85 e 47,50, apresentaram diferen\u00e7a significativa pelo teste de Tukey com 5% de signific\u00e2ncia em ambos os tratamentos para polpa pasteurizada e n\u00e3o-pasteurizada, respectivamente. Nos ensaios de an\u00e1lise sensorial, a bebida a base da polpa pasteurizada apresentou diferen\u00e7a significativa, no entanto, os provadores avaliaram com notas inferiores quando comparadas a polpa n\u00e3o pasteurizada. No entanto, nos demais resultados para aroma, sabor e impress\u00e3o global n\u00e3o houve diferen\u00e7a estat\u00edstica. Os frutos de E. pyriformis pode tamb\u00e9m ser utilizados na produ\u00e7\u00e3o de vinagre, sorvetes, geleias, doces e na fermenta\u00e7\u00e3o durante a produ\u00e7\u00e3o de vinho (ANDRADE; FERREIRA, 2000; SCALON et al., 2004; DELGADO; BARBEDO, 2007). Silva et al., (2009), produziram uma bebida l\u00e1ctea a base da polpa de uvaia. Os pesquisadores avaliaram por an\u00e1lises microbiol\u00f3gicas a aus\u00eancia de coliforme fecal e total e de Bacillus cereus, no entanto foi observada a presen\u00e7a de mes\u00f3filo aer\u00f3bico, al\u00e9m de an\u00e1lises de ponto cr\u00edtico (PC), ponto cr\u00edtico de controle (PCC) devido \u00e0 produ\u00e7\u00e3o ter sido de forma industrial. Fernandes et al., (2018) desenvolveram um iogurte elaborado com leite bovino, saborizado com polpa de uvaia, onde obtiveram resultados satisfat\u00f3rios para este novo produto aliment\u00edcio conforme Tabela 3. Tabela 3. Par\u00e2metros f\u00edsico-qu\u00edmicos da bebida l\u00e1ctea flavorizada com polpa de Eugenia pyriformis. Tratamentos pH ATT \u00b0Brix L* a* b* 0% de polpa 4,22 0,77 18,00 18,00 49,80 31,40 10% de polpa 4,09 1,03 17,67 43,43 2,08 27,12 15% de polpa 4,08 1,10 16,33 40,33 1,27 25,88 20% de polpa 4,02 1,17 16,50 35,68 0,33 24,60 25% de polpa 3,99 1,25 15,50 37,98 0,20 24,78 ATT: acidez total titul\u00e1vel, S\u00f3lido sol\u00faveis totais determinados em \u00b0Brix, L* luminosidade, a* cromaticidade vermelho/verde, b* azul/amarelo. Fonte: Fernandes et al. (2018). Conforme a Tabela 3, os resultados se encontraram dentro dos par\u00e2metros estabelecidos pela legisla\u00e7\u00e3o vigente (BRASIL, 2000). Os ensaios microbiol\u00f3gicos Scientia Naturalis, Rio Branco, v. 3, n. 1, p. 345-369, 2021 p. 364 apresentaram estarem dentro das normas vigentes para an\u00e1lises microbiol\u00f3gicas coliformes termotolerantes (NMP mL-1) < 3,0 x 10-1 UFC para todos os tratamentos, o mesmo foi observado para a presen\u00e7a de Staphylococcus coagulase positiva (UFC mL-1) < 1,0 x 10-1 e aus\u00eancia de Salmonella. Outros estudos tamb\u00e9m foram elaborados com intuito de produzirem novos produtos \u00e0 base ou flavorizados com polpa de uvaia, como no trabalho de Pavan (2016) onde avaliou as caracter\u00edsticas f\u00edsico-qu\u00edmicas e sensoriais de uma bebida l\u00e1ctea a base de soja com polpa de uvaia. No entanto, os testes sensoriais n\u00e3o apresentaram diferen\u00e7a significativa entre a bebida l\u00e1ctea de soja e incorporada com polpa de uvaia, possivelmente o sabor da soja foi o causador das interfer\u00eancias na avalia\u00e7\u00e3o realizada pelos provadores. Outro estudo tamb\u00e9m realizado com a polpa dos frutos de uvaia avalia sua utiliza\u00e7\u00e3o na harmoniza\u00e7\u00e3o na forma de (geleia) como acompanhamento na picanha de cordeiro, descrita por Deotti et al., (2019). CONCLUS\u00c3O A partir do levantamento de dados, observa-se que, as sementes de Eugenia pyriformis s\u00e3o altamente sens\u00edveis \u00e0 desseca\u00e7\u00e3o, e a redu\u00e7\u00e3o no teor de \u00e1gua, este seja igual ou inferior a 30% j\u00e1 inviabiliza as sementes para germina\u00e7\u00e3o. Outro ponto observado foi que o processo de armazenamento em c\u00e2maras frias e de secagem reduz a viabilidade de emerg\u00eancia quando comparado a produ\u00e7\u00e3o de plantas in natura, esses processos indicam um comportamento conhecido por recalcitrante. Embora, estudos tenham verificado que o armazenamento em c\u00e2mara fria e/ou seca, bem como o uso de \u00e1cido giber\u00e9lico como indutor de germina\u00e7\u00e3o, reduz consideravelmente o tempo m\u00e9dio de emerg\u00eancia em sementes de E. pyriformis. Quanto aos estudos sobre a fitoqu\u00edmica, ainda se observa poucos estudos quanto \u00e0 composi\u00e7\u00e3o qu\u00edmica natural em E. pyriformis, em especial na polpa e sementes do fruto. O mesmo \u00e9 observado apresentando um d\u00e9ficit grande de ensaios biol\u00f3gicos quanto ao uso do \u00f3leo essencial e de extratos do fruto carecendo de mais informa\u00e7\u00f5es cient\u00edficas, principalmente toxicol\u00f3gicas. O mesmo \u00e9 observado na polpa agregada a produtos aliment\u00edcios, visto que, s\u00e3o escassos os estudos no desenvolvimento de produtos com caracter\u00edsticas naturais, visto que, os constituintes nutricionais s\u00e3o bem descritos fornecendo valiosos resultados. Scientia Naturalis, Rio Branco, v. 3, n. 1, p. 345-369, 2021 p. 365 REFER\u00caNCIAS ALVAREZ, A. S.; SILVA, R. J. F. Anatomia foliar de esp\u00e9cies de Eugenia L. (Myrtaceae) oriundas da restinga de Algodoal/Maiandeua-Par\u00e1. INSULA Revista de Bot\u00e2nica, n. 41, p. 83-94, 2012. ANDRADE, R. N. B.; FERREIRA, A. G. Germina\u00e7\u00e3o e armazenamento de sementes de uvaia (Eugenia pyriformis Camb.) \u2013 Myrtaceae. Revista Brasileira de Sementes, v. 22, n. 2, p. 118-125, 2000. ANVISA. Ag\u00eancia Nacional Brasileira de Vigil\u00e2ncia Sanit\u00e1ria. Resolu\u00e7\u00e3o RDC n\u00ba. 269, de 22 de setembro de 2005. Dispon\u00edvel em: http://portal.anvisa.gov.br/documents/33916/394219/RDC_269_2005.pdf/2e95553c-a482-45c3-bdd1-f96162d607b3. Acesso em: 20 out. 2020. ARA\u00daJO, F. F.; NERI-NUMA, I. A.; FARIAS, D. P.; CUNHA, G. R. M. C.; PASTORE, G. M. Wild Brazilian species of Eugenia genera (Myrtaceae) as na innovation hotspot for food and pharmacological purposes. Food Research International, v. 121, p. 57-72, 2019. BIANCHINI, C. B.; ARRIOLA, N. D. A.; SERAGLIO, S. K. T.; COASTA, A. C. O.; RIBEIRO, D. H. B.; KOMATSU, R. A. Influ\u00eancia da pasteuriza\u00e7\u00e3o nas caracter\u00edsticas qu\u00edmicas, f\u00edsicas e microbiol\u00f3gicas de polpa de uvaia (Eugenia pyriformis Cambess). Research, Society and Development, v. 9, n. 7, p. e993975192, 2020. CARDOSO, C. M. V.; SAJO, M. G. Vasculariza\u00e7\u00e3o foliar e a identifica\u00e7\u00e3o de esp\u00e9cies de Eugenia L. (Myrtaceae) da bacia hidrogr\u00e1fica do Rio Tibagi, PR. Revista Brasileira de Bot\u00e2nica, v. 27, n. 1, p. 47-54, 2004. CHAMBERS, S. J.; NIGEL, L.; PLUMB, G. W.; WILLIAMSON, G. Evaluation of the antioxidant properties of a methanolic extract from juice plus fruit and juice plus vegetable (dietary supplements). Food Chemistry, v. 57, n. 2, p. 271-274, 1996. CHAVASCO, J. M.; FELIPHE, B. H. M. P.; CERDEIRA, C. D.; LEANDRO, F. D.; COELHO, L. F. L.; SILVA, J. J. Evaluation of antimicrobial and cytotoxic activities of plant extracts from Southern Minas Gerais Cerrado. Revista do Instituto de Medicina Tropical de S\u00e3o Paulo, v. 56, n. 1, p. 13-20, 2014. COELHO, T. B.; RIBEIRO, V. A. Supera\u00e7\u00e3o de dorm\u00eancia em sementes de jatob\u00e1. Ip\u00ea Agronomic Journal, v. 2, n. 1, p. 14-22, 2018. DELGADO, L. F.; BARBEDO, C. J. Toler\u00e2ncia \u00e0 desseca\u00e7\u00e3o de sementes de Eugenia. Pesquisa Agropecu\u00e1ria Brasileira, v. 42, n. 2, p. 265-272, 2007. DEOTTI, K. M.; PAULA, D. L.; FALICIANO, Y. T. K.; BESSA, M. E. O emprego de frutas nativas na gastronomia: Uvaia. Revista de Gastronomia, v. 1, n. 2, 2019. DEXHEIMER, G. M.; POZZOBON, A. Atividade biol\u00f3gica de plantas da fam\u00edlia Myrtaceae: revis\u00e3o sistem\u00e1tica de artigos entre 1989 e 2015. Revista Cubana de Plantas Medicinales, v. 22, n. 2, 2017. EMMERICH, T.; BORELLI, V.; CARDOSO, T. C.; WISSER, C. S.; WICPOLT, N. S.; BIFF, C. P. Intoxica\u00e7\u00e3o espont\u00e2nea e experimental por frutos de Eugenia uvalha Cambess. (Myrtaceae) em ovinos. Pesquisa Veterin\u00e1ria Brasileira, v. 34, n. 5, p. 438-442, 2014. FARIAS, D. P.; ARA\u00daJO, F. F.; NERI-NUMA, I. A.; DIAS-AUDIBERT, F. L.; DELAFIORI, J.; CATHARINO, R. R.; PASTORE, G. M. Distribution of nutrientes and functional potential in fractions of Eugenia pyriformis: Na underutilized native Brazilian fruit. Food Research International, v. 137, 2020. Scientia Naturalis, Rio Branco, v. 3, n. 1, p. 345-369, 2021 p. 366 FERNADES, K. A.; SANTOS, E. A.; ALVES, L. A. A. S.; RAGHIANTE, F.; BONNAS, D. S. Desenvolvimento de iogurte elaborado com leite bovino, saborizado com uvaia (Eugenia uvalha Cambess.). In: SIMP\u00d3SIO DE SEGURAN\u00c7A ALIMENTAR, DESVENDANDO MITOS, 6. 2018. Gramado. Anais..., Gramado: FAURGS, p. 1-6, 2018. FRANCO G. Tabela de composi\u00e7\u00e3o qu\u00edmica dos alimentos. 9. ed., S\u00e3o Paulo: Atheneu, 2008. FONSECA, C. A.; PEREIRA, D. G. Aplica\u00e7\u00e3o da gen\u00e9tica toxicol\u00f3gica em planta com atividade medicinal. Infarma, v. 16, n. 7-8, p. 51-54, 2004. GALANAKIS, C. M.; GOULAS, V.; TSAKONA, S.; MANAGANARIS, G. A.; GEKAS, V. A knowledge base for the recovery of natural phenols with different solvents. International Journal of Food Properties, v. 16, n. 2, p. 382-396, 2013. HAMINIUK, C. W. I.; PLATA-OVIEDO, M. S. V.; MATTOS, G.; CARPES, S. T.; BRANCO, I. G. Extraction and quantification of phenolic acids and flavonols from Eugenia pyriformis using different solvents. Journal of Food Science and Technology, v. 51, n. 10, p. 2862-2866, 2014. HOWARD, L. A.; WONG, A. D.; PERRY, A. K.; KLEIN, B. P. \u03b2-carotene and ascorbic acid retention in fresh and processed vegetables. Journal of Food Science, v. 64, n. 5, p. 929-936, 1999. JACOMINO, A. P.; SILVA, A. P. G.; FREITAS, T. P.; MORAIS, V. S. P. Uvaia \u2013 Eugenia pyriformis Cambess. Exotic Fruits, p. 435-438, 2018. JUSTO, C. F.; ALVARENGA, A. A.; ALVES, E.; GUIMAR\u00c3ES, R. M.; STRANSSBURG, R. C. Efeito da secagem, do armazenamento e da germina\u00e7\u00e3o sobre a micromorfologia de sementes de Eugenia pyriformis Camb. Acta Bot\u00e2nica Bras\u00edlica, v. 21, n. 3, 2007. KLEIN, E. J.; N\u00c1THIA-NEVES, G.; VARDANEGA, R.; MEIRELES, M. A. A.; SILVA, E. A.; VIEIRA, M. G. A. Supercritical CO2 extraction of \u03b1--/\u03b2-amyrin from uvaia (Eugenia pyriformis Cambess.): Effects of pressure and co-solvent addition. The Journal of Supercritical Fluids, v. 153, 2019. KRUMREICH, F.; D\u2019AVILLA, R. F.; FREDA, S. A.; CHIM, J. F.; CHAVES, F. C. An\u00e1lises f\u00edsico-qu\u00edmicas e estabilidade de compostos bioativos presentes em polpa de uvaia em p\u00f3 obtidos por m\u00e9todos de secagem e adi\u00e7\u00e3o de maltodextrina e goma ar\u00e1bica. Revista Tema, v. 13, n. 2, p. 4-17, 2016. KWON, D. Y.; KIM, S. J.; LEE, J. W.; KIM, Y. C. Comparison of hydroxyl radical, peroxyl radical, and peroxynitrite scavenging capacity of extracts and active components from selected medicinal plants. Toxicology Research, v. 26, p. 321-327, 2010. LAZZAROTTO, J.; CAPELEZZO, A. P.; SCHINDLER, M. S. Z.; FOSS\u00c1, J. F. C.; ALBENY-SIM\u00d5ES, D.; ZANATTA, L.; OLIVEIRA, J. V.; DAL MAGRO, J. Antioxidant activity, antibacterial and inhibitory effect of intestinal disaccharidases of extracts obtained from Eugenia uniflora L. seeds. Brazilian Journal of Biology, p. 1-10, 2020. LEONHARDT, C.; CALIL, A. C.; FIOR, C. S. Germina\u00e7\u00e3o de sementes de Myrcia glabra (O. Berg.) D; Legrand e Myrcia palustris DC. \u2013 Myrtaceae armazenadas em c\u00e2mara fria. Iheringia \u2013 S\u00e9rie Bot\u00e2nica, v. 65, n. 1, p. 25-33, 2010. LISB\u00d4A, G. N.; KINUPP, V. F.; BARROS, I. B. I. Eugenia pyriformis (Uvaia). In: Esp\u00e9cies Nativas da Flora Brasileira de Valor Econ\u00f4mico Atual ou Potencial: Plantas para o Futuro - Regi\u00e3o Sul. Bras\u00edlia: MMA, 2011. LUCAS, E. J.; BELSHAM, S. R.; NICLUGHADHA, E. M.; ORLOVICH, D. A.; SAKURAGUI, C. M.; CHASE, M. W.; WILSON, P. G. Phylogenetic patterns in the fleshy-fruited Myrtaceae-preliminary molecular evidence. Plant Systematics and Evolution, v. 251, p. 35-51, 2005. MANICA, I. Frutas nativas, silvestres e ex\u00f3ticas 2: T\u00e9cnicas de produ\u00e7\u00e3o e mercado: feij\u00e3o, figo-da-\u00edndia, fruta-p\u00e3o, jaca, lichia, mangaba. Porto Alegre: Cinco Continentes. 2002. 54 p. Scientia Naturalis, Rio Branco, v. 3, n. 1, p. 345-369, 2021 p. 367 MATOS, J. R. Estudo pomol\u00f3gico dos frutos ind\u00edgenas do Rio Grande do Sul. Porto Alegre: SIPA, 1956. 82 p. MASETTO, T. E.; FARIA, J. M. R.; DAVIDE, A. C.; SILVA, E. A. A. Desiccation tolerance and DNA integrity in Eugenia pleurantha O. Berg (Myrtaceae) seeds. Revista Brasileira de Sementes, v. 30, n. 1, p. 51-56, 2008. MEHTA, B. M. Nutritional and toxicological aspects of the chemical changes of food components and nutrients during heating and cooking. In Cheung PCK (Ed.) Handbook of Food Chemistry, p. 898-932, Berlin: Springer, 2015. MONTES, R. A.; SOUZA, R. O. L.; MORAES, S. R.; MIRANDA, M. G.; FRIEDE, R.; LIMA, A. L. S. Qualidade microbiol\u00f3gica de drogas vegetais utilizadas na fitoterapia popular. Revista Espacios, v. 38, n. 11, p. 1-12, 2017. NASCIMENTO, V. E. Caracteriza\u00e7\u00e3o de plantas de mamey. 53 f. 2008. Disserta\u00e7\u00e3o (Mestrado em Agronomia) - Universidade Estadual Paulista \u201cJ\u00falio de Mesquita Filho\u201d, Jaboticabal, 2008. NASCIMENTO, M. C. Medicamentos, comunica\u00e7\u00e3o e cultura. Ci\u00eancia & Sa\u00fade Coletiva, v. 10, suppl., p. 179-193, 2005. OMS. Organiza\u00e7\u00e3o Mundial da Sa\u00fade. (2007). Reducing salt intake in populations: report of a WHO f\u00f3rum and technical meeting. Dispon\u00edvel em: https://apps.who.int/iris/handle/10665/43653. Acesso em: 20 out. 2020. PAMMENTER, N. W.; BERJAK, P. A review of recalcitrant seed physiology in relation to desiccation-tolerance mechanisms. Seed Science Research, v. 9, n. 1, p. 13-37, 1999. PAVAN, C. R. F. Estudo das caracter\u00edsticas de polpa de uvaia adicionada em iogurte de soja. 64 f. 2012. Trabalho de gradua\u00e7\u00e3o (Engenharia de Alimentos) - Universidade Federal da Fronteira Sul, 2016. PEREIRA, M. C.; STEFFENS, R. S.; JABLONSKI, A.; HERTZ, P. F.; RIOS, A. O.; VIZZOTTO, M. Characterization and antioxidant potential of Brazilian fruits from the Myrtaceae family. Journal of Agricultural and Food Chemistry, v. 60, n. 12, p. 3061-3067, 2012. PEREIRA, M. C.; BOSCHETTI, W.; RAMPAZZO, R.; CELSO, P. G.; HERTZ, P. F.; RIOS, A. D. O Mineral characterization of native fruits from the southern region of Brazil. Food Science Technology, v. 34, p. 258-266, 2014. PEREIRA, E. D.; SANTOS, D. C.; SCHIAVON, M. V.; MUNHOZ, P. C.; VIZZOTTO, M. Compostos bioativos em frutas nativas amarelas-ara\u00e7\u00e1, guabiroba, uvaia, maracuj\u00e1 e buti\u00e1. In: Embrapa Clima Temperado-Resumo em anais de congresso (ALICE). In: ENCONTRO SOBRE PEQUENAS FRUTAS E FRUTAS NATIVAS DO MERCOSUL, 6., 2014, Pelotas. Pelotas: Embrapa Clima Temperado, 189 p. 2014. PEREIRA, A. G.; FRAGA-CORRAL, M.; GARC\u00cdA-OLIVEIRA, P.; JIMENEZ-LOPEZ, C.; LOUREN\u00c7O-LOPES, C.; CARPENA, M.; OTERO, P.; GULL\u00d3N, P.; PRIETO, M. A.; SIMAL-GANDARA, J. Culinary and nutritional value of edible wild plants from Northern Spain rich in phenolic compounds with potential health benefits. Food & Nutrition, v. 11, p. 8493-8515, 2020. RAHIMMALEK, M.; HEIDARI, E. F.; EHTEMAM, M. H.; MOHAMMADI, S. Essential oil variation in Iranian Ajowan (Trachyspermum ammi (L.) Sprague) population collected from different geographical regions in relation to climatic factors. Industrial Crops and Products, v. 95, p. 591-598, 2017. RAD\u00dcNZ, L. L.; MELO, E. C.; BARBOSA, L. C. A.; SANTOS, R. H. S.; BARBOSA, F. F.; MARTINAZZO, A. P. Influ\u00eancia da temperatura do ar de secagem no rendimento do \u00f3leo essencial de hortel\u00e3-comum (Mentha x villosa Hyds). Engenharia na Agricultura, v. 14, n. 4, p. 250-257, 2006. Scientia Naturalis, Rio Branco, v. 3, n. 1, p. 345-369, 2021 p. 368 RAMIREZ, M. R.; SCHNORR, C. E.; FEISTAUER, L. B.; APEL, M.; HENRIQUES, A. T.; MOREIRA, J. C. F. Evaluation of the polyphenolic content, anti-inflammatory and antioxidant activities of total extract from Eugenia pyriformis Cambess (uvaia) fruits. Journal of Food Biochemistry, v. 36, n. 4, p 405-412, 2012. REDY, M. B.; LOVE, M. The impact of food processing on the nutritional quality of vitamins and minerals. Impact of Processing on Food Safety, v. 459, p. 99-106, 1999. REITZ, P.; KLEIN, R. M.; REIS, A. Projeto madeira do Rio Grande do Sul. Porto Alegre: Secretaria da Agricultura e Abastecimento, 1988. 525 p. RIGUETO, C. V. T.; EVARISTO, L. M.; GERALDI, C. A. Q.; COVRE, L. Influ\u00eancia da temperatura de secagem de uvaia (Eugenia pyriformis) em camada de espuma. Engevista, v. 20, n. 4, p. 537-547, 2018. ROCHA, S. F. R.; MING, L. C.; MARQUES, M. O. M. Influ\u00eancia de cinco temperaturas de secagem no rendimento e composi\u00e7\u00e3o do \u00f3leo essencial de Citronela (Cymbopogon winterianus Jowitt). Revista Brasileira de Plantas Medicinais, v. 3, n. 1, p. 73-78, 2000. RODRIGUES, L. M.; ROMANINI, E. B.; SILVA, E.; PILAU, E. J.; COSTA, S. C.; MADRONA, G. S. Uvaia (Eugenia pyriformis Cambess) residue as a source of antioxidants: An approach to ecofriendly extraction. LWT, v. 138, 2020. SARMENTO, M. B.; SILVA, A. C. S.; SILVA, C. S. Recursos gen\u00e9ticos de frutas nativas da fam\u00edlia Myrtaceae no Sul do Brasil. Magistra, v. 24, n. 4, p. 250-262, 2012. SALVADOR, M. J.; LOUREN\u00c7O, C. C.; ANDREAZZA, N. L.; PASCOAL, A. C.; STEFANELLO, M. E. Antioxidant capacity and phenolic content of four Myrtaceae plants of the South of Brazil. Natural Product Communications, v. 6, n. 7, p. 977-982, 2011. SILVA, A. P. G.; SPRICIGO, P. C.; PURGATTO, E.; ALENCAR, S. M.; SARTORI, S. F.; JACOMINO, A. P. Chemical composition, nutritional value and bioactive compounds in six uvaia accessions. Food Chemistry, v. 294, p. 547-556, 2019. SILVA, A. P. B.; ARCHANGELO, A. R.; NEGRI, B. Iogurte de Uvaia. In: 7\u00aa Mostra Acad\u00eamica UNIMEP, 7\u00ba Simp\u00f3sio de Ensino de Gradua\u00e7\u00e3o. Ci\u00eancia, Tecnologia e Inova\u00e7\u00e3o: A universidade e a constru\u00e7\u00e3o do futuro. 2009. SILVA, Y. L.; TAKEMURA, O. S.; SANTOS, S. R. S. R.; ROMAGNOLO, M. B.; J\u00daNIOR, A. L. Triagem fitoqu\u00edmica e avalia\u00e7\u00e3o de propriedades biol\u00f3gicas do extrato alco\u00f3lico das folhas de Eugenia pyriformis Cambess. (Myrtaceae). Arquivos de Ci\u00eancias da Sa\u00fade da UNIPAR, v. 19, n. 3, p. 205-211, 2015. SILVA, A. P. G.; TOKAIRIN, T. O.; ALENCAR, S. M.; JACOMINO, A. P. Characteristics of the fruits of two uvaia populations grown in Sales\u00f3polis, SP, Brazil. Revista Brasileira de fruticultura, v. 40, n. 2, p. 1-7, 2018. SCALON, S. P. Q.; SCALON FILHO, H.; RIGONI, M. R. Armazenamento e germina\u00e7\u00e3o de sementes de uvaia Eugenia uvalha Cambess. Ci\u00eancia e Agrotecnologia, v. 28, n. 6, p. 1228-1234, 2004. SCHMIDT, H. O.; ROCKETT, F. C.; PAGNO, C. H.; POSSA, J.; ASSIS, R. Q.; OLIVEIRA, V. R. Vitamin and bioactive compound diversity of seven fruit species from South Brazil. Journal of the Science of Food and Agriculture, v. 99, n. 7, p. 3307-3317, 2019. SGANZERLA, W. G.; BELING, P. C.; FERREIRA, A. L. A.; AZEVEDO, M. S.; FERRAREZE, J. P.; KOMATSU, R. A. Geographical discrimination of uvaia (Eugenia pyriformis Cambess) by principal component analysis. Journal of the Science and Food and Agriculture, v. 99, n. 15, p. 6778-6787, 2019. Scientia Naturalis, Rio Branco, v. 3, n. 1, p. 345-369, 2021 p. 369 SGANZERLA, W. G.; BELING, P. C.; FERRAREZE, J. P.; KOMATSU, R. A.; NUNES, M. R.; VEECK, A. P. L. Nutritional, physicochemical and antimicrobial properties of uvaia pulp (Eugenia pyriformis Cambess). Communications in Plant Sciences, v. 8, p. 1-7, 2018. STEFANELLO, E. A.; WISNIEWISKI, J. R. A.; SIMIONATTO, E. L.; CERVI, A. C. Composi\u00e7\u00e3o qu\u00edmica e varia\u00e7\u00e3o sazonal dos \u00f3leos essenciais de Eugenia pyriformis (Myrtaceae). Latim American Journal of Pharmacy, v. 28, n. 3, p. 449-453, 2009. SCALON, S. P. Q.; FILHO, H. S.; RIGONI, M. R. Armazenamento e germina\u00e7\u00e3o de sementes de uvaia Eugenia uvalha Cambess. Ci\u00eancia e Agrotecnologia, v. 28, n. 6, p. 1228-1234, 2004. SCALON, S. P. Q.; JEROMINI, T. S.; MUSSURY, R. M.; DRESCH, D. M. Photosynthetic mtabolism and quality of Eugenia pyriformis Cambess. seedlings on substrate function and water levels. Anais da Academia Brasileira de Ci\u00eancias, v. 86, n. 4, p. 2039-2048, 2014. SCALON, S. P. Q.; NEVES, S. E. M.; MASETO, T. E.; PEREIRA, Z. V. Sensibilidade \u00e0 desseca\u00e7\u00e3o e ao armazenamento em sementes de Eugenia pyriformis Cambess. (Uvaia). Revista Brasileira de Fruticultura, v. 34, n. 1, p. 269-276, 2012. STIEVEN, A. C.; MOREIRA, J. J. S.; SILVA, C. F. \u00f3leos essenciais de uvaia (Eugenia pyriformis Cambess): avalia\u00e7\u00e3o das atividades microbiana e antioxidante. Ecl\u00e9tica Qu\u00edmica, v. 34, n. 3, p. 7-13, 2009. TAKAO, L. K.; IMATOMI, M.; GUALTIERI, S. C. J. Antioxidant activity and phenolic content of leaf infusions of Myrtaceae species from Cerrado (Brazilian Savanna). Brazilian Journal of Biology, v. 75, n. 4, p. 848-952, 2015. TOLEDO, A. C. O.; HIRATA, L. L.; BUFFON, M. C. M.; MIGUEL, M. D.; MIGUEL, O. G. Fitoter\u00e1picos: uma abordagem farmacot\u00e9cnica. Revista Lecta, v. 21, n. 1/2, p. 7-13, 2003. URBIZU-GONZ\u00c1LEZ, A. L., CASTILLO-RUIZ, O.; MART\u00cdNEZ-\u00c1VILA, G. C. G.; TORRES-CASTILLO, J. A. Natural variability of essential oil and antioxidants in the medicinal plant Turnera difusa. Asian Pacific Journal of Tropical Medicine, v. 10, n. 2, p. 121-125, 2017. VIDAL, W. N.; VIDAL, M. R. R. Taxonomia Vegetal: cadernos did\u00e1ticos 57. 1. ed. Vi\u00e7osa: Editora da Universidade Federal de Vi\u00e7osa, 2000. 89 p. ZILLO, R. R.; SILVA, P. P. M.; ZANATTA, S.; SPOTO, M. H. F. Par\u00e2metros f\u00edsico-qu\u00edmicos e sensoriais de polpa de uvaia (Eugenia pyriformis) submetidas \u00e0 pasteuriza\u00e7\u00e3o. Bioenergia em Revista: Di\u00e1logos, v. 4, n. 2, p. 2033, 2014. ZILLO, R. R.; SILVA, P. P. M.; ZANATTA, S.; CARMO, L. F.; SPOTO, M. H. F. Qualidade f\u00edsico-qu\u00edmica da fruta in natura e da polpa de uvaia congelada. Revista Brasileira de Produtos Agroindustriais, v. 15, n. 3, p. 293-298, 2013. WILSON, P. G.; O\u2019BRIEN, M. M.; HESLEWOOD, M. M.; QUINN, C. J. Relationships within Myrtaceae sensu lato based on a matK phylogeny. Plant Systematic and Evolution, v. 251, p. 3-19, 2005."}