{"taxa": [{"scientific_name": "curatella americana",
  "compounds": ["quercetina-3-o-\u03b1-l-ramnos\u00eddeo", "quercetina-3-\u03b2-glucopiranos\u00eddeo", "quercetina-3-glucos\u00eddeo", "caempferol", "\u03b2-amirina", "catequina", "quercetina-3-o-galactopiranos\u00eddeo", "quercetina galactoarabinos\u00eddeo", "4'-o-metil-catequina", "epicatequina", "quercetina-3-o-arabinopiranos\u00eddeo", "quercetina-3-\u03b1-ramnopiranos\u00eddeo", "4'-o-metil-catequina-3-o-galato", "procianidina", "apigenina-7-o-\u03b2-glucopiranos\u00eddeo", "foeniculina", "lupeol", "\u00e1cido g\u00e1lico", "caempferol-3-o-(2''-o-e-p-couraroil)-\u03b2-d-glucopiranos\u00eddeo", "\u00e1cido betul\u00ednico", "caempferol-4-\u03b2-glucopiranos\u00eddeo", "caempferol-3-o-(6''-o-e-p-coumaroil)-\u03b2-d-glucopiranos\u00eddeo", "epi-catequina-3-o-galato", "quercetina", "avicularina"], "accepted_name": "Curatella americana", "accepted_species": "Curatella americana", "accepted_genus": "Curatella",
  "inchi_keys": {"lupeol": "MQYXUWHLBZFQQO-QGTGJCAVSA-N"}, "inchi_key_simps": {"lupeol": "MQYXUWHLBZFQQO"}}], "text": "Scientia Naturalis, Rio Branco, v. 3, n. 1, p. 330-344, 2021 p. 330 SCIENTIA NATURALIS Scientia Naturalis, v. 3, n. 1, p. 330-344, 2021 Home page: http://revistas.ufac.br/revista/index.php/SciNat ISSN 2596-1640 Curatella americana uma esp\u00e9cie caracter\u00edstica do Cerrado pouco conhecida: caracter\u00edsticas da sistem\u00e1tica, fenologia, fitoqu\u00edmica e fitomedicinal Antonio Carlos Pereira de Menezes Filho* Instituto Federal de Educa\u00e7\u00e3o, Ci\u00eancia e Tecnologia Goiano, Campus Rio Verde, Goi\u00e1s, Brasil. *astronomoamadorgoias@gmail.com Recebido em: 21/08/2020 Aceito em: 18/02/2021 Publicado em: 20/03/2021 RESUMO Curatella americana esp\u00e9cie de grande ocorr\u00eancia no dom\u00ednio Cerrado, apresenta papel importante tanto para este ambiente de in\u00fameras fitofisionomias, como tamb\u00e9m nos processos fitoter\u00e1picos utilizados pela popula\u00e7\u00e3o para tratamento e cura de in\u00fameras doen\u00e7as. O trabalho objetivou-se realizar uma revis\u00e3o sistem\u00e1tica, fenol\u00f3gica, fitoqu\u00edmica e fitomedicinal de Curatella americana, como poss\u00edvel norteador para novas pesquisas. A revis\u00e3o foi realizada atrav\u00e9s de termos sobre Curatella americana, Dilleniaceae, fitoqu\u00edmica e fitoterapia. Durante a discuss\u00e3o da revis\u00e3o, foi observado que apenas os \u00f3rg\u00e3os a\u00e9reos, em restrito para casca do caule e folhas s\u00e3o utilizados na forma de extratos, fra\u00e7\u00f5es e subfra\u00e7\u00f5es, no entanto, os outros \u00f3rg\u00e3os a\u00e9reo e terrestre n\u00e3o apresentam estudos, bem como para as classes de \u00f3leos essenciais, \u00f3leo-resina e \u00f3leo fixo, que carecem de estudos. Com esta revis\u00e3o, novos trabalhos poder\u00e3o ser realizados visando outras a\u00e7\u00f5es biol\u00f3gicas, bem como diversificar os produtos do metabolismo secund\u00e1rio que o vegetal possa fornecer para novos ensaios in vitro. Palavras-chave: Curatella. Fam\u00edlia Dilleniaceae. Fitoqu\u00edmica. Fitomedicina. Curatella americana a characteristic species of the little-known Cerrado: characteristics of systematics, phenology, phytochemistry and phytomedicine ABSTRACT Curatella americana, a species of great occurrence in the Cerrado domain, plays an important role both for this environment of countless phytophysiognomies, as well as in the phytotherapic processes used by the population to treat and cure numerous diseases. The work aimed to carry out a systematic, phenological, phytochemical and phytomedicinal review of Curatella americana, as a possible guide for further research. The review was carried out using terms about Curatella americana, Dilleniaceae, phytochemistry and herbal medicine. During the discussion of the review, it was observed that only the aerial organs, restricted to stem bark and leaves, are used in the form of extracts, fractions and subfractions, however, the other aerial and terrestrial organs do not present studies, as well as for the classes of essential oils, oil-resin and fixed oil, which need studies. With this review, further work may be carried out aiming at other biological actions, as well as diversifying the secondary metabolism products that the plant can provide for new in vitro assays. Keywords: Curatella. Dilleniaceae Family. Phytochemistry. Phytomedicine. Scientia Naturalis, Rio Branco, v. 3, n. 1, p. 330-344, 2021 p. 331 INTRODU\u00c7\u00c3O O dom\u00ednio Cerrado \u00e9 considerado o segundo maior em \u00e1rea territorial, flora e fauna do Brasil e do mundo, estando atr\u00e1s somente do bioma Amaz\u00f4nico. Este dom\u00ednio apresenta uma diversidade fitofision\u00f4mica rica e diversificada onde h\u00e1 um banco rico em material gen\u00e9tico vegetal que forma a flora end\u00eamica e compartilhada entre outros biomas (SILVA-MORAES et al., 2019; CARVALHO et al., 2010). Bueno et al., (2018) em estudo, cita o Cerrado, onde s\u00e3o descritas mais de 11.000 esp\u00e9cies de vegetais nativos, onde das quais, mais de 4.400 s\u00e3o end\u00eamicas. No entanto, este ambiente natural \u00fanico, vem a cada ano perdendo espa\u00e7o entre as grandes \u00e1reas rurais abertas para o plantio, principalmente de soja e milho, e pelas queimadas, onde muitas das vezes s\u00e3o criminosas (TEIXEIRA et al., 2017). A Fam\u00edlia Dilleniaceae apresenta algumas esp\u00e9cies que est\u00e3o inclu\u00eddas na flora brasileira, onde v\u00e1rias delas, apresentam estudos com in\u00fameras atividades e a\u00e7\u00f5es fitomedicinais como no tratamento da artrite, diabetes, disenteria, hepatite, blenorragia, doen\u00e7as gastrointestinais, age tamb\u00e9m diminuindo os efeitos causados pelos processos inflamat\u00f3rios, anti-hemorroida, antimicrobiana, antif\u00fangica, antioxidante, antitumoral, bem como, age fortalecendo o sistema imunol\u00f3gico e como quimiopreventivo (LIMA et al., 2014). \u00c9 nesse ambiente com incr\u00edveis fitofisionomias que encontramos a \u00fanica esp\u00e9cie do g\u00eanero Curatella, Curatella americana pertencente \u00e0 Fam\u00edlia Dilleniaceae. C. americana \u00e9 popularmente conhecida por \u201clixeira, cajueiro-bravo e sambaiba\u201d, ganhando esses nomes populares pelo uso dom\u00e9stico onde suas folhas s\u00e3o utilizadas na limpeza de pe\u00e7as de alum\u00ednio como panelas, copos dentre outros utens\u00edlios dom\u00e9sticos (BRUNIERA; GROPPO, 2010). Na medicina popular brasileira, o uso das folhas e cascas da \u00e1rvore \u00e9 utilizado no al\u00edvio, tratamento e cura de inflama\u00e7\u00f5es, artrite, bronquite, antiss\u00e9ptico, adstringente e antiulceroso (FUJISHIMA et al., 2018). Este estudo teve por objetivo realizar uma revis\u00e3o sistem\u00e1tica da fenologia, da fitoqu\u00edmica e fitomedicinal de Curatella americana. MATODOLOGIA O estudo de revis\u00e3o foi realizado a partir do levantamento de dados de pesquisas sobre a esp\u00e9cie C. americana. Os termos utilizados para a pesquisa foram \u201cCuratella americana, Fitoqu\u00edmica de Curatella americana, Dilleniaceae, Phytochemical by Scientia Naturalis, Rio Branco, v. 3, n. 1, p. 330-344, 2021 p. 332 Curatella americana, Phytochemistry by Curatella americana. Foram utilizados neste levantamento de dados, artigos, notas t\u00e9cnicas, livros, disserta\u00e7\u00f5es e teses, estas quando presentes durante a busca. RESULTADOS E DISCUSS\u00c3O Fam\u00edlia Dilleniaceae A Fam\u00edlia Dilleniaceae, possui 12 g\u00eaneros e 500 esp\u00e9cies, com porte arb\u00f3reo, arbustivo e subarbustos eretos ou escandentes, lianas lenhosas e raramente ervas (PEREIRA; GOMES-KLEIN, 2007). O g\u00eanero Davilla Vandl., \u00e9 considerado o de maior diversidade dentro desta fam\u00edlia, apresentando cerca de 30 esp\u00e9cies neotropicais com porte de lianas, arbustos eretos ou escandentes com distribui\u00e7\u00e3o desde o M\u00e9xico na Am\u00e9rica do Norte ao Paraguai na Am\u00e9rica do Sul. No Brasil, este g\u00eanero apresenta na regi\u00e3o Nordestina um centro de diversidade. Outro g\u00eanero de import\u00e2ncia \u00e9 o Doliocarpus Roland., que possui ampla distribui\u00e7\u00e3o Neotropical com 48 esp\u00e9cies que apresentam porte de lianas lenhosas apresentando similaridade na distribui\u00e7\u00e3o como observado para Davilla, no entanto, no Brasil, o g\u00eanero apresenta centro de diversidade biol\u00f3gica no bioma Amaz\u00f4nico. Para o g\u00eanero Tetracera Linn., h\u00e1 um n\u00famero consider\u00e1vel com 17 esp\u00e9cies que apresentam desenvolvimento do tipo lianas lenhosas com ocorr\u00eancia Pantropical com esp\u00e9cies principalmente no bioma Amaz\u00f4nico brasileiro. Com menor quantidade de esp\u00e9cies, os g\u00eaneros Pinzona Mart. & Zucc., e Curatella, s\u00e3o chamados de monoespec\u00edficos, onde ambos s\u00e3o compostos por apenas um t\u00e1xon cada uma (PEREIRA; GOMES-KLEIN, 2007). Sistem\u00e1tica e fenologia de Curatella americana Na Figura 1, est\u00e1 apresentado um indiv\u00edduo de C. americana em ambiente de Cerrado t\u00edpico no estado de Goi\u00e1s, Munic\u00edpio de Rio Verde, Brasil. Scientia Naturalis, Rio Branco, v. 3, n. 1, p. 330-344, 2021 p. 333 Figura 1 - Indiv\u00edduo de Curatella americana em ambiente de Cerrado, fitofisionomia sentido restrito, munic\u00edpio de Rio Verde, Goi\u00e1s, Brasil. Fonte: autor, (2020). A seguir est\u00e1 apresentada a chave de identifica\u00e7\u00e3o para a Fam\u00edlia Dilleniaceae e seus g\u00eaneros, em especial Curatella, ao qual est\u00e1 inclu\u00edda a \u00fanica esp\u00e9cie Curatella americana. Chave para os g\u00eaneros 1. \u00c1rvores; carpelos 2, unidos na base.............................................................1. Curatella 1\u2019. Arbustos ou lianas; carpelos 2, livres, ou carpelo 1. 2. Infloresc\u00eancias terminais ou laterais no \u00e1pice dos ramos; s\u00e9palas internas 2, maiores que as externas (2 a 3 vezes no comprimento), acrescentes ao fruto..................2. Davilla 2\u2019. Infloresc\u00eancias ramiflora; s\u00e9palas de tamanho similar.......................3. Doliocarpus C. americana apresenta porte arb\u00f3reo entre 3-5 m de alt.; com ramos tomentosos, quando velhos do tipo glabros com ritidoma descamante (Figura 2, prancha C); a folha apresenta tamanho entre 6-18 cm compr., com largura entre 4-11,5 cm, do tipo cori\u00e1ceo, \u00e1spero, el\u00edptico ou oval, \u00e1pice emarginado ou arredondado, base atenuada, margem denteada quando jovem e sinuosa quando adulta, na face adaxial \u00e9 do tipo esparso flocosa, na face abaxial densamente flocosa; o tipo de nervura lateral \u00e9 entre 10 Scientia Naturalis, Rio Branco, v. 3, n. 1, p. 330-344, 2021 p. 334 a 19, com maior evidencia na face abaxial (Figura 2, prancha A); pec\u00edolo entre 1-2 cm compr., do tipo alado, tomentoso; pan\u00edcula com at\u00e9 8 cm de compr., tomentosa; as flores s\u00e3o actinomorfas, apresentando c\u00e1lice dialiss\u00e9pala persistente de cor verde, corola caduca de colora\u00e7\u00e3o branca dialip\u00e9tala, levemente rosada no per\u00edodo de pr\u00e9-antese, as s\u00e9palas apresentam di\u00e2metro entre 5-7 mm de compr., obovais, glabras; os estames entre 60-80 (polist\u00eamones), com diferencia\u00e7\u00e3o entre filete e antera, basifixos e com abertura das anteras longitudinais (Figura 3, pranchas A, B, C e D), sendo persistentes nos frutos, com di\u00e2metro entre 5-7 mm de compr.; ov\u00e1rio entre 1-2 mm de compr., do tipo glabro; n\u00facula entre 4-6 mm de compr., elips\u00f3ide, densamente pubescente, e sementes entre 3-4 mm de compr., do tipo elips\u00f3ide a oboval. Os frutos s\u00e3o classificados como c\u00e1psula ou n\u00facula, apresentando entre 1-2 sementes por l\u00f3culo (Figura 2, prancha B) (DOS SANTOS; A\u00d1EZ, 2018; BRUNIERA; GROPPO, 2010). Figura 2 - Em (A) parte \u00e1rea, folhas, em (B) frutos e (C) casca do caule de Curatella americana. Fonte: autor, (2020). Na Figura 3, est\u00e1 apresentado esquema da flor e morfoanatomia descritiva de Curatella americana. Scientia Naturalis, Rio Branco, v. 3, n. 1, p. 330-344, 2021 p. 335 Figura 3 - Desenho esquem\u00e1tico floral e suas estruturas em Curatella americana. Em (A) flor completa, (B) gineceu, (C) estames e cortes transversal e longitudinal do ov\u00e1rio em (D). Fonte: Dos Santos e A\u00f1ez, (2018). \u00c9 uma planta semidec\u00eddua, heli\u00f3fila, seletiva xer\u00f3fita, caracter\u00edstica de terrenos secos com dispers\u00e3o descont\u00ednua. C. americana produz grande n\u00famero de sementes entre outubro a dezembro, no entanto, com baixo potencial germinativo (DALMOLIN et al., 2015). C. americana \u00e9 uma esp\u00e9cie caracter\u00edstica de ambientes de savanas, Cerrado sentido restrito, matas de galeria, cerrad\u00e3o, dentre outros (BRUNIERA; GROPPO, 2010). No entanto, Do Amaral et al. (2016), relataram o primeiro encontro da esp\u00e9cie em restingas no litoral da Amaz\u00f4nia. Os pesquisadores complementam que, C. americana pode ser facilmente observada em todo o litoral do Nordeste brasileiro, n\u00e3o havendo registro para os demais trechos de restinga do Sudeste e Sul do Brasil. A dispers\u00e3o das sementes \u00e9 estritamente zooc\u00f3rica, onde foram observadas 56 esp\u00e9cies forrageando indiv\u00edduos de C. americana, das quais, 12 esp\u00e9cies s\u00e3o consideradas potenciais dispersores das sementes, sendo as esp\u00e9cies Diopsittaca nobilis, Patagioenas picazzuro, Myiodinastes maculatus e Volatinia jacarina, sendo estas de maior presen\u00e7a (PASCOTTO et al., 2012). J\u00e1 nos estudos de Purifica\u00e7\u00e3o e Pascotto (2019), foram registradas nove esp\u00e9cies de aves se alimentando dos frutos maduros de C. americana, onde as principais Fam\u00edlias foram Thraupidae e Tyrannidae, este estudo, foi realizado no Parque Estadual da Serra Azul, na regi\u00e3o Leste do estado de Mato Grosso, Brasil. De acordo com Dos Santos e A\u00f1ez (2018), Barbosa et al. (2003), e Lorenzi (2002), o per\u00edodo de flora\u00e7\u00e3o de C. americana varia conforme a regi\u00e3o onde os grupos desta esp\u00e9cie se encontram, estudos descrevem in\u00edcio de flora\u00e7\u00e3o no final do m\u00eas de agosto at\u00e9 outubro, e para a regi\u00e3o do estado de Roraima este per\u00edodo se iniciou em Scientia Naturalis, Rio Branco, v. 3, n. 1, p. 330-344, 2021 p. 336 outubro at\u00e9 abril. Durante este levantamento, foram realizadas imagens fotogr\u00e1ficas de C. americana em \u00e1rea de Cerrado t\u00edpico na regi\u00e3o Sudoeste, munic\u00edpio de Rio Verde no estado de Goi\u00e1s em 2020, onde foram observados grupos de C. americana com flora\u00e7\u00e3o no m\u00eas de junho at\u00e9 setembro. Nos estudos de Ara\u00fajo e Filho (1977), os pesquisadores realizaram minuciosa descri\u00e7\u00e3o sobre a estrutura da madeira de C. americana, com par\u00eanquima apotraqueal, difuso e em numerosas linhas tangenciais, muito finas e onduladas, com poros muito pequenos 0,05 mm, pequenos 0,05-0,1 mm, m\u00e9dios 0,1-0,2 mm e grandes 0,2-0,3 mm, linhas vasculares indistintas na face tangencial e percept\u00edveis na face radial, as perfura\u00e7\u00f5es s\u00e3o simples, \u00e0s vezes m\u00faltiplas, \u00e1reas de perfura\u00e7\u00e3o percept\u00edveis na se\u00e7\u00e3o transversal. Raios finos 0,05 mm, an\u00e9is de crescimento ausentes ou aparentemente indicados pela presen\u00e7a de camadas fibrosas com pequenos poros, e m\u00e1culas medulares ausentes. Vasos com disposi\u00e7\u00e3o difusos, \u00e0s vezes semi-difusos ou em semi-an\u00e9is, solit\u00e1rios, elementos vasculares curtos a muito longos, espessamentos espiralados ausentes, perfura\u00e7\u00e3o simples predominantes e ou \u00e0s vezes m\u00faltipla, conte\u00fado, tilos ausentes, dep\u00f3sitos de goma presentes. Princ\u00edpios fitoqu\u00edmicos e biol\u00f3gicos A C. americana \u00e9 popularmente utilizada na fitomedicina para o tratamento de inflama\u00e7\u00f5es e em processos ulcerog\u00eanicos. Estudos apresentam algumas classes fitoqu\u00edmicas como flavonoides, terpenos, fen\u00f3licos, saponinas e esteroides isolados, dentre outros de grande import\u00e2ncia farmac\u00eautica, biol\u00f3gica e agr\u00edcola (ALEXANDRE-MOREIRA et al., 1999). Nos estudos de Fujishima et al. (2020), os pesquisadores encontraram in\u00fameros compostos atrav\u00e9s de an\u00e1lises por cromatografia l\u00edquida de alta efici\u00eancia (CLAE) como catequina, epicatequina, caempferol-4-\u03b2-glucopiranos\u00eddeo, quercetina-3-\u03b2-glucopiranos\u00eddeo, apigenina-7-O-\u03b2-glucopiranos\u00eddeo, quercetina-3-O-galactopira- nos\u00eddeo, quercetina-3-O-arabinopiranos\u00eddeo, quercetina-3-\u03b1-ramnopiranos\u00eddeo, quercetina, caempferol-3-O-(6\u2019\u2019-O-E-p-coumaroil)-\u03b2-D-glucopiranos\u00eddeo, caempferol-3-O-(2\u2019\u2019-O-E-p-couraroil)-\u03b2-D-glucopiranos\u00eddeo, caempferol e \u00e1cido betul\u00ednico no extrato hidroetan\u00f3lico foliar de C. americana coletadas na cidade de Macap\u00e1, estado do Amap\u00e1, Brasil. Scientia Naturalis, Rio Branco, v. 3, n. 1, p. 330-344, 2021 p. 337 Menezes Filho e Castro (2019) avaliaram o extrato foliar etan\u00f3lico de C. americana coletada no munic\u00edpio de Rio verde, Goi\u00e1s, Brasil, onde encontraram as seguintes classes fitoqu\u00edmicas por os testes qualitativos com presen\u00e7a positiva para \u00e1cidos org\u00e2nicos, a\u00e7\u00facares redutores, alcaloides, antraquinonas, catequinas, deps\u00eddeos e depsidonas, fen\u00f3is, flavonoides, glicos\u00eddeos card\u00edacos e taninos cat\u00e9quicos. O estudo de Henriques e Almeida (2013) encontraram resultados similares ao anterior, em que avaliam os compostos fitoqu\u00edmicos tamb\u00e9m por an\u00e1lises qualitativas avaliando o extrato etan\u00f3lico foliar, onde encontraram a presen\u00e7a de fen\u00f3is, taninos, a\u00e7\u00facares redutores, saponinas, esteroides e triterpenoides e deps\u00eddeos e depsidonas, e alcaloides. As classes de compostos terp\u00eanicos, fen\u00f3is, saponinas e ester\u00f3ides s\u00e3o comumente encontradas em esp\u00e9cies vegetais da Fam\u00edlia Dilleniaceae (RODRIGUES, 2013). Estudos realizados por El-Azizi et al. (1980), os pesquisadores descreveram para a constitui\u00e7\u00e3o qu\u00edmica a partir do extrato foliar de C. americana, os flavonoides avicularina glicos\u00eddeo flavonol e \u00e1cido g\u00e1lico, terpenos, compostos fen\u00f3licos, saponinas e esteroides, j\u00e1 nos estudos de Honda et al. (1990), onde avaliaram grupos de C. americana no estado do Mato Grosso do Sul, Brasil, foram descritos a presen\u00e7a de triterpenoides e esteroides nas folhas, e taninos na casca do caule. Fujishima et al. (2018), encontraram os seguintes compostos, fen\u00f3licos totais, flavonoides, terpenos, saponinas e esteroides, El-Azizi et al., (1980) e Gurni e Kubitzki (1981), identificaram no extrato foliar avicularina, quercetina, quercetina-3-O-galactopiranos\u00eddeo, quercetina galactoarabinos\u00eddeo, quercetina-3-glucos\u00eddeo, quercetina-3-O-\u03b1-L-ramnos\u00eddeo, procianidina, \u03b2-amirina, \u00e1cido betul\u00ednico, lupeol, \u00e1cido g\u00e1lico e foeniculina. A esp\u00e9cie C. americana \u00e9 bem caracterizada quanto \u00e0 produ\u00e7\u00e3o de extratos, apresentando v\u00e1rias classes fitoqu\u00edmicas de grande interesse econ\u00f4mico, que s\u00e3o produzidos naturalmente atrav\u00e9s das in\u00fameras vias metab\u00f3licas que exercem fun\u00e7\u00f5es diretas e indiretas no metabolismo secund\u00e1rio do vegetal. Al\u00e9m disso, dentre as in\u00fameras classes fitoqu\u00edmicas, muitas apresentam importantes a\u00e7\u00f5es como na atividade de redu\u00e7\u00e3o de radicais livres. Fujishima et al. (2018), obtiveram excelentes resultados onde em um estudo avaliando os extratos das folhas de C. americana, encontraram porcentagens de sequestro do radical livre DPPH com at\u00e9 90% de redu\u00e7\u00e3o, com concentra\u00e7\u00e3o de inibi\u00e7\u00e3o de CI50 de 45 \u00b5g mL-1. Os pesquisadores sugerem que a efetividade na a\u00e7\u00e3o de redu\u00e7\u00e3o do radical livre DPPH se deve aos compostos fen\u00f3licos observados no extrato foliar, Scientia Naturalis, Rio Branco, v. 3, n. 1, p. 330-344, 2021 p. 338 citados anteriormente nos v\u00e1rios estudos que avaliam a presen\u00e7a das classes fitoqu\u00edmicas. O mesmo tamb\u00e9m foi observado nos estudos de Lopes et al. (2016), onde encontraram efetiva atividade antioxidante a partir do extrato hidroetan\u00f3lico foliar de C. americana coletadas no estado do Mato grosso, Brasil. Os pesquisadores obtiveram concentra\u00e7\u00e3o de inibi\u00e7\u00e3o com CI50 de 6,0 \u00b5g mL-1 e atividade m\u00e1xima de 96,5% (25 \u00b5g mL-1), quando comparados ao BHT com CI50 18,3 \u00b5g mL-1, e m\u00e1xima atividade de 93,7% (500 \u00b5g mL-1), e para o \u00e1cido asc\u00f3rbico com CI50 de 1,8 \u00b5L mL-1 e m\u00e1xima atividade de 92,3 (10 \u00b5g mL-1). Ainda neste estudo, foram observados conte\u00fados expressivos de fen\u00f3licos totais de 391 mg EAG 100 g-1 e de flavonoides com 59 mg EQ g-1 de extrato seco, e a presen\u00e7a da classe de saponinas. Estudos fitoter\u00e1picos e perspectivas cient\u00edficas Como apresentado anteriormente, a Fam\u00edlia Dilleneaceae, apresenta algumas esp\u00e9cies com caracter\u00edsticas fitoterap\u00eauticas j\u00e1 conhecidas pelos povos antigos e confirmadas em ensaios, apresentados em v\u00e1rios estudos para confirma\u00e7\u00e3o das suas a\u00e7\u00f5es em prol do bem estar e cura de v\u00e1rias patologias tanto em humanos quanto em animais. Fujishima et al. (2020), avaliaram a toxicidade aguda d\u00e9rmica a partir do extrato hidroetan\u00f3lico foliar de C. americana onde encontraram dose limite considerada segura de 2.000 mg kg-1 em um formulado em gel. Neste estudo, n\u00e3o foram observados processos inflamat\u00f3rios, nem eritema, escara, edema e sintomas de toxicidade, bem como, mortalidade ou quaisquer outras rea\u00e7\u00f5es nos animais avaliados, considerando o extrato seguro e n\u00e3o irritante. De Toledo et al. (2015), testaram o extrato, suas fra\u00e7\u00f5es e compostos purificados (isolados) da casca do caule de C. americana, onde observaram importante efeito no extrato bruto e suas fra\u00e7\u00f5es, e em menor atividade para os compostos isolados 4\u2019-O-metil-catequina, Epi-catequina-3-O-galato e 4\u2019-O-metil-catequina-3-O-galato com concentra\u00e7\u00e3o inibit\u00f3ria m\u00ednima CIM, variando entre 31,3 a 125,0 \u00b5g mL-1 sobre as cepas de Candida albicans, Candida tropicalis e Candida parapsilosis. Ainda neste estudo, os pesquisadores avaliaram a a\u00e7\u00e3o citot\u00f3xica in vitro em culturas de c\u00e9lulas Vero, onde para o extrato cru, foi encontrado resultado de 250 \u00b5g mL-1 para citotoxicidade, e para a capacidade hemol\u00edtica em eritr\u00f3citos humanos, o extrato e Scientia Naturalis, Rio Branco, v. 3, n. 1, p. 330-344, 2021 p. 339 fra\u00e7\u00f5es apresentaram baixa toxicidade com resultados de 1,4% (15,6 \u00b5g mL-1) e 8,5% (125 \u00b5g mL-1) para o extrato, e sua fra\u00e7\u00e3o F2 com 5,8% (15,6 \u00b5g mL-1) e 15,2 (125 \u00b5g mL-1), respectivamente. Vilar et al. (2009), tamb\u00e9m observaram em estudo avaliando o extrato etan\u00f3lico da casca do tronco de C. americana, resultados negativos para o ensaio de genotoxicidade, contribuindo assim, para o conhecimento terap\u00eautico quanto ao uso do extrato que pode ser utilizado na fitomedicina com seguran\u00e7a e alta efic\u00e1cia. Ainda, neste estudo, o extrato apresentou baixa atividade citot\u00f3xica nas v\u00e1rias concentra\u00e7\u00f5es testadas. Esta baixa atividade citot\u00f3xica, foi tamb\u00e9m avaliada por Soares et al. (2002), onde observaram col\u00f4nicas sobreviventes de Escherichia coli AB 1157 em concentra\u00e7\u00f5es do extrato etan\u00f3lico das cascas de C. americana. No entanto, os pesquisadores ressaltam que, a cepa E. coli AB 1157 \u00e9 do tipo selvagem em termos de mecanismos de reparo. Al\u00e9m disso, a bact\u00e9ria E. coli contem o profago \u03bb, E. coli WP2s, onde tamb\u00e9m apresenta uma muta\u00e7\u00e3o no gene uvrA, envolvido no reparo por excis\u00e3o de nucleot\u00eddeos, o que torna esta cepa altamente sens\u00edvel a agentes capazes de causar les\u00f5es no DNA (FONSECA et al., 1994). J\u00e1 nos estudos de Guerrero et al. (2002), onde encontraram a dose de 20 mg kg-1 durante a administra\u00e7\u00e3o intravenosa do extrato etan\u00f3lico das partes a\u00e9reas de C. americana, onde observaram excepcional atividade anti-hipertensiva em ratos. Alguns estudos farmacol\u00f3gicos com o extrato das cascas do caule realizados por Alexandre-Moreira (1997) avaliaram a dose letal DL50 do extrato hidroetan\u00f3lico de C. americana em testes com ratos, onde encontraram resultado de 647,1 mg kg-1 i.p. Em estudo posterior, Alexandre-Moreira et al. (1999), encontraram atividades antiinflamat\u00f3ria e analg\u00e9sica peritoneal em ratos administrados com doses vari\u00e1veis de extrato hidroetan\u00f3lico 90% a partir das cascas do caule de C. americana, com dose DL50 de 647 mg kg i.p. Fujishima et al. (2020), n\u00e3o observaram efeitos significativos como agente antimicrobiano avaliando o extrato hidroetan\u00f3lico foliar de C. americana, sobre Staphylococcus aureus com CIM mg mL-1 (> 25) e MBC mg mL-1 (> 2,5), Staphylococcus epidermidis CIM mg mL-1 (2,5) e MBC mg mL-1 (2,5), Escherichia coli CIM mg mL-1 (0,62) e MBC mg mL-1 (> 2,5), Klebsiella pneumoniae CIM mg mL-1 (> 2,5) e MBC mg mL-1 (> 2,5) e Pseudomonas aeruginosa CIM mg mL-1 (> 2,5) e MBC Scientia Naturalis, Rio Branco, v. 3, n. 1, p. 330-344, 2021 p. 340 mg mL-1 (> 2,5). J\u00e1 no estudo de Costa et al. (2008), os pesquisadores avaliaram o extrato etan\u00f3lico de C. americana com resultado positivo apenas para a atividade antimicrobiana, com zona de inibi\u00e7\u00e3o sobre Staphylococcus aureus com 8 mm na dose de 5000 \u00b5g mL-1, n\u00e3o foram observadas atividade antif\u00fangica para Aspergillus flavus, Aspergillus parasiticus, C. albicans, Candida guilliermondii, C. tropicalis, Cephalosporium spp., Microsporum canis, Microsporum gypseum, Penicillium spp., Rhodotorula rubra, Trichophyton mentagrophytes, Trichophyton rubrum e Trichosporon spp.. O extrato etan\u00f3lico das cascas do caule de C. americana, foi avaliado no estudo de Guevara et al. (2011), onde demonstram excepcional atividade antiinflamat\u00f3ria devido a presen\u00e7a de terpenos, observados no experimento de edema auricular induzido por TPA com ratos albinos ICR machos, corroborando com os estudos de Alexandre-Moreira et al., (1999; 1997). Os pesquisadores compararam os bons resultados com o extrato de C. americana com a indometacina apresentando resultados equipar\u00e1veis a droga sint\u00e9tica de refer\u00eancia. Queiroz e De Sousa (2017), avaliaram a estabilidade e microbiologia de um formulado de gel cremoso contendo o extrato hidroetan\u00f3lico foliar de C. americana, onde os resultados foram satisfat\u00f3rios para as caracter\u00edsticas sensoriais, f\u00edsicas, f\u00edsico-qu\u00edmicas e microbiol\u00f3gicas atendidas pela farmacop\u00e9ia brasileira. Em especial, o ensaio microbiano apresentou resultados inferiores ao preconizado tanto para fungos e bact\u00e9rias, demonstrando que o extrato incorporado apresenta efeito antimicrobiano e antif\u00fangico excepcional. Conforme Lopes et al. (2016), os pesquisadores discutem sobre as in\u00fameras a\u00e7\u00f5es farmacodin\u00e2micas biol\u00f3gicas, como antiinflamat\u00f3ria, analg\u00e9sica, anti-hipertensiva, vasodilatadora, antiulcerog\u00eanica, antimicrobiana e hipolipid\u00eamica que C. americana fornece. Os pesquisadores avaliaram o efeito hipoglicemiante a partir do extrato hidroetan\u00f3lico foliar de C. americana em ratos Wistar, onde encontraram resultados promissores. Os n\u00edveis s\u00e9ricos estavam reduzidos para colesterol total e triglicer\u00eddeos de 34% e 45% respectivamente, quando comparados ao controle com ratos hiperlipid\u00eamicos. Os resultados obtidos neste estudo equiparam aos obtidos por drogas comerciais sint\u00e9ticas como ciprofibrato utilizado no controle do colesterol e da sinvastatina utilizada no controle de triglicer\u00eddeos. Scientia Naturalis, Rio Branco, v. 3, n. 1, p. 330-344, 2021 p. 341 In\u00fameros compostos como fen\u00f3is, taninos, a\u00e7\u00facares, saponinas, esteroides e triterpenoides e alcaloides apresentam v\u00e1rias a\u00e7\u00f5es fitoter\u00e1picas como agentes antioxidantes, antibacterianos, analg\u00e9sicos, cicatrizantes, anti-hemorr\u00e1gicos, no tratamento de diarr\u00e9ias, nos processos inflamat\u00f3rios, antiulcerog\u00eanicos, na prote\u00e7\u00e3o contra radia\u00e7\u00e3o ultravioleta UVA, UVB e UVC, e inseticida, bem como, para a prote\u00e7\u00e3o do pr\u00f3prio vegetal, tamb\u00e9m como na alelopatia e na inibi\u00e7\u00e3o de fungos, e animais herb\u00edvoros (HENRIQUES; DE ALMEIDA, 2013). Perspectivas futuras para diversifica\u00e7\u00e3o aos estudos com C. americana, podem apresentar vertentes diferentes ao processo fitoter\u00e1pico, como observados por Barbosa et al. (2008), onde avaliaram o extrato diclorometan\u00f3lico foliar de C. americana com maior poder fitot\u00f3xico quando comparado ao extrato diclorometan\u00f3lico do caule sobre o desenvolvimento de Panicum maximum, sendo posteriormente necess\u00e1rio, o isolamento dos compostos e poss\u00edveis testes alelop\u00e1ticos, para a produ\u00e7\u00e3o de novas mol\u00e9culas capazes de apresentar retardo no desenvolvimento de vegetais invasores, como ervas-daninhas. C. americana tamb\u00e9m apresenta estudos promissores como esp\u00e9cie bioindicadora em regi\u00f5es aur\u00edferas, como relatado por Resende e Pinho (2011), onde avaliaram a esp\u00e9cie em \u00e1rea de jazida de ouro no distrito de Cangas-Pocon\u00e9, estado do Mato Grosso, Brasil. No estudo, os pesquisadores obtiveram resultados indicados atrav\u00e9s de an\u00e1lises pelo m\u00e9todo ICP-EAS onde descrevem forte rela\u00e7\u00e3o entre os teores de minerais como ouro Au e prata Ag em folhas de C. americana, e tamb\u00e9m onde os teores an\u00f4malos gerados por estes elementos marcam claramente as regi\u00f5es de jazidas aur\u00edferas. A C. americana apresenta forte tend\u00eancia para ser investigada em outros processos qu\u00edmicos e biol\u00f3gicos, visto que, nos estudos de De Toledo et al. (2015), os pesquisadores encontraram alto e efici\u00eante processo de rendimento de extrato onde para 1 kg de cascas do caule, foram obtidos 148,79 g de extrato seco, equivalente a 14,88%, para parti\u00e7\u00e3o l\u00edquido-l\u00edquido 120 g, foram obtidos 72,03 g, equivalente a 60,03%, e de 34,17 g a partir da fase aceto-et\u00edlica F2 20,0 g, e onde a partir desta, foram obtidas 19 outras subfra\u00e7\u00f5es por cromatografia em coluna. Novos estudos dever\u00e3o ser realizados avaliando outras a\u00e7\u00f5es como inseticida, fungicida, antiviral, bactericida dentre outras a partir dos extratos e \u00f3leo essencial sendo Scientia Naturalis, Rio Branco, v. 3, n. 1, p. 330-344, 2021 p. 342 produzidos a partir do metabolismo secund\u00e1rio de C. americana, apresentando assim, maior diversidade dos estudos, onde a planta pode ser explorada. CONCIDERA\u00c7\u00d5ES FINAIS Neste levantamento de estudos sobre as caracter\u00edsticas da sistem\u00e1tica, fenologia, fitoqu\u00edmica e fitomedicinal, de Curatella americana, \u00e9 poss\u00edvel observar que a esp\u00e9cie apresenta n\u00famero consider\u00e1vel de estudos, entretanto, ainda s\u00e3o considerados baixo, visto que, s\u00e3o in\u00fameras as a\u00e7\u00f5es que devem ser investigadas partindo de outros modelos biol\u00f3gicos a partir dos extratos das sementes, flores, frutos, folhas, cascas e ra\u00edzes, e em especial aten\u00e7\u00e3o, principalmente aos estudos sobre poss\u00edveis teores de \u00f3leos essenciais, \u00f3leo-resina e \u00f3leo fixo que possivelmente a esp\u00e9cie pode fornecer. Os estudos ainda devem continuar avaliando esta esp\u00e9cie vegetal de peculiar apar\u00eancia e de f\u00e1cil acesso nos mais variados tipos fitofision\u00f4micos do dom\u00ednio Cerrado, dentre outros biomas brasileiros. REFER\u00caNCIAS ALEXANDRE-MOREIRA, M. S.; PIUVEZAM, M. R.; ARA\u00daJO, C. C.; THOMAS, G. Studies on the anti-inflammatory and analgesic activity of Curatella americana L. Journal Ethnopharmacology, v. 67, p. 171-177, 1999. ALEXANDRE-MOREIRA, M. S.. An\u00e1lise fitoqu\u00edmica e avalia\u00e7\u00e3o da atividade antiinflamat\u00f3ria de Curatella americana L. Tese (Doutorado em Farm\u00e1cia) - Universidade Federal da Para\u00edba, Jo\u00e3o Pessoa, Brasil. 1997. ARA\u00daJO, P. A. M.; FILHO, A. M. Estruturas das madeiras brasileiras de Angiospermas dicotiled\u00f4neas (XVIII). Dilleniaceae (Curatella americana L.). Rodrigu\u00e9sia, v. 29, n. 42, p. 233-239, 1977. BARBOSA, C. S.; MAIA, F.; SANTOS, D. Q.; TERRONES, M. G. H. Potencial herbicida do extrato diclometan\u00f3lico de folha da lixeira (Curatella americana L.). In: ENCONTRO INTERNO, 8., SEMIN\u00c1RIO DE INICIA\u00c7\u00c3O CIENT\u00cdFICA, 12., Uberl\u00e2ndia. Anais..., Universidade Federal de Uberl\u00e2ndia, 2008. BARBOSA, R. I.; CASADIO, G. M. L.; SILVA, S. J. R. Fenologia e visitantes florais de Curatella americana L., Byrsonima crassif\u00f3lia (L.) Kunth in H. B. K. e Byrsonima coccolobifolia Kunth in H. B. K. em \u00e1rea de savana aberta de Roraima, norte da Amaz\u00f4nia Brasileira. In: CONGRESSO NACIONAL DE BOT\u00c2NICA, 54., REUNI\u00c3O AMAZ\u00d4NICA DE BOT\u00c2NICA, 3., Bel\u00e9m. Anais..., Bel\u00e9m: Universidade da Amaz\u00f4nia, 2003. BRUNIERA, C. P.; GROPPO, M. Flora da Serrado do Cip\u00f3, Minas Gerais: Dilleniaceae. Boletim de Bot\u00e2nica, v. 28, n. 1, p. 59-67, 2010. BUENO, M. L.; OLIVEIRA-FILHO, A. T.; PONTARA, V.; POTT, A.; DAMASCENO-J\u00daNIOR, G. A. Flora arb\u00f3rea do Cerrado de Mato Grosso do Sul. Iheringia, v. 73, supl., p. 53-64, 2018. Scientia Naturalis, Rio Branco, v. 3, n. 1, p. 330-344, 2021 p. 343 CARVALHO, M. B.; ISHARA, K. L.; MAIMONI-RODELLA, R. C. S. Vascular flora of a Cerrado sensu stricto remnants in Prat\u00e2nia, state of S\u00e3o Paulo, southeastern Brazil. Check List, Journal of Species Lists and Distribution, v. 6, n. 3, p. 350-357, 2010. COSTA, E. S.; HIRUMA-LIMA, C. A.; LIMA, E. O.; SUCUPIRA, G. C.; BERTOLIN, A. O.; LOLIS, S. F.; ANDRADE, F. D. P.; VILEGAS, W.; SOUZA-BRITO, A. R. M. Antimicrobial activity of some medicinal plants of the Cerrado, Brazil. Phytotherapy Research, v. 22, p. 705-707, 2008. DALMOLIN, \u00c2. C.; THOMAS, S. E. O.; ALMEIDA, B. C.; ORT\u00cdZ, C. E. R. Altera\u00e7\u00f5es morfofisiol\u00f3gicas de plantas jovens de Curatella americana L. submetidas ao sombreamento. Revista Brasileira de Bioci\u00eancias, v. 13, n. 1, p. 41-48, 2015. DE TOLEDO, C. E. M.; SANTOS, P. R.; DE MELLO, J. C. P.; FILHO, B. P. D.; NAKAMURA, C. V.; UEDA-NAKAMURA, T. Antifungal properties of crude extracts, fractions, and purified compounds from bark of Curatella americana L. (Dilleniaceae) against Candida species. Evidence-Based Complementary and Alternative Medicine, v. 2015, p. 1-9, 2015. DO AMARAL, D. D.; NETO, S. V. C.; JARDIM, M. A. G.; DOS SANTOS, J. U. M.; BASTOS, M. N. C. Curatella americana L. (Dilleniaceae): primeira ocorr\u00eancia nas restingas do litoral da Amaz\u00f4nia. Revista Brasileira de Bioci\u00eancias, v. 14, n. 4, p. 257-262, 2016. DOS ASNTOS, R. A.; A\u00d1EZ, R. B. S. Aspectos da biologia floral de Curatella americana L. (Dilleniaceae), em um fragmento de Cerrado antropizado, Tangar\u00e1 da Serra, MT. Flovet \u2013 Boletim do Grupo de Pesquisa da Flora, Vegeta\u00e7\u00e3o e Etnobot\u00e2nica, v. 1, n. 10, p. 22-36, 2018. EL-AZIZI, M. M., ATEYA, A. M., SVOBODA, G. H., SCHIFF JR., P. L., SLATKIN, D. J., KNAPP, J. E. Chemical constituents of Curatella americana (Dilleniaceae). Journal of Pharmaceutical Sciences, v. 69, p. 360-361, 1980. Fonseca, C. A. S.; Leal, J.; Costa, S. S.; Leit\u00e3o, A. C. Genotoxic and mutagenic effects of guaran\u00e1 (Paullinia cupana) in prokaryotic organisms. Mutation Research/Genetic Toxicology, v. 321, n. 3, p. 165-173, 1994. FUJISHIA, M. A. T.; DA SILVA, N. S. R.; RAMOS, R. S.; FERREIRA, E. F. B.; DOS SANTOS, K. L. B.; DA SILVA, C. H. T. P.; DA SILVA, J. O.; ROSA, J. M. C.; DOS SANTOS, C. B. R. Na antioxidant potential, quantum-chemical and molecular docking study of the major chemical constituents present in the leaves of Curatella americana Linn. Pharmaceuticals, v. 1, 2018. FUJISHIMA, M .A. T.; S\u00c1, D. M. C.; LIMA, C. M. S.; BITTENCOURT, J. A. H. M.; PEREIRA, W. L. A.; MURIBECA, A. J. B.; YOSHIOKA E SILVA, C. Y.; DA SILVA, M. N.; DE SOUSA, F. F. O.; DOS SANTOS, C. B. R.; DA SILVA, J. O. Chemical profiling of Curatella americana Linn leaves by UPLC-HRMS and its wound healing activity in mice. Plos One, v. 15, n. 1, p. e0225514, 2020. GUERRERO, M. F.; PUEBLA, P.; CARR\u00d3N, R.; MART\u00cdN, M. L.; ARTEAGA, L.; SAN ROM\u00c1N, L. Assessment of the antihypertensive and vasodilatador effects of ethanolic extracts of some Colombian medicinal plants. Journal of Ethnopharmacology, v. 80, n. 1, p. 37-42, 2002. GUEVARA, M. C. G.; GIRALDO, L. F. O.; VELANDIA, J. R. Actividad antiinflamatoria de extractos y fracciones de Myrcianthes leucoxila, Calea prunifolia, Curatella americana y Physalis peruviana em los modelos edema auricular por TPA, edema plantar por carragenina y artritis inducida por col\u00e1geno. Biosalud, v. 10, n. 1, p. 9-18, 2011. GURNI, A. A.; KUBITZKI, K. Flavonoid chemistry and systematics of the Dilleniaceae. Biochemical Systematics and Ecology, v. 9, n. 2-3, p. 109-114, 1981. HENRIQUES, S. V. C.; ALMEIDA, S. S. M. S. Identifica\u00e7\u00e3o do car\u00e1ter medicinal da esp\u00e9cie Curatella americana por meio das folhas. Esta\u00e7\u00e3o Cient\u00edfica, v. 3, n. 2, p. 89-97, 2013. Scientia Naturalis, Rio Branco, v. 3, n. 1, p. 330-344, 2021 p. 344 HIRUMA-LIMA, C. A.; RODRIGUES, C. M.; KUSHIMA, H.; MORAES, T. M.; LOLIS S. F.; FEITOSA, S. B.; MAGRI, L. P.; SOARES, F. R.; COLA, M. M.; ANDRADE, F. D. P.; VILEGAS, W.; BRITO, A. R. M. S. The anti-ulcerogenic effects of Curatella americana L. Journal of Ethnopharmacology, v. 121, p. 425-432, 2009. HONDA, N. K., GARCEZ, W. S., GARCEZ, F. R., CONCEI\u00c7\u00c3O, C. A. Estudo qu\u00edmico de plantas de Mato Grosso do Sul. I. triagem fitoqu\u00edmica. Revista Cient\u00edfica e Cultural, v. 5, p. 37-46, 1990. LIMA, C. C.; LEMOS, R. P. L.; CONSERVA, L. M. Dilleniaceae family: an overview of its Ethnomedicinal uses, biological and phytochemical profile. Journal of Pharmacognosy and Phytochemistry, v. 3, n. 2, p. 181-204, 2014. LOPES, R. H. O.; MACORINI, L. F. B.; ANTUNES, K. A.; DE TOLEDO ESPINDOLA, P. P.; ALFREDO, T. M.; DA ROCHA, P. D. S.; PEREIRA, Z. F.; DOS SANTOS, E. L.; DE PICOLI SOUZA, K. Antioxidant and hypolipidemic activity of the hydroethanolic extract of Curatella americana L. leaves. Oxidative Medicine and Cellular Longevity, v. 2016, p. 1-6, 2016. LORENZI, H. 1949. \u00c1rvores brasileiras: manual de identifica\u00e7\u00e3o e cultivo de plantas arb\u00f3reas do Brasil, 4. ed., Nona Odessa, SP: Instituto Plantarum, 2002. p. 111. MENEZES FILHO, A. C. P.; CASTRO, C. F. S. Identifica\u00e7\u00e3o das classes metab\u00f3licas secund\u00e1rias em extratos etan\u00f3licos foliares de Byrsonima verbascifolia, Cardiopetalum calophyllum, Curatela americana e Qualea grandiflora. Colloquium Agrariae, v. 15, n. 4, p. 39-50, 2019. PASCOTTO, M. C.; CATEN, H. T.; DE OLIVEIRA, J. P. F. Birds as potential seed dispersers of Curatella americana L. (Dilleniaceae) in the Brazilian Cerrado. Ornitologia Neotropical, v. 23, p. 585-595, 2012. PEREIRA, I. M.; GOMES-KLEIN, V. L. Taxonomia e ecologia da Fam\u00edlia Dilleniaceae nos estados de Goi\u00e1s e Tocantins. Revista Brasileira de Bioci\u00eancias, v. 5, supl. 2, p. 975-977, 2007. PURIFICA\u00c7\u00c3O, K. N.; PASCOTTO, M. C. Frugivoria por aves em Curatella americana L. (Dilleniaceae) em uma \u00e1rea do Cerrado no Leste de Mato Grosso, Brasil. South American Journal of Basic Education, Technical and Technological, v. 6, n. 2, p. 208-217, 2019. QUEIROZ, K. A.; DE SOUSA, F. F. O. Avalia\u00e7\u00e3o da estabilidade de gel cremoso contendo extrato de Curatella americana. In: Ci\u00eancias da Sa\u00fade: Resultados dos projetos de inicia\u00e7\u00e3o cient\u00edfica da Universidade Federal do Amap\u00e1, p. 19-39, (2012-2016), 2017. RESENDE, R. O.; PINHO, F. E. C. Estudo da esp\u00e9cie Curatella americana L \u2013 (Lixeira) utilizada como bioindicador em regi\u00e3o aur\u00edfera do distrito de Cangas-Pocon\u00e9-MT. Revista de Biologia e Ci\u00eancias da Terra, v. 11, n. 2, p. 48-63, 2011. SILVA-MORAES, H. G.; CORDEIRO, I.; FIGUEIREDO, N. Flora and floristic affinities of the Cerrados of Maranh\u00e3o state, Brazil. Edinburgh Journal of Botany, v. 76, n. 1, p. 1-21, 2019. TEIXEIRA, J. V.; RIBEIRO, R. N.; DAUD, R. D. Mites on Curatella americana L. (Dilleniaceae) from Cerrado vegetation remnants in mining site vicinities. International Journal of Acarology, v. 43, n. 4, p. 302-307, 2017. VILAR, J. B.; DE ANDRADE, L. S.; LEITE, K. R.; FERREIRA, H. D.; CHEN, L. C. Assessment of genotoxicity and cytotoxicity of \u201c lixeira\u201d (Curatella americana L.) using the prophage \u03bb induction test (SOS inductest). Brazilian Journal of Pharmaceutical Sciences, v. 45, n. 3, p. 491-496, 2009. ."}